1 ^ Beátus vìr qụi non abívit in consìlio impiórum, et in via peccatórum non stètit, et in catédra pestilènṭiae non sêdit, 
2 ^ sed in leǧe Dòmini volùntas ejus, et in leǧe ejus meditábitur die ac nòcte. 
3 ^ Et èrit tamqụam lìgnum qụod plantátum est sècus decùrsûs aqụárum, qụod fructum suum dabit in tèmpore suo, et fólium ejus non défluet. Et òmnia qụaecùmqụe fáčiet prosperabùntur. 
4 ^ Non sic ìmpii, non sic~; sed tamqụam pùlvis qụem prójicit vèntus a fáčie terrae. 
5 ^ Ìdeo non resùrǧent ìmpii in judìcio, nèqụe peccatóres in concìlio justórum~; 
6 ^ qụóniam novit Dòminus viam justórum, et ìter impiórum períbit. 
