1 ^ ¿~Qüare fremuérunt ğèntes, et pòpuli meditáti sunt inánia~? 
2 ^ Astitérunt reğes terrae, et prínçipes convenérunt in unum advèrsus Dòminum, et advèrsus christum ejus. 
3 ^ «~Dirumpámus vìncula eórum, et projiçiámus a nobîs jugum ipsórum.~»
4 ^ Qüi hábitat in çaelîs irridébit eos, et Dòminus subsannábit eos. 
5 ^ Tunc loqüétur ad eos in ira sua, et in furóre suo conturbábit eos. 
6 ^ «~Ego autem constitútus sum rex ab eo super Siónem, mòntem sanctum ejus, práedicans praeçèptum ejus.~»
7 ^ Dòminus dixit ad me, «~Fílius meus es tu, ego hódie ğènui te. 
8 ^ Póstula a me, et dabo tìbi ğèntes hereditátem tuam, et possessiónem tuam tèrminos terrae. 
9 ^ Règes eos in vìrga fèrrea, et tàmqüam vas fìguli confrìnges eos.~»
10 ^ Et nunc, reğes, intellègite~; erudímini, qüi judicátis terram. 
11 ^ Servíte Dòmino in timóre, et exsultáte ei cum tremóre. 
12 ^ Apprehèndite disçiplínam, neqüándo irascátur Dòminus, et periátis de via justa. 
13 ^ Qüum exárserit in brèvi ira ejus, beáti òmnes qüi confídunt in eo. 
