1 ^ ¿~Qụare fremuérunt ģèntes, et pòpuli meditáti sunt inánia~? 
2 ^ Astitérunt reģes terraĕ, et príncipes convenérunt in unum advèrsus Dòminum, et advèrsus christum ejus. 
3 ^ «~Dirumpámus vìncula eórum, et projiciámus a nobîs jugum ipsórum.~»
4 ^ Qụi hábitat in caĕlîs irridébit eos, et Dòminus subsannábit eos. 
5 ^ Tunc loqụétur ad eos in ira sua, et in furóre suo conturbábit eos. 
6 ^ «~Ego aŭtem constitútus sum rex ab eo super Siónem, mòntem sanctum ejus, práĕdicans praĕcèptum ejus.~»
7 ^ Dòminus dixit ad me, «~Fílius meus es tu, ego hódie ģènui te. 
8 ^ Póstula a me, et dabo tìbi ģèntes hereditátem tuam, et possessiónem tuam tèrminos terraĕ. 
9 ^ Rèģes eos in vìrga fèrrea, et tamqụam vas fìguli confrìnģes eos.~»
10 ^ Et nunc, reģes, intellèģite~; erudímini, qụi judicátis terram. 
11 ^ Servíte Dòmino in timóre, et exsultáte ei cum tremóre. 
12 ^ Apprehèndite disciplínam, neqụándo irascátur Dòminus, et periátis de via justa. 
13 ^ Qụum exárserit in brèvi ira ejus, beáti òmnes qụi confídunt in eo. 
