2 ^ Dòmine, ¿~qüid multiplicáti sunt qüi trìbulant me~? Mùlti insùrgunt advèrsum me. 
3 ^ Mùlti dicunt ànimae meae, «~Non est sàlûs ìpsi in Deo ejus.~» 
4 ^ Tu autem, Dòmine, susçèptor meus es, glória mea, et exáltans caput meum. 
5 ^ Voçe mea ad Dòminum clamávi, et exaudívit me de mònte sancto suo. 
6 ^ Ego dormívi et soporátus sum, et exsurréxi, qüia Dòminus susçépit me. 
7 ^ Non timébo mìllia pòpuli çircumdàntîs me. Exsùrge Dòmine~; sàlvum me fac Deus meus. 
8 ^ Qüóniam tu percussìsti òmnes adversàntes mìhi sine causa~; dèntes peccatórum contrivìsti. 
9 ^ Dòmini est sàlûs, et super pòpulum tuum benedìczio tua. 
