2 ^ Dòmine, ¿~cvid multiplicáti sunt cvi trìbulant me~? Mùlti insùrǧunt advèrsum me. 
3 ^ Mùlti dicunt ánimae meae, «~Non est salûs ìpsi in Deo ejus.~» 
4 ^ Tu autem, Dòmine, suscèptor meus es, glória mea, et exáltans caput meum. 
5 ^ Voce mea ad Dòminum clamávi, et exaudívit me de mònte sancto suo. 
6 ^ Ego dormívi et soporátus sum, et exsurréxi, cvia Dòminus suscépit me. 
7 ^ Non timébo mìllia pòpuli circumdántîs me. Exsùrǧe Dòmine~; salvum me fac Deus meus. 
8 ^ Cvóniam tu percussìsti òmnes adversántes mìchi sine causa~; dèntes peccatórum contrivìsti. 
9 ^ Dòmini est salûs, et super pòpulum tuum benedìcṭio tua. 
