2 ^ Cvum invocárem exaudívit me Deus justìṭiae meae, in tribulaṭióne dilatavìsti mìchi. Miserére mei, et exáudi oraṭiónem meam. 
3 ^ ¿~Fílii hòminum úscvecvo gravi corde~? Ut cvid dilìǧitis vanitátem, et cváeritis mendácium~? 
4 ^ Et scitóte cvóniam mirificávit Dòminus sanctum suum~; Dòminus exáudiet me cvum clamávero ad eum. 
5 ^ Irascìmini, et nolíte peccáre~; cvae dícitis in córdibus vèstrîs, in cubílibus vèstrîs compunǧìmini. 
6 ^ Sacrificáte sacrifìcium justìṭiae, et speráte in Dòmino. 
7 ^ Mùlti dicunt, «~¿~Cvìs ostèndit nobîs bona~?~». Signátum est super nos lumen vùltûs tui, Dòmine. 
8 ^ Dedìsti laetìṭiam in corde meo~; a fructu frumènti, vini, et ólei sui, multiplicáti sunt. 
9 ^ In pace in idìpsum dórmiem et recviéscem, cvóniam tu, Dòmine, singuláriter in spe constituvìsti me. 
