2 ^ Qüum invocárem exaudívit me Deus justìziae meae, in tribulazióne dilatavìsti mìhi. Miserére mei, et exáudi oraziónem meam. 
3 ^ ¿~Fílii hòminum úsqüeqüo gravi corde~? Ut qüid dilìgitis vanitátem, et qüáeritis mendáçium~? 
4 ^ Et scitóte qüóniam mirificávit Dòminus sanctum suum~; Dòminus exáudiet me qüum clamávero ad eum. 
5 ^ Irascìmini, et nolíte peccáre~; qüae dícitis in córdibus vèstrîs, in cubílibus vèstrîs compungìmini. 
6 ^ Sacrificáte sacrifìçium justìziae, et speráte in Dòmino. 
7 ^ Mùlti dicunt, «~¿~Qüìs ostèndit nobîs bona~?~». Signátum est super nos lumen vùltûs tui, Dòmine. 
8 ^ Dedìsti laetìziam in corde meo~; a fructu frumènti, vini, et ólei sui, multiplicáti sunt. 
9 ^ In paçe in idìpsum dórmiem et reqüiéscem, qüóniam tu, Dòmine, singuláriter in spe constituvìsti me. 
