2 ^ Vèrba mea áŭribus pèrcipe, Dòmine~; intèlleǧe clamórem meum. ^ Give ear to my words, O Lord~; understand my cry.
3 ^ Intènde voci orațiónis meaĕ, rex meus et Deus meus. ^ Hearken to the voice of my prayer, O my King and my God.
4 ^ Qŭóniam ad te orábo, Dòmine~; mane exáŭdies vocem meam. ^ For to thee will I pray, O Lord~; in the morning thou shalt hear my voice.
5 ^ Mane astábo tìbi et vedébo, qŭóniam non Deus volens iniqŭitátem tu es. ^ In the morning I will stand before thee, and I will see, because thou art not a God that willest iniquity.
6 ^ Nèqŭe habitábit juxta te malìgnus, nèqŭe permanébunt injústi ante òculos tuos. ^ Neither shall the wicked dwell near thee, nor shall the unjust abide before thy eyes.
7 ^ Odìsti òmnes qŭi operántur iniqŭitátem~; pèrdes òmnes, qŭi loqŭùntur mendácium. Vìrum sángŭinum et dolósum abominábitur Dòminus. ^ Thou hatest all the workers of iniquity~; thou wilt destroy all that speak a lie. The bloody and the deceitful man the Lord will abhor.
8 ^ Ego aŭtem in multitúdine misericórdiaĕ tuaĕ, introíbo in domum tuam~; adorábo ad templum sanctum tuum in timóre tuo. ^ But as for me in the multitude of thy mercy, I will come into thy house~; I will worship towards thy holy temple, in thy fear.
9 ^ Dòmine, dedúce me in justìția tua~; pròpter inimícos meos díriǧe in conspèctu tuo viam meam. ^ Conduct me, O Lord, in thy justice~; because of my enemies direct my way in thy sight.
10 ^ Qŭóniam non est in ore eórum vèritas~; cor eórum vanum est. ^ For there is no truth in their mouth~; their heart is vain.
11 ^ Sepùlcrum patens est guttur eórum~; lingŭîs suîs dolóse aǧébant~; júdica illos, Deus. Décidant a coǧitațiónibus suîs~; secùndum multitúdinem impietátum eórum expèlle eos, qŭóniam irritavérunt te, Dòmine. ^ Their throat is an open sepulchre~; they dealt deceitfully with their tongues~; judge them, O God. Let them fall from their devices~; according to the multitude of their wickednesses cast them out, for they have provoked thee, O Lord.
12 ^ Et laĕtèntur òmnes qŭi sperant in te~; in aĕtèrnum exsultábunt, et habitábis in eîs. Et gloriabùntur in te òmnes qŭi díliǧunt nomen tuum, ^ But let all them be glad that hope in thee~; they shall rejoice for ever, and thou shalt dwell in them. And all they that love thy name shall glory in thee,
13 ^ qŭóniam tu benedíces justo. Dòmine, ut scuto bonaĕ voluntátis tuaĕ coronavìsti nos. ^ for thou wilt bless the just. O Lord, thou hast crowned us as with a shield of thy good will.
