2 ^ Dòmine, ne in furóre tuo árguas me, nèqŭe in ira tua corrìpias me. ^ O Lord, rebuke me not in thy indignation, nor chastise me in thy wrath.
3 ^ Miserére mei, Dòmine, qŭóniam infìrmus sùm~; sana me, Dòmine, qŭóniam conturbáta sùnt òssua mea. ^ Have mercy on me, O Lord, for I am weak~; heal me, O Lord, for my bones are troubled.
4 ^ Et ánima mea turbáta èst valde~; ¿~sed tu, Dòmine, úsquequo~? ^ And my soul is troubled exceedingly~; but thou, O Lord, how long~?
5 ^ Convèrtere, Dòmine, et éripe ánimam meam~; salvum me fac pròpter misericórdiam tuam. ^ Turn to me, O Lord, and deliver my soul~; O save me for thy mercy's sake.
6 ^ Qŭóniam non èst in morte qŭi mèmor sit tui~; ¿~in infèrno aŭtem qŭìs confitébitur tìbi~? ^ For there is no one in death, that is mindful of thee~; and who shall confess to thee in hell~?
7 ^ Laborávi in gèmitu meo, lavábo per sìngulas nòctes lettum meum~; lácrimîs meîs stratum meum rigábo. ^ I have laboured in my groanings, every night I will wash my bed~; I will water my couch with my tears.
8 ^ Turbátus èst a furóre òculus meus~; inveterávi inter òmnes inimícos meos. ^ My eye is troubled through indignation~; I have grown old amongst all my enemies.
9 ^ Discédite a me òmnes qŭi operámini iniqŭitátem, qŭóniam exaŭdívit Dòminus vocem fletûs mei. ^ Depart from me, all ye workers of iniquity, for the Lord hath heard the voice of my weeping.
10 ^ Exaŭdívit Dòminus deprecatiónem meam~; Dòminus oratiónem meam suscépit. ^ The Lord hath heard my supplication~; the Lord hath received my prayer.
11 ^ Erubéscant et conturbèntur vehemènter, òmnes inimíci mei~; convertántur et erubéscant valde velóciter. ^ Let all my enemies be ashamed, and be very much troubled~; let them be turned back, and be ashamed very speedily.
