2 ^ Dòmine, Deus meus, in te sperávi~; sàlvum me fac ex òmnibus perseqüèntibus me, et líbera me, 
3 ^ neqüándo rápiat ut leo ànimam meam, dum non est qüi rèdimat, nèqüe qüi sàlvum fàçiat. 
4 ^ Dòmine Deus meus, si feçi ìstud, si est iníqüitas in mànibus meîs, 
5 ^ si rèddidi retribuèntibus mìhi màla, déçidam mèrite ab inimícîs meîs inánis. 
6 ^ Perseqüátur inimícus ànimam meam, et comprehèndat, et concùlcet in terra vitam meam, et glóriam meam in pùlverem dedúcat. 
7 ^ Exsùrge, Dòmine, in ira tua~; exaltáre in fínibus inimicórum meórum, et exsùrge, Dòmine Deus meus, in praeçèpto qüod mandavìsti. 
8 ^ Et synagóga populórum çircùmdabit te, et pròpter hanc in altum regrèdere. 
9 ^ Dòminus júdicat pòpulos. Júdica me, Dòmine, secùndum justìziam meam, et secùndum innoçènziam meam super me. 
10 ^ Consumétur neqüìzia peccatórum, et díriges justum, scrutans corda et renes Deus. 
11 ^ Justum adjutórium meum a Dòmino, qüi sàlvos fàçit rectos corde. 
12 ^ Deus judex justus, fortis, et pàziens~; ¿~numqüid iráscitur per sìngulos dies~? 
13 ^ Nisi fuèritis convèrsi, glàdium suum vibrábit~; arcum suum tetèndit, et parávit illum. 
14 ^ Et in eo parávit vasa mortis, sağìttas suas ardèntibus efféçit. 
15 ^ Ecçe parturívit injustìziam~; conçépit dolórem, et pèperit iniqüitátem. 
16 ^ Lacum apèruit, et effódit eum, et inçiduit in fóveam, qüam feçit. 
17 ^ Convertétur dolor ejus in caput ejus, et in vèrtiçem ìpsius iníqüitas ejus desçèndet. 
18 ^ Confitébor Dòmino secùndum justìziam ejus, et psallem nómini Dòmini altìssimi. 
