2 ^ Dòmine, Deus meus, in te sperávi~; sàlvum me fac ex òmnibus persequèntibus me, et líbera me, 
3 ^ nequándo rápiat ut leo ànimam meam, dum non est qui rèdimat, nèque qui sàlvum fàčiat. 
4 ^ Dòmine Deus meus, si feči ìstud, si est iníquitas in mànibus meïs, 
5 ^ si rèddidi retribuèntibus mìhi màla, déčidam mèrite ab inimícïs meïs inánis. 
6 ^ Persequátur inimícus ànimam meam, et comprehèndat, et concùlcet in terra vitam meam, et glóriam meam in pùlverem dedúcat. 
7 ^ Exsùrge, Dòmine, in ira tua~; exaltáre in fínibus inimicórum meórum, et exsùrge, Dòmine Deus meus, in praečèpto quod mandavìsti. 
8 ^ Et synagóga populórum čircùmdabit te, et pròpter hanc in altum regrèdere. 
9 ^ Dòminus júdicat pòpulos. Júdica me, Dòmine, secùndum justìțiam meam, et secùndum innočènțiam meam super me. 
10 ^ Consumétur nequìția peccatórum, et díriges justum, scrutans corda et renes Deus. 
11 ^ Justum adjutórium meum a Dòmino, qui sàlvos fàčit rectos corde. 
12 ^ Deus judex justus, fortis, et pàziens~; ¿~numquid iráscitur per sìngulos dies~? 
13 ^ Nisi fuèritis convèrsi, glàdium suum vibrábit~; arcum suum tetèndit, et parávit illum. 
14 ^ Et in eo parávit vasa mortis, saǧìttas suas ardèntibus efféčit. 
15 ^ Ecče parturívit injustìțiam~; cončépit dolórem, et pèperit iniquitátem. 
16 ^ Lacum apèruit, et effódit eum, et inčiduit in fóveam, quam fečit. 
17 ^ Convertétur dolor ejus in caput ejus, et in vèrtičem ìpsius iníquitas ejus desčèndet. 
18 ^ Confitébor Dòmino secùndum justìțiam ejus, et psallem nómini Dòmini altìssimi. 
