2 ^ Dòmine Deus meus, in te sperávi~; salvum me fac ex òmnibus perseqụèntibus me, et líbera me, 
3 ^ neqụándo rápiat ut leo ánimam meam, dum non est qụi rèdimat, nèqụe qụi salvum fáçiat. 
4 ^ Dòmine Deus meus, si feci ìstud, si est iníqụitas in mánibus meîs, 
5 ^ si rèddidi retribuèntibus mìchi mala, décadam mèrite ab inimícîs meîs inánis. 
6 ^ Perseqụátur inimícus ánimam meam, et comprehèndat, et concùlcet in terra vitam meam, et glóriam meam in pùlverem dedúcat. 
7 ^ Exsùrģe, Dòmine, in ira tua~; exaltáre in fínibus inimicórum meórum, et exsùrģe, Dòmine Deus meus, in praĕcèpto qụod mandavìsti. 
8 ^ Et sinagóga populórum circùmdabit te, et pròpter hanc in altum regrèdere. 
9 ^ Dòminus júdicat pòpulos. Júdica me, Dòmine, secùndum justìțiam meam, et secùndum innocènțiam meam super me. 
10 ^ Consumétur neqụìția peccatórum, et díriģes justum, scrutans corda et renes Deus. 
11 ^ Justum adjutórium meum a Dòmino, qụi salvos façit rectos corde. 
12 ^ Deus judex justus, fortis, et páțiens~; ¿~numqụid iráscitur per sìngulos dies~? 
13 ^ Nisi fuèritis convèrsi, gládium suum vibrábit~; arcum suum tetèndit, et parávit illum. 
14 ^ Et in eo parávit vasa mortis, saģìttas suas ardèntibus effécit. 
15 ^ Ecce parturívit injustìțiam~; concépit dolórem, et pèperit iniqụitátem. 
16 ^ Lacum apèruit, et effódit eum, et incáduit in fóveam, qụam fecit. 
17 ^ Convertétur dolor ejus in caput ejus, et in vèrticem ìpsius iníqụitas ejus descèndet. 
18 ^ Confitébor Dòmino secùndum justìțiam ejus, et psallem nómini Dòmini altìssimi. 
