2 ^ Dòmine, Dòminus noster, qụam admirábile est nomen tuum in univèrsa terra, qụóniam eleváta est magnificènṭia tua super caelos. 
3 ^ Èx ore infántium et lactèntium perfecìsti laudem pròpter inimícos tuos, ut déstruas inimícum et ultórem. 
4 ^ Qụóniam vedébo caelos tuos, ópera diģitórum tuórum, lunam et stellas qụae tu fundavìsti. 
3 ^ Èx ore infántium et lactèntium perfecìsti laudem pròpter inimícos tuos, ut déstruas inimícum et ultórem. 
4 ^ Qụóniam vedébo caelos tuos, ópera diģitórum tuórum, lunam et stellas qụae tu fundavìsti. 
5 ^ ¿~Qụid est hòmo, qụod mèmor es ejus, aut fílius hòminis, qụóniam vísitas eum~? 
6 ^ Minuvìsti eum paulo mìnus ab ánģelîs~; glória et honóre coronavìsti eum, 
7 ^ et constituvìsti eum super ópera mánuum tuárum. 
8 ^ Òmnia subjecìsti sub pèdibus ejus, oves et boves univèrsas, ìnsuper et pècora campi, 
9 ^ vulácres caeli, et pìsces maris qụi perámbulant sémitas maris. 
10 ^ Dòmine, Dòminus noster, qụam admirábile est nomen tuum in univèrsa terra. 
