2 ^ In Dòmino confído~; ¿~cvómodo dícitis ánimae meae, «~Tránsmigra in mòntem sicut passer~»~? 
3 ^ Cvóniam ecce peccatóres intendérunt arcum~; paravérunt saǧìttas suas in farétra, ut saǧìttent in obscúro rectos corde. 
4 ^ Cvóniam cvae perfecìsti, destruxérunt~; ¿~justus autem, cvid fecit~? 
5 ^ Dòminus in templo sancto suo~; Dòminus in caelo sedis ejus. Òculi ejus in páuperem respìciunt~; palpébrae ejus intèrrogant fílios hòminum. 
6 ^ Dòminus intèrrogat justum et ìmpium~; cvi autem díliǧit inicvitátem, odit ánimam suam. 
7 ^ Pluet super peccatóres lácveos~; ìgnis et sùlfur, et spíritûs procellárum, pars cálicis eórum. 
8 ^ Cvóniam justus Dòminus, et justìṭias diléxit~; aecvitátem vîdit vùltus ejus. 
