2 ^ Salvum me fac, Dòmine, qụóniam defécit sanctus, qụóniam diminútaĕ sunt veritátes a fíliîs hòminum. 
3 ^ Vana locúti sunt unusqụìsqụe ad pròximum suum~; lábia dolósa, in corde et corde locúti sunt. 
4 ^ Dispèrdat Dòminus univèrsa lábia dolósa, et lìngụam magnìloqụam. 
5 ^ Qụi dixérunt, «~Lìngụam nostram magnificábimus~; lábia nostra a nobîs sunt. ¿~Qụìs noster Dòminus est~?~». 
6 ^ «~Pròpter misèriam ìnopum, et ģèmitum páŭperum, nunc exsùrģem~», dicit Dòminus; «~Ponem in salutári~; fiduciáliter aģam in eo.~» 
7 ^ Elóqụia Dòmini, elóqụia casta~; arģèntum ìgne examinátum, probátum terraĕ, purgátum septùplum. 
8 ^ Tu, Dòmine, servábis nos, et custódies nos a ģenerațióne hac in aĕtèrnum. 
9 ^ In circùmitu ìmpii ámbulant~; secùndum altitúdinem tuam multiplicavìsti fílios hòminum. 
