2 ^ Salvum me fac, Dòmine, qvóniam defécit sanctus, qvóniam diminútae sunt veritátes a fíliîs hòminum. 
3 ^ Vana locúti sunt unusqvìsqve ad pròximum suum~; lábia dolósa, in corde et corde locúti sunt. 
4 ^ Dispèrdat Dòminus univèrsa lábia dolósa, et lìngvam magnìloqvam. 
5 ^ Qvi dixérunt, «~Lìngvam nostram magnificábimus~; lábia nostra a nobîs sunt. ¿~Qvìs noster Dòminus est~?~». 
6 ^ «~Pròpter misèriam ìnopum, et gèmitum páuperum, nunc exsùrgem~», dicit Dòminus; «~Ponem in salutári~; fiduciáliter agam in eo.~» 
7 ^ Elóqvia Dòmini, elóqvia casta~; argèntum ìgne examinátum, probátum terrae, purgátum septùplum. 
8 ^ Tu, Dòmine, servábis nos, et custódies nos a generazióne hac in aetèrnum. 
9 ^ In circùmitu ìmpii ámbulant~; secùndum altitúdinem tuam multiplicavìsti fílios hòminum. 
