1 ^ Dixit insápiens in corde suo, «~Non est Deus~». Corrùpti sunt, et abominábiles facti sunt in stúdiîs suîs~; non est qụi fáçiat bonum, non est usqụe ad unum. 
2 ^ Dòminus de caelo prospèxit super fílios hòminum, ut vèdeat si est intèlleģens, aut reqụírens Deum. 
3 ^ Òmnes declinavérunt, sìmul inútiles facti sunt. Non est qụi fáçiat bonum, non est usqụe ad unum. 
4 ^ ¿~Nonne cognóscent òmnes qụi operántur iniqụitátem, qụi dévorant plebem meam sicut escam panis~? 
5 ^ Dòminum non invocavérunt~; illic trepidavérunt timóre, ubi non èrat tìmor. 
6 ^ Qụóniam Dòminus in ģeneraṭióne justa est~; consìlium ìnopis confudìstis, qụóniam Dòminus spes ejus est. 
7 ^ ¿~Qụìs dabit ex Sióne salutáre Israhélis~? Qụum avèrterit Dòminus captivitátem plebis suae, exsultábit Jacob, et laetábitur Isráhel. 
