2 ^ Çaeli enárrant glóriam Dei, et ópera mànuum ejus adnúnziat firmamèntum. 
3 ^ Dies diéi erúctat vèrbum, et nòx nòcti ìndicat sciènziam. 
4 ^ Non sunt loqüélae, nèqüe sermónes, qüórum non audiàntur voçes eórum. 
5 ^ In òmnem terram exívit sonus eórum, et in fines orbis terrae vèrba eórum. 
6 ^ In sole pósuit tabernáculum suum, et ìpse tàmqüam sponsus proçédens de thàlamo suo. Exsultávit ut ğìgas ad currèndam viam. 
7 ^ A summo çaelo egrèssio ejus, et occùrsus ejus usqüe ad summum ejus, nec est qüi se abscòndat a calóre ejus. 
8 ^ Lex Dòmini immaculáta convèrtens ànimas~; testimónium Dòmini fidéle, sapiènziam praestans párvulîs. 
9 ^ Justìziae Dòmini rectae, laetificàntes corda~; praeçèptum Dòmini lúçidum, illúminans òculos. 
10 ^ Tìmor Dòmini sanctus, pèrmanens in sáeculum sáeculi~; judìçia Dòmini vera, justificáta in semet ìpsa. 
11 ^ Desiderabìlia super aurum et lápidem preziósum mùltum, et dulçióra super mel et favum. 
12 ^ Ètenim sèrvus tuus custódit ea~; in custodièndîs illîs retribúzio mùlta. 
13 ^ ¿~Delìcta qüìs intèllegit~? Ab occùltîs meîs mùnda me, 
14 ^ et ab aliénîs parce servo tuo. Si mei non fúerint domináti, tunc immaculátus èro, et emundábor a delìcto maximo. 
15 ^ Et èrunt ut complàçeant elóqüia oris mei, et meditázio cordis mei in conspèctu tuo sèmper. Dòmine adjútor meus, et redèmptor meus. 
