2 ^ Caeli enárrant glóriam Dei, et ópera mánuum ejus adnúnṭiat firmamèntum. 
3 ^ Dies diéi erúctat vèrbum, et nòx nòcti ìndicat sciènṭiam. 
4 ^ Non sunt loqụélae, nèqụe sermónes, qụórum non audiántur voces eórum. 
5 ^ In òmnem terram exívit sonus eórum, et in fines orbis terrae vèrba eórum. 
6 ^ In sole pósuit tabernáculum suum, et ìpse tamqụam sponsus procédens de tálamo suo. Exsultávit ut ģigas ad currèndam viam. 
7 ^ A summo caelo egrèssio ejus, et occùrsus ejus usqụe ad summum ejus, nec est qụi se abscòndat a calóre ejus. 
8 ^ Lex Dòmini immaculáta convèrtens ánimas~; testimónium Dòmini fidéle, sapiènṭiam praestans párvulîs. 
9 ^ Justìṭiae Dòmini rectae, laetificántes corda~; praecèptum Dòmini lúcidum, illúminans òculos. 
10 ^ Tìmor Dòmini sanctus, pèrmanens in sáeculum sáeculi~; judìcia Dòmini vera, justificáta in semet ìpsa. 
11 ^ Desiderabìlia super aurum et lápidem preṭiósum mùltum, et dulcióra super mel et favum. 
12 ^ Ètenim sèrvus tuus custódit ea~; in custodièndîs illîs retribúṭio mùlta. 
13 ^ ¿~Delìcta qụìs intèlleģit~? Ab occùltîs meîs mùnda me, 
14 ^ et ab aliénîs parce servo tuo. Si mei non fúerint domináti, tunc immaculátus èro, et emundábor a delìcto maximo. 
15 ^ Et èrunt ut compláceant elóqụia oris mei, et meditáṭio cordis mei in conspèctu tuo sèmper. Dòmine adjútor meus, et redèmptor meus. 
