2 ^ Deus, Deus meus, rèspice in me~; ¿~qvare me dereliqvìsti~? Longe a salúte mea vèrba delictórum meórum. 
3 ^ Deus meus clamábo per diem, et non exáudies, et nòcte, et non ad insapiènziam mìhi. 
4 ^ Tu autem in sancto hábitas, laus Israhélis. 
5 ^ In te speravérunt patres nostri~; speravérunt, et liberavìsti eos. 
6 ^ Ad te clamavérunt, et salvi facti sunt~; in te speravérunt, et non sunt confúsi. 
7 ^ Ego autem sum vermis, et non hòmo~; oppróbrium hòminum, et abjèczio plebis. 
8 ^ Òmnes vedèntes me, derisérunt me~; locúti sunt lábiîs, et movérunt caput. 
9 ^ Sperávit in Dòmino, erìpiat eum~; salvum fáciat eum, qvóniam vùlt eum. 
10 ^ Qvóniam tu es qvi extraxìsti me de vèntre~; spes mea ab ubèribus matris meae. 
11 ^ In te projèctus sum ex útero~; de vèntre matris meae Deus meus es tu~; 
12 ^ ne discèsserîs a me, qvóniam tribulázio pròxima est, qvóniam non est qvi ádjuvet. 
13 ^ Circumdedérunt me vìtuli mùlti~; tauri pingves obsedérunt me. 
14 ^ Aperuérunt super me os suum, sicut leo rápiens et rúgiens. 
15 ^ sicut aqva effúsus sum, et dispèrsa sunt òmnia òssua mea. Factum est cor meum tamqvam cera liqvéscens in mèdio vèntris mei. 
16 ^ Áruit tamqvam tèsta vìrtûs mea, et lìngva mea adháesit fáucibus meîs, et in pùlverem mortis deduxìsti me. 
17 ^ Qvóniam circumdedérunt me canes mùlti~; concìlium malignántium obsédit me. Fodérunt manûs meas et pèdes meos~; 
18 ^ dinumeravérunt òmnia òssua mea. Ìpsi vero consideravérunt et inspexérunt me. 
19 ^ Divisérunt sìbi vestimènta mea, et super vestem meam misérunt sortem. 
20 ^ Tu autem Dòmine ne elongáverîs auxìlium tuum a me~; ad defensiónem meam cònspice. 
21 ^ Érue a frámea, Deus, ánimam meam, et de manu canis únicam meam. 
22 ^ Salva me ex ore leónis, et a córnibus unicórnium humilitátem meam. 
23 ^ Narrábo nomen tuum frátribus meîs~; in mèdio ecclésiae laudábo te. 
24 ^ Qvi timétis Dòminum laudáte eum~; univèrsum semen Jacóbi glorificáte eum~; tìmeat eum omne semen Israhélis, 
25 ^ qvóniam non sprevit, nèqve despèxit deprecaziónem páuperis, nec avèrtit fáciem suam a me, et qvum clamárem ad eum exaudívit me. 
26 ^ Apud te laus mea in ecclésia magna~; vota mea reddem in conspèctu timèntium eum. 
27 ^ Edent páuperes, et saturabùntur, et laudábunt Dòminum qvi reqvírunt eum~; vivent corda eórum in sáeculum sáeculi. 
28 ^ Reminiscèntur et convertèntur ad Dòminum univèrsi fines terrae, et adorábunt in conspèctu ejus univèrsae famíliae gèntium. 
29 ^ Qvóniam Dòmini est regnum, et ìpse dominábitur gèntium. 
30 ^ Manducavérunt et adoravérunt òmnes pingves terrae~; in conspèctu ejus cadent òmnes qvi descèndunt in terram. 
31 ^ Et ánima mea illi vivet, et semen meum sèrviet ìpsi. 
32 ^ Adnunziábitur Dòmino generázio ventúra, et adnunziábunt caeli justìziam ejus pòpulo qvi nascétur, qvem fecit Dòminus. 
