2 ^ Deus, Deus meus, rèspiče in me~; ¿~qụare me dereliqụìsti~? Longe a salúte mea vèrba delictórum meórum. 
3 ^ Deus meus clamábo per diem, et non exáudies, et nòcte, et non ad insapiènṭiam mìchi. 
4 ^ Tu autem in sancto hábitas, laus Israhélis. 
5 ^ In te speravérunt patres nostri~; speravérunt, et liberavìsti eos. 
6 ^ Ad te clamavérunt, et salvi facti sunt~; in te speravérunt, et non sunt confúsi. 
7 ^ Ego autem sum vermis, et non hòmo~; oppróbrium hòminum, et abjècṭio plebis. 
8 ^ Òmnes vedèntes me, derisérunt me~; locúti sunt lábiîs, et movérunt caput. 
9 ^ Sperávit in Dòmino, erìpiat eum~; salvum fáčiat eum, qụóniam vùlt eum. 
10 ^ Qụóniam tu es qụi extraxìsti me de vèntre~; spes mea ab ubèribus matris meae. 
11 ^ In te projèctus sum ex útero~; de vèntre matris meae Deus meus es tu~; 
12 ^ ne discèsserîs a me, qụóniam tribüláṭio pròxima est, qụóniam non est qụi ádjuvet. 
13 ^ Circumdedérunt me vìtuli mùlti~; tauri pingves obsedérunt me. 
14 ^ Aperuérunt super me os suum, sicut leo rápiens et rúǧiens. 
15 ^ sicut aqụa effúsus sum, et dispèrsa sunt òmnia òssua mea. Factum est cor meum tamqụam cera liqụéscens in mèdio vèntris mei. 
16 ^ Áruit tamqụam tèsta vìrtûs mea, et lìngva mea adháesit fáucibus meîs, et in pùlverem mortis deduxìsti me. 
17 ^ Qụóniam circumdedérunt me canes mùlti~; concìlium malignántium obsédit me. Fodérunt manûs meas et pèdes meos~; 
18 ^ dinumeravérunt òmnia òssua mea. Ìpsi vero consideravérunt et inspexérunt me. 
19 ^ Divisérunt sìbi vestimènta mea, et super vestem meam misérunt sortem. 
20 ^ Tu autem Dòmine ne elongáverîs auxìlium tuum a me~; ad defensiónem meam cònspiče. 
21 ^ Érue a frámea, Deus, ánimam meam, et de manu canis űnicam meam. 
22 ^ Salva me ex ore leónis, et a córnibus ünicórnium humilitátem meam. 
23 ^ Narrábo nomen tuum frátribus meîs~; in mèdio ecclésiae laudábo te. 
24 ^ Qụi timétis Dòminum laudáte eum~; ünivèrsum semen Jacóbis glorificáte eum~; tìmeat eum omne semen Israhélis, 
25 ^ qụóniam non sprevit, nèqụe despèxit deprecaṭiónem páuperis, nec avèrtit fáčiem suam a me, et qụum clamárem ad eum exaudívit me. 
26 ^ Apud te laus mea in ecclésia magna~; vota mea reddem in conspèctu timèntium eum. 
27 ^ Edent páuperes, et saturabùntur, et laudábunt Dòminum qụi reqụírunt eum~; vivent corda eórum in sáeculum sáeculi. 
28 ^ Reminiscèntur et convertèntur ad Dòminum ünivèrsi fines terrae, et adorábunt in conspèctu ejus ünivèrsae famíliae ǧèntium. 
29 ^ Qụóniam Dòmini est regnum, et ìpse dominábitur ǧèntium. 
30 ^ Manducavérunt et adoravérunt òmnes pingves terrae~; in conspèctu ejus cadent òmnes qụi descèndunt in terram. 
31 ^ Et ánima mea illi vivet, et semen meum sèrviet ìpsi. 
32 ^ Adnunṭiábitur Dòmino ǧeneráṭio ventúra, et adnunṭiábunt caeli justìṭiam ejus pòpulo qụi nascétur, qụem fečit Dòminus. 
