1 ^ Dòmini est terra, et plenitúdo ejus~; orbis terrárum, et ünivèrsi qvi hábitant in eo. 
2 ^ Qvia ìpse super mária fundávit eum, et super flúmina praeparávit eum. 
3 ^ ¿~Qvìs ascèndet in mòntem Dòmini~? ¿~Aut qvìs stabit in loco sancto ejus~? 
4 ^ ìnnocens mánibus et mùndo corde, qvi non accépit in vano ánimam suam, nec jurávit in dolo pròximo suo~; 
5 ^ hic accìpiet benedictiónem a Dòmino, et misericórdiam a Deo salutári suo. 
6 ^ Haec est ǧeneráṭio qvaerèntium eum, qvaerèntium fáciem Dei Jacóbis. 
7 ^ Attòllite portas, príncipes vèstri, et elevámini, portae aeternáles, et introíbit rex glóriae. 
8 ^ ¿~Qvìs est ìste rex glóriae~? Dòminus fortis et potens~; Dòminus potens in práelio. 
9 ^ Attòllite portas, príncipes vèstri, et elevámini, portae aeternáles, et introíbit rex glóriae. 
10 ^ ¿~Qvìs est ìste rex glóriae~? Dòminus virtútum ìpse est rex glóriae. 
