1 ^ Dòmini est terra, et plenitúdo ejus~; orbis terrárum, et univèrsi qui hábitant in eo. 
2 ^ Quia ìpse super mária fundávit eum, et super flúmina praeparávit eum. 
3 ^ ¿~Quìs asçèndet in mòntem Dòmini~? ¿~Aut quìs stabit in loco sancto ejus~? 
4 ^ ìnnoçens mánibus et mùndo corde, qui non acçépit in vano ánimam suam, nec jurávit in dolo pròximo suo~; 
5 ^ hic acçìpiet benedicziónem a Dòmino, et misericórdiam a Deo salutári suo. 
6 ^ Haec est generázio quaerèntium eum, quaerèntium fáçiem Dei Jacóbi. 
7 ^ Attòllite portas, prínçipes vèstri, et elevámini, portae aeternáles, et introíbit rex glóriae. 
8 ^ ¿~Quìs est ìste rex glóriae~? Dòminus fortis et potens~; Dòminus potens in práelio. 
9 ^ Attòllite portas, prínçipes vèstri, et elevámini, portae aeternáles, et introíbit rex glóriae. 
10 ^ ¿~Quìs est ìste rex glóriae~? Dòminus virtútum ìpse est rex glóriae. 
