1 ^ Ad te, Dòmine, levávi ánimam meam. 
2 ^ Deus meus, in te confído~; non erubéscam, 
3 ^ nèqve irrídeant me inimíci mei~; ètenim ünivèrsi qvi sùstinent te, non confundèntur. 
4 ^ Confundántur òmnes iníqva aǧèntes supervácue. Vias tuas Dòmine demònstra mìchi, et sémitas tuas édoce me. 
5 ^ Díriǧe me in veritáte tua, et dòce me, qvia tu es Deus salvátor meus, et te sustìnui tota die. 
6 ^ Reminíscere miseraçiónum tuárum, Dòmine, et misericordiárum tuárum qvae a sáeculo sunt. 
7 ^ Delìcta juventútis meae, et ignoránṭias meas ne memínerîs. Secùndum misericórdiam tuam memènto mei tu, pròpter bonitátem tuam, Dòmine. 
8 ^ Dulcis et rectus Dòminus~; pròpter hoc leǧem dabit delinqvèntibus in via. 
9 ^ Díriǧet mansuétos in judìcio~; docébit mites vias suas. 
10 ^ Ünivèrsae viae Dòmini, misericórdia et vèritas, reqvirèntibus testamèntum ejus et testimónia ejus. 
11 ^ Pròpter nomen tuum, Dòmine, propiṭiáberis peccáto meo~; mùltum est ènim. 
12 ^ ¿~Qvìs est hòmo qvi tìmet Dòminum~? Leǧem statúvit ei in via, qvam eléǧit. 
13 ^ Ánima ejus in bonîs demorábitur, et semen ejus hereditábit terram. 
14 ^ Firmamèntum est Dòminus timèntibus eum, et testamèntum ìpsius ut manifestétur illîs. 
15 ^ Òculi mei sèmper ad Dòminum, qvóniam ìpse evèllet de láqveo pèdes meos. 
16 ^ Rèspiçe in me, et miserére mei, qvia űnicus et pauper sum ego. 
17 ^ Tribülaçiónes cordis mei multiplicátae sunt~; de necessitátibus meîs érue me. 
18 ^ Vède humilitátem meam et labórem meum, et dimìtte ünivèrsa delìcta mea. 
19 ^ Rèspiçe inimícos meos, qvóniam multiplicáti sunt, et ódio iníqvo odérunt me. 
20 ^ Custódi ánimam meam, et érue me~; non erubéscam, qvóniam sperávi in te. 
21 ^ Innocèntes et recti adhaesérunt mìchi, qvia sustìnui te. 
22 ^ Líbera, Deus, Israhélem ex òmnibus tribülaçiónibus suîs. 
