1 ^ Ad tē, Domine, levāvī animam meam. ^ To thee, O Lord, have I lifted up my soul.
2 ^ Deus meus, in tē confīdō~; nōn ērubēscam, ^ O my God, in thee have I put my trust~; let me not be ashamed,
3 ^ neque irrīdeant mē inimīcī meī~; etenim ūniversī quī sustinent tē, nōn confundentur. ^ neither let my enemies laugh at me~; for all who wait on thee, they shall not be confounded.
4 ^ Confundantur omnēs inīqua agentēs supervacuē. Viās tuās Domine dēmonstrā mihī, et sēmitās tuās ēdocē mē. ^ Let all them be confounded that act unjust things without cause. Thy ways, O Lord, show unto me, and teach me thy paths.
5 ^ Dīrige mē in vēritāte tuā, et docē mē, quia tū es Deus salvātor meus, et tē sustinuī tōtā diē. ^ Direct me in thy truth, and teach me, for thou art God my Saviour, and on thee have I waited all the day long.
6 ^ Reminīscere miserātiōnum tuārum, Domine, et misericordiārum tuārum quae ā saeculō sunt. ^ Remember thy bowels of compassion, O Lord. and thy mercies that are from the beginning of the world.
7 ^ Dēlicta juventūtis meae, et ignōrantiās meās nē meminerīs. Secundum misericordiam tuam mementō meī tū, propter bonitātem tuam, Domine. ^ The sins of my youth and my ignorances do not remember. According to thy mercy remember thou me, for thy goodness, O Lord.
8 ^ Dulcis et rēctus Dominus~; propter hoc lēgem dabit dēlinquentibus in viā. ^ The Lord is sweet and righteous~; therefore he will give a law to sinners in the way.
9 ^ Dīriget mansuētōs in jūdiciō~; docēbit mītēs viās suās. ^ He will guide the mild in judgment~; he will teach the meek his ways.
10 ^ Ūniversae viae Dominī, misericordia et vēritās, requīrentibus testāmentum ejus et testimōnia ejus. ^ All the ways of the Lord are mercy and truth, to them that seek after his covenant and his testimonies.
11 ^ Propter nōmen tuum, Domine, propitiāberis peccātō meō~; multum est enim. ^ For thy name's sake, O Lord, thou wilt pardon my sin~; for it is great.
12 ^ ¿~Quis est homō quī timet Dominum~? Lēgem statuit eī in viā, quam ēlēgit. ^ Who is the man that feareth the Lord~? He hath appointed him a law in the way he hath chosen.
13 ^ Anima ejus in bonīs dēmorābitur, et sēmen ejus hērēditābit terram. ^ His soul shall dwell in good things, and his seed shall inherit the land.
14 ^ Firmāmentum est Dominus timentibus eum, et testāmentum ipsīus ut manifestētur illīs. ^ The Lord is a firmament to them that fear him, and his covenant shall be made manifest to them.
15 ^ Oculī meī semper ad Dominum, quoniam ipse ēvellet dē laqueō pedēs meōs. ^ My eyes are ever towards the Lord, for he shall pluck my feet out of the snare.
16 ^ Respice in mē, et miserēre meī, quia ūnicus et pauper sum egō. ^ Look thou upon me, and have mercy on me, for I am alone and poor.
17 ^ Trībulātiōnēs cordis meī multiplicātae sunt~; dē necessitātibus meīs ērue mē. ^ The troubles of my heart are multiplied~; deliver me from my necessities.
18 ^ Vidē humilitātem meam et labōrem meum, et dīmitte ūniversa dēlicta mea. ^ See my abjection and my labour, and forgive all my sins.
19 ^ Respice inimīcōs meōs, quoniam multiplicātī sunt, et odiō inīquō ōdērunt mē. ^ Consider my enemies, for they are multiplied, and have hated me with an unjust hatred.
20 ^ Custōdī animam meam, et ērue mē~; nōn ērubēscam, quoniam spērāvī in tē. ^ Keep thou my soul, and deliver me~; may I not be ashamed, for I have hoped in thee.
21 ^ Innocentēs et rēctī adhaesērunt mihī, quia sustinuī tē. ^ The innocent and the upright have adhered to me, because I have waited on thee.
22 ^ Līberā, Deus, Isrāēlem ex omnibus trībulātiōnibus suīs. ^ Deliver, O God, Israel from all his tribulations.
