1 ^ Júdica me Dòmine, qŭóniam ego in innocèntia mea ingrèssus sum, et in Dòmino sperans non infirmábor. ^ Judge me, O Lord, for I have walked in my innocence, and I have put my hope in the Lord and shall not be weakened.
2 ^ Proba me, Dòmine, et tenta me~; ure renes meos et cor meum. ^ Prove me, O Lord, and try me~; burn my reins and my heart.
3 ^ Qŭóniam misericórdia tua ante òculos meos est, et complácui in veritáte tua. ^ For thy mercy is before my eyes, and I am well pleased with thy truth.
4 ^ Non sêdi cum concìlio vanitátis, et cum iníqŭa gerèntibus non introíbo. ^ I have not sat with the council of vanity, and with the doers of unjust things I will not enter.
5 ^ Odívi ecclésiam malignántium, et cum ìmpiîs non sědébo. ^ I have hated the assembly of the malignant~; and with the wicked I will not sit.
6 ^ Lavábo inter innocèntes manûs meas, et circùmdabo altáre tuum Dòmine, ^ I will wash my hands among the innocent, and will compass thy altar, O Lord,
7 ^ ut áŭdiam vocem laŭdis, et enárrem univèrsa mirabìlia tua. ^ that I may hear the voice of thy praise, and tell of all thy wondrous works.
8 ^ Dòmine, diléxi decórem domûs tuaĕ, et locum habitatiónis glóriaĕ tuaĕ. ^ I have loved, O Lord, the beauty of thy house, and the place where thy glory dwelleth.
9 ^ Ne pèrdas cum ìmpiîs, Deus, ánimam meam, et cum vìrîs sángŭinum vitam meam, ^ Take not away my soul, O God, with the wicked~; nor my life with bloody men,
10 ^ In quórum mánibus iniqŭitátes sunt~; dèxtera eórum repléta est munèribus. ^ in whose hands are iniquities~; their right hand is filled with bribes.
11 ^ Ego aŭtem in innocèntia mea ingrèssus sum~; rèdime me, et miserére mei. ^ But as for me, I have walked in my innocence~; redeem me, and have mercy on me.
12 ^ Pes meus stètit in dirécto~; in ecclésiîs benedícem te, Dòmine. ^ My foot hath stood in the direct way~; in the churches I will bless thee, O Lord.
