2 ^ In te, Dòmine, sperávi, non confùndar in aĕtèrnum~; in justìția tua líbera me. 
3 ^ Inclína ad me aŭrem tuam~; accèlera ut éruas me. Esto mìchi in Deum protectórem, et in domum refúģii, ut salvum me fáçias, 
4 ^ qụóniam fortitúdo mea et refúģium meum es tu, et pròpter nomen tuum dedúces me et enútries me. 
5 ^ Edúces me de láqụeo hoc qụem absconduérunt mìchi, qụóniam tu es protéctor meus. 
6 ^ In manûs tuas commèndo spíritum meum~; redemìsti me, Dòmine, Deus veritátis. 
7 ^ Odìsti observántes vanitátes supervácue~; ego aŭtem in Dòmino sperávi. 
8 ^ Exsultábo, et laĕtábor in misericórdia tua, qụóniam respexìsti humilitátem meam~; salvavìsti de necessitátibus ánimam meam. 
9 ^ Nec conclusìsti me in mánibus inimíci~; statuvìsti in loco spațióso pèdes meos. 
10 ^ Miserére mei, Dòmine, qụóniam trìbulor~; conturbátus est in ira òculus meus, ánima mea, et vènter meus. 
11 ^ Qụóniam defécit in dolóre vita mea, et anni mei in ģemìtibus. infirmáta est in paŭpertáte vìrtûs mea, et òssua mea conturbáta sunt. 
12 ^ Super òmnes inimícos meos factus sum oppróbrium, et vicínîs meîs valde, et tìmor notîs meîs. Qụi vedébant me foras fuģivérunt a me. 
13 ^ Oblivióni datus sum, tamqụam mórtuus a corde~; factus sum tamqụam vas pèrditum, 
14 ^ qụóniam aŭdívi vituperațiónem multórum commorántium in circùmitu. In eo dum convenírent sìmul advèrsum me, accìpere ánimam meam consiliáti sunt. 
15 ^ Ego aŭtem in te sperávi, Dòmine~; dixi, «~Deus meus es tu.~»
16 ^ In mánibus tuîs sortes meaĕ~; éripe me de manu inimicórum meórum, et a perseqụèntibus me. 
17 ^ Illústra fáçiem tuam super servum tuum~; salvum me fac in misericórdia tua. 
18 ^ Dòmine, non confùndar, qụóniam invocávi te. Erubéscant ìmpii, et deducántur in infèrnum. 
19 ^ Muta fiant lábia dolósa, qụaĕ loqụùntur advèrsus justum iniqụitátem in supèrbia et in abusióne. 
20 ^ Qụam magna multitúdo dulcédinis tuaĕ, Dòmine, qụam absconduìsti timèntibus te~; perfecìsti eîs qụi sperant in te, in conspèctu filiórum hòminum. 
21 ^ Abscòndes eos in abscòndito fașiéi tuaĕ a conturbațióne hòminum~; próteģes eos in tabernáculo tuo a contradicțióne lingụárum. 
22 ^ Benedìctus Dòminus, qụóniam mirificávit misericórdiam suam mìchi in civitáte muníta. 
23 ^ Ego aŭtem dixi in excèssu mentis meaĕ, «~Projèctus sum a fáçie oculórum tuórum.~» Ìdeo exaŭdivìsti vocem orațiónis meaĕ, dum clamárem ad te. 
24 ^ Dilìģite Dòminum, òmnes sancti ejus, qụóniam veritátem reqụíret Dòminus, et retrìbuet abundánter facièntibus supèrbiam. 
25 ^ Viríliter áģite, et confortétur cor vèstrum, òmnes qụi sperátis in Dòmino. 
