1 ^ Beáti qụórum remìssae sunt iniqụitátes, et qụórum tecta sunt peccáta. 
2 ^ Beátus vìr, cui non imputávit Dòminus peccátum, nec est in spíritu ejus dolus. 
3 ^ Qụóniam tácui, inveteravérunt òssua mea, dum clamárem tota die. 
4 ^ Qụóniam die ac nòcte graváta est super me manus tua, convèrsus sum in aerùmna mea, dum confíǧitur spína. 
5 ^ Delìctum meum cógnitum tìbi feci, et injustìṭiam meam non abscòndui. Dixi, «~Confitébor advèrsum me injustìṭiam meam Dòmino~», et tu remisìsti impietátem peccáti mei. 
6 ^ Pro hac orábit ad te òmnis sanctus in tèmpore opportúno. Verùmtamen in dilúvio aqụárum multárum, ad eum non approximábunt. 
7 ^ Tu es refúǧium meum a tribulaṭióne qụae circùmdedit me~; exsultáṭio mea, érue me a circumdántibus me. 
8 ^ Intelléctum tìbi dabo, et ìnstruam te in via hac qụa gradiéris~; firmábo super te òculos meos. 
9 ^ Nolíte fíeri sicut èqụus et mulus, qụìbus non est intelléctus. In camo et freno maxìllas eórum constrìnǧe, qụi non appròximant ad te. 
10 ^ Multa flaǧèlla peccatóris~; sperántem autem in Dòmino misericórdia circùmdabit. 
11 ^ Laetámini in Dòmino et exsultáte, justi~; et gloriámini, òmnes recti corde. 
