1 ^ Benedícem Dòminum in òmni tèmpore~; sèmper laus ejus in ore meo. 
2 ^ In Dòmino laudábitur ánima mea~; áudiant mansuéti, et laetèntur. 
3 ^ Magnificáte Dòminum mecum, et exaltémus nomen ejus in idìpsum. 
4 ^ Exqụisívi Dòminum, et exaudívit me, et ex òmnibus tribulaṭiónibus meîs erìpuit me. 
5 ^ Accédite ad eum, et illuminámini, et fáçies vèstrae non confundèntur. 
6 ^ Ìste pauper clamávit, et Dòminus exaudívit eum, et de òmnibus tribulaṭiónibus ejus salvávit eum. 
7 ^ Immìttet ánģelus Dòmini in circùmitu timèntium eum, et erìpiet eos. 
8 ^ Gustáte et vedéte qụóniam suávis est Dòminus~; beátus vìr qụi sperat in eo. 
9 ^ Timéte Dòminum, òmnes sancti ejus~; qụóniam non est inòpia timèntibus eum. 
10 ^ Dívites egụérunt, et esurivérunt~; inqụirèntes autem Dòminum non minuèntur òmni bono. 
11 ^ Věníte, fílii, audíte me~; timórem Dòmini docébo vos. 
12 ^ ¿~Qụìs est hòmo qụi vùlt vitam, díliģit dies vedére bonos~? 
13 ^ Próhibe lìngụam tuam a malo, et lábia tua ne loqụántur dolum. 
14 ^ Divèrte a malo, et fac bonum~; inqụíre pacem, et persèqụere eam. 
15 ^ Òculi Dòmini super justos, et aures ejus in prèces eórum. 
16 ^ Vùltus autem Dòmini super facièntes mala, ut pèrdat de terra memóriam eórum. 
17 ^ Clamavérunt justi, et Dòminus exaudívit eos, et ex òmnibus tribulaṭiónibus eórum liberávit eos. 
18 ^ Juxta est Dòminus eîs qụi tribuláto sunt corde, et húmiles spíritu salvábit. 
19 ^ Multae tribulaṭiónes justórum, et de òmnibus hîs liberábit eos Dòminus. 
20 ^ Custódit Dòminus òmnia òssua eórum~; unum ex hîs non conterétur. 
21 ^ Mors peccatórum pèssima~; et qụi odérunt justum delìnqụent. 
22 ^ Rèdimet Dòminus ánimas servórum suórum, et non delìnqụent òmnes qụi sperant in eo. 
