1 ^ Júdica, Dòmine, noçèntes me~; expúgna impugnántes me. 
2 ^ Apprehènde arma et scutum, et exsùrge in adjutórium mìhi. 
3 ^ Effùnde frámeam, et conclúde advèrsus eos qui persequùntur me~; dic ánimae meae, «~Salûs tua ego sum.~»
4 ^ Confundántur et revereántur, quaerèntes ánimam meam. Avertántur retrósum et confundántur cogitántes mìhi mala. 
5 ^ Fiant tamquam pùlvis ante fáçiem vènti, et ángelus Dòmini coártans eos. 
6 ^ Fiat via illórum tènebrae et lúbricum, et ángelus Dòmini pèrsequens eos. 
7 ^ Quóniam gratîs absconduérunt mìhi intèritum láquei sui~; supervácue exprobravérunt ánimam meam. 
8 ^ Vèniat illi láqueus quem ignórat, et cápzio quam abscònduit apprehèndat eum, et in láqueum cadat in ìpsum. 
9 ^ Ánima autem mea exsultábit in Dòmino, et delectábitur super salutári suo. 
10 ^ Òmnia òssua mea dicent, «~¿~Dòmine, quìs sìmilis tìbi~? Erìpiens ìnopem de manu forziórum ejus~; egénum et páuperem a diripièntibus eum.~» 
11 ^ Surgèntes tèstes iníqui, quae ignorábam interrogábant me. 
12 ^ Retribuébant mìhi mala pro bonîs, sterilitátem ánimae meae. 
13 ^ Ego autem, quum mìhi molèsti essent, induébar cilìcio~; humiliábam in jejúnio ánimam meam, et orázio mea in sìnu meo convertétur. 
14 ^ Quasi pròximum, et quasi frátrem nostrum, sic complaçébam~; quasi lugens et contristátus, sic humiliábar. 
15 ^ Et advèrsum me laetáti sunt, et convenérunt~; congregáta sunt super me flagèlla, et ignorávi. 
16 ^ Dissipáti sunt, nec compúncti~; tentavérunt me, subsannavérunt me subsannazióne~; frenduérunt super me dèntibus suîs. 
17 ^ Dòmine, ¿~quando respìçies~? Restìtue ánimam meam a malignitáte eórum~; a leónibus únicam meam. 
18 ^ Confitébor tìbi in ecclésia magna~; in pòpulo gravi laudábo te. 
19 ^ Non supergáudeant mìhi qui adversántur mìhi iníque, qui odérunt me gratîs et ánnuunt òculîs. 
20 ^ Quóniam mìhi quìdem paçìfice loquebántur, et in iracùndia terrae loquèntes, dolos cogitábant. 
21 ^ Et dilatavérunt super me os suum~; dixérunt, «~Bène, bène, vedérunt òculi nostri.~»
22 ^ Vîdìsti, Dòmine, ne sìleas~; Dòmine, ne disçédas a me. 
23 ^ Exsùrge, et intènde judìçio meo, Deus meus et Dòminus meus, in causam meam. 
24 ^ Júdica me secùndum justìziam tuam, Dòmine Deus meus, et non supergáudeant mìhi. 
25 ^ Non dicant in córdibus suîs, «~Bène, bène, ánimae nostrae.~» Nec dicant, «~Devorávimus eum.~»
26 ^ Erubéscant et revereántur sìmul qui gratulántur malîs meîs~; induántur confusióne et reverènzia qui magna loquùntur super me. 
27 ^ Exsùltent et laetèntur qui volunt justìziam meam, et dicant sèmper, «~Magnificétur Dòminus, qui volunt paçem sèrvi ejus.~»
28 ^ Et lìngua mea meditábitur justìziam tuam~; tota die laudem tuam. 
