1 ^ Júdica, Dòmine, noçèntes me~; expúgna impugnántes me. 
2 ^ Apprehènde arma et scutum, et exsùrge in adjutórium mìhi. 
3 ^ Effùnde frámeam, et conclúde advèrsus eos qvi perseqvùntur me~; dic ánimae meae, «~Salûs tua ego sum.~»
4 ^ Confundántur et revereántur, qvaerèntes ánimam meam. Avertántur retrósum et confundántur cogitántes mìhi mala. 
5 ^ Fiant tamqvam pùlvis ante fáçiem vènti, et ángelus Dòmini coártans eos. 
6 ^ Fiat via illórum tènebrae et lúbricum, et ángelus Dòmini pèrseqvens eos. 
7 ^ Qvóniam gratîs absconduérunt mìhi intèritum láqvei sui~; supervácue exprobravérunt ánimam meam. 
8 ^ Vèniat illi láqveus qvem ignórat, et cápzio qvam abscònduit apprehèndat eum, et in láqveum cadat in ìpsum. 
9 ^ Ánima autem mea exsultábit in Dòmino, et delectábitur super salutári suo. 
10 ^ Òmnia òssua mea dicent, «~¿~Dòmine, qvìs sìmilis tìbi~? Erìpiens ìnopem de manu forziórum ejus~; egénum et páuperem a diripièntibus eum.~» 
11 ^ Surgèntes tèstes iníqvi, qvae ignorábam interrogábant me. 
12 ^ Retribuébant mìhi mala pro bonîs, sterilitátem ánimae meae. 
13 ^ Ego autem, qvum mìhi molèsti essent, induébar cilìcio~; humiliábam in jejúnio ánimam meam, et orázio mea in sìnu meo convertétur. 
14 ^ Qvasi pròximum, et qvasi frátrem nostrum, sic complaçébam~; qvasi lugens et contristátus, sic humiliábar. 
15 ^ Et advèrsum me laetáti sunt, et convenérunt~; congregáta sunt super me flagèlla, et ignorávi. 
16 ^ Dissipáti sunt, nec compúncti~; tentavérunt me, subsannavérunt me subsannazióne~; frenduérunt super me dèntibus suîs. 
17 ^ Dòmine, ¿~qvando respìçies~? Restìtue ánimam meam a malignitáte eórum~; a leónibus únicam meam. 
18 ^ Confitébor tìbi in ecclésia magna~; in pòpulo gravi laudábo te. 
19 ^ Non supergáudeant mìhi qvi adversántur mìhi iníqve, qvi odérunt me gratîs et ánnuunt òculîs. 
20 ^ Qvóniam mìhi qvìdem paçìfice loqvebántur, et in iracùndia terrae loqvèntes, dolos cogitábant. 
21 ^ Et dilatavérunt super me os suum~; dixérunt, «~Bène, bène, vedérunt òculi nostri.~»
22 ^ Vîdìsti, Dòmine, ne sìleas~; Dòmine, ne disçédas a me. 
23 ^ Exsùrge, et intènde judìçio meo, Deus meus et Dòminus meus, in causam meam. 
24 ^ Júdica me secùndum justìziam tuam, Dòmine Deus meus, et non supergáudeant mìhi. 
25 ^ Non dicant in córdibus suîs, «~Bène, bène, ánimae nostrae.~» Nec dicant, «~Devorávimus eum.~»
26 ^ Erubésçant et revereántur sìmul qvi gratulántur malîs meîs~; induántur confusióne et reverènzia qvi magna loqvùntur super me. 
27 ^ Exsùltent et laetèntur qvi volunt justìziam meam, et dicant sèmper, «~Magnificétur Dòminus, qvi volunt paçem sèrvi ejus.~»
28 ^ Et lìngva mea meditábitur justìziam tuam~; tota die laudem tuam. 
