2 ^ Dòmine, ne in furóre tuo árguas me, nècve in ira tua corrìpias me. 
3 ^ Cvóniam saǧìttae tuae infíxae sunt mìchi, et confirmavìsti super me manum tuam. 
4 ^ Non est sánitas in carne mea, a fáčie irae tuae~; non est pax òssibus meîs a fáčie peccatórum meórum. 
5 ^ Cvóniam inicvitátes meae supergrèssae sunt caput meum, et sicut onus grave gravátae sunt super me. 
6 ^ Putruérunt et corrùptae sunt sicatríces meae, a fáčie insapiènṭiae meae. 
7 ^ Mìser factus sum et curvátus sum uscve in finem~; tota die contristátus ingrediébar. 
8 ^ Cvóniam lùmbi mei impléti sunt illusiónibus, et non est sánitas in carne mea. 
9 ^ Afflíctus sum, et humiliátus sum nìmis~; ruǧiébam a ǧèmitu cordis mei. 
10 ^ Dòmine, ante te omne desidèrium meum, et ǧèmitus meus a te non est abscònditus. 
11 ^ Cor meum conturbátum est~; derelícvit me vìrtûs mea, et lumen oculórum meórum, et ìpsum non est mecum. 
12 ^ Amíci mei et pròximi mei advèrsum me appropincvavérunt et stetérunt, et cvi juxta me èrant, de longe stetérunt. 
13 ^ Et vim fačiébant cvi cvaerébant ánimam meam, et cvi incvirébant mala mìchi, locúti sunt vanitátes, et dolos tota die meditabántur. 
14 ^ Ego autem, tamcvam surdus, non audiébam, et sicut mutus non apèriens os suum. 
15 ^ Et factus sum sicut hòmo non áudiens, et non habens in ore suo redarguṭiónes. 
16 ^ Cvóniam in te Dòmine sperávi~; tu exáudies me Dòmine Deus meus. 
17 ^ Cvia dixi, «~Necvándo supergáudeant mìchi inimíci mei~», et dum commovèntur pèdes mei, super me magna locúti sunt. 
18 ^ Cvóniam ego in flaǧèlla parátus sum, et dolor meus in conspèctu meo sèmper. 
19 ^ Cvóniam inicvitátem meam adnunṭiábo, et coǧitábo pro peccáto meo. 
20 ^ Inimíci autem mei vivunt, et confirmáti sunt super me, et multiplicáti sunt cvi odérunt me inícve. 
21 ^ Cvi retrìbuunt mala pro bonîs, detrahébant mìchi, cvóniam secvébar bonitátem. 
22 ^ Ne derelìncvas me, Dòmine Deus meus~; ne discèsserîs a me. 
23 ^ Intènde in adjutórium meum, Dòmine, Deus salútis meae. 
