2 ^ Dòmine, ne in furóre tuo árguas me, nèqüe in ira tua corrìpias me. 
3 ^ Qüóniam sağìttae tuae infíxae sunt mìhi, et confirmavìsti super me mànum tuam. 
4 ^ Non est sánitas in càrne mea, a fàçie irae tuae~; non est pax òssibus meîs a fàçie peccatórum meórum. 
5 ^ Qüóniam iniqüitátes meae supergrèssae sunt caput meum, et sicut onus grave gravátae sunt super me. 
6 ^ Putruérunt et corrùptae sunt sicatríces meae, a fàçie insapiènziae meae. 
7 ^ Mìser factus sum et curvátus sum usqüe in finem~; tota die contrystátus ingrediébar. 
8 ^ Qüóniam lùmbi mei impléti sunt illusiónibus, et non est sánitas in càrne mea. 
9 ^ Afflíctus sum, et humiliátus sum nìmis~; ruğiébam a ğèmitu cordis mei. 
10 ^ Dòmine, ànte te omne desidèrium meum, et ğèmitus meus a te non est abscònditus. 
11 ^ Cor meum conturbátum est~; derelíqüit me vìrtûs mea, et lumen oculórum meórum, et ìpsum non est mecum. 
12 ^ Amíci mei et pròximi mei advèrsum me appropinqüavérunt et stetérunt, et qüi juxta me èrant, de longe stetérunt. 
13 ^ Et vim façiébant qüi qüaerébant ànimam meam, et qüi inqüirébant màla mìhi, locúti sunt vanitátes, et dolos tota die meditabàntur. 
14 ^ Ego autem, tàmqüam surdus, non audiébam, et sicut mutus non apèriens os suum. 
15 ^ Et factus sum sicut hòmo non áudiens, et non habens in ore suo redarguziónes. 
16 ^ Qüóniam in te Dòmine sperávi~; tu exáudies me Dòmine Deus meus. 
17 ^ Qüia dixi, «~Neqüándo supergáudeant mìhi inimíci mei~», et dum commovèntur pèdes mei, super me magna locúti sunt. 
18 ^ Qüóniam ego in flagèlla parátus sum, et dolor meus in conspèctu meo sèmper. 
19 ^ Qüóniam iniqüitátem meam adnunziábo, et coğitábo pro peccáto meo. 
20 ^ Inimíci autem mei vivunt, et confirmáti sunt super me, et multiplicáti sunt qüi odérunt me iníqüe. 
21 ^ Qüi retrìbuunt màla pro bonîs, detrahébant mìhi, qüóniam seqüébar bonitátem. 
22 ^ Ne derelìnqüas me, Dòmine Deus meus~; ne disçèsserîs a me. 
23 ^ Intènde in adjutórium meum, Dòmine, Deus salútis meae. 
