2 ^ Dixi, «~Custódiem vias meas, ut non delìnqụam in lìngụa mea~; pósui ori meo custódiam, qụum consìsteret peccátor advèrsum me.~»
3 ^ Obmútui, et humiliátus sum, et sìlui a bonîs, et dolor meus renovátus est. 
4 ^ Concáluit cor meum intra me, et in meditaṭióne mea exardéscet ìgnis. 
5 ^ Locútus sum in lìngụa mea, «~Notum fac mìchi, Dòmine, finem meum, et númerum diérum meórum qụìs est, ut sciam qụid desit mìchi.~»
6 ^ Ecce mensurábiles posuìsti dies meos, et substánṭia mea tamqụam nìhilum ante te. Verùmtamen univèrsa vánitas, òmnis hòmo vívens. 
7 ^ Verùmtamen in imáģine pertránsit hòmo~; sed et frustre conturbátur. Tesáurisat, et ignórat cui congregábit ea. 
8 ^ ¿~Et nunc qụae est expectáṭio mea~? ¿~Nonne Dòminus~? Et substánṭia mea apud te est. 
9 ^ Ab òmnibus iniqụitátibus meîs érue me~; oppróbrium insapiènti dedìsti me. 
10 ^ Obmútui, et non apèrui os meum, qụóniam tu fecìsti. 
11 ^ Ámove a me plagas tuas~; a fortitúdine manûs tuae ego deféci in increpaṭiónibus. 
12 ^ Pròpter iniqụitátem corripuìsti hòminem, et tabéscere fecìsti sicut aráneam ánimam ejus~; verùmtamen vane conturbátur òmnis hòmo. 
13 ^ Exáudi oraṭiónem meam, Dòmine, et deprecaṭiónem meam~; áuribus pèrcipe lácrimas meas. Ne sìleas, qụóniam ádvena ego sum apud te, et peregrínus sicut òmnes patres mei. 
14 ^ Remìtte mìchi, ut refríģerer priùsqụam ábiam, et ámplius non èro. 
