2 ^ Dixi, «~Custódiem vias meas, ut non delìnqŭam in lingŭa mea~; pósui ori meo custódiam, qŭum consìsteret peccátor advèrsum me.~»^ I said, "I will take heed to my ways, that I sin not with my tongue~; I have set a guard to my mouth, when the sinner stood against me."
3 ^ Obmútui, et humiliátus sum, et sìlui a bonîs, et dolor meus renovátus est. ^ I was dumb, and was humbled, and kept silence from good things, and my sorrow was renewed.
4 ^ Concáluit cor meum intra me, et in meditațióne mea exardéscet ìgnis. ^ My heart grew hot within me, and in my meditation a fire shall flame out.
5 ^ Locútus sum in lingŭa mea, «~Notum fac mìhi, Dòmine, finem meum, et númerum diérum meórum qŭìs est, ut sciam qŭid desit mìhi.~»^ I spoke with my tongue, "Make know to me, O Lord, my end, and what is the number of my days, that I may know what is wanting to me."
6 ^ Ecce mensurábiles posuìsti dies meos, et substánția mea tamqŭam nìhilum ante te. Verùmtamen univèrsa vánitas, òmnis hòmo vívens. ^ Behold thou hast made my days measurable, and my substance is as nothing before thee. Surely all things are vanity, every man living.
7 ^ Verùmtamen in imáǧine pertránsit hòmo~; sed et frustre conturbátur. Tesáŭrisat, et ignórat cui congregábit ea. ^ Surely man passeth as an image~; but even he is disquieted in vain. He storeth up, and he knoweth not for whom he shall gather these things.
8 ^ ¿~Et nunc qŭaĕ est expectáțio mea~? ¿~Nonne Dòminus~? Et substánția mea apud te est. ^ And now what is my hope~? Is it not the Lord~? And my substance is with thee.
9 ^ Ab òmnibus iniqŭitátibus meîs érue me~; oppróbrium insapiènti dedìsti me. ^ Deliver thou me from all my iniquities~; thou hast made me a reproach to the fool.
10 ^ Obmútui, et non apèrui os meum, qŭóniam tu fecìsti. ^ I was dumb, and I opened not my mouth, because thou hast done it.
11 ^ Ámove a me plagas tuas~; a fortitúdine manûs tuaĕ ego deféci in increpațiónibus. ^ Remove thy scourges from me~; the strength of thy hand hath made me faint in rebukes.
12 ^ Pròpter iniqŭitátem corripuìsti hòminem, et tabéscere fecìsti sicut aráneam ánimam ejus~; verùmtamen vane conturbátur òmnis hòmo. ^ Thou hast corrected man for iniquity, and thou hast made his soul to waste away like a spider~; surely in vain is any man disquieted.
13 ^ Exáŭdi orațiónem meam, Dòmine, et deprecațiónem meam~; áŭribus pèrcipe lácrimas meas. Ne sìleas, qŭóniam ádvena ego sum apud te, et peregrínus sicut òmnes patres mei. ^ Hear my prayer, O Lord, and my supplication~; give ear to my tears. Be no silent, for I am a stranger with thee, and a sojourner as all my fathers were.
14 ^ Remìtte mìhi, ut refríǧerer priùsqŭam ábiam, et ámplius non èro. ^ Forgive me, that I may be refreshed before I go hence, and be no more.
