2 ^ Beátus qụi intèlleģit super eģénum et páuperem~; in die mala liberábit eum Dòminus. 
3 ^ Dòminus consèrvet eum, et vivíficet eum, et beátum fáçiat eum in terra, et non tradat eum in ánimam inimicórum ejus. 
4 ^ Dòminus òpem fèrat illi super lettum dolóris ejus~; univèrsum stratum ejus versavìsti in infirmitáte ejus. 
5 ^ Ego dixi, «~Dòmine, miserére mei~; sana ánimam meam, qụia peccávi tìbi.~»
6 ^ Inimíci mei dixérunt mala mìchi, «~¿~Qụando moriétur, et períbit nomen ejus~?~». 
7 ^ Et si ingrediebátur ut vedéret, vana loqụebátur~; cor ejus congregávit iniqụitátem sìbi. Egrediebátur foras et loqụebátur in idìpsum. 
8 ^ Advèrsum me susurrábant òmnes inimíci mei~; advèrsum me coģitábant mala mìchi. 
9 ^ Vèrbum iníqụum constituvérunt advèrsum me, «~¿~Numqụid qụi dormit non adjìciet ut resùrģat~?~». 
10 ^ Ètenim hòmo pacis meae in qụo sperávi, qụi edébat panes meos, magnificávit super me supplantaṭiónem. 
11 ^ Tu autem, Dòmine, miserére mei et resùscita me, et retrìbuem eîs. 
12 ^ In hoc cognóvi qụóniam voluìsti me, qụóniam non gaudébit inimícus meus super me. 
13 ^ Me autem pròpter innocènṭiam suscepìsti, et confirmavìsti me in conspèctu tuo in aetèrnum. 
14 ^ Benedìctus Dòminus Deus Israhélis a sáeculo, et usqụe in sáeculum. Fiat, fiat. 
