2 ^ Beátus qüi intèllegit super eğénum et páuperem~; in die màla liberábit eum Dòminus. 
3 ^ Dòminus consèrvet eum, et vivíficet eum, et beátum fàçiat eum in terra, et non tradat eum in ànimam inimicórum ejus. 
4 ^ Dòminus òpem fèrat illi super lèctum dolóris ejus~; univèrsum stratum ejus versavìsti in infirmitáte ejus. 
5 ^ Ego dixi, «~Dòmine, miserére mei~; sana ànimam meam, qüia peccávi tìbi.~»
6 ^ Inimíci mei dixérunt màla mìhi, «~¿~Qüando moriétur, et períbit nomen ejus~?~». 
7 ^ Et si ingrediebátur ut vidéret, vana loqüebátur~; cor ejus congregávit iniqüitátem sìbi. Egrediebátur foras et loqüebátur in idìpsum. 
8 ^ Advèrsum me susurrábant òmnes inimíci mei~; advèrsum me coğitábant màla mìhi. 
9 ^ Vèrbum iníqüum constituvérunt advèrsum me, «~¿~Numqüid qüi dormit non adjìçiet ut resùrgat~?~». 
10 ^ Ètenim hòmo paçis meae in qüo sperávi, qüi edébat panes meos, magnificávit super me supplantaziónem. 
11 ^ Tu autem, Dòmine, miserére mei et resùsçita me, et retrìbuem eîs. 
12 ^ In hoc cognóvi qüóniam voluìsti me, qüóniam non gaudébit inimícus meus super me. 
13 ^ Me autem pròpter innoçènziam susçepìsti, et confirmavìsti me in conspèctu tuo in aetèrnum. 
14 ^ Benedìctus Dòminus Deus Israhélis a sáeculo, et usqüe in sáeculum. Fiat, fiat. 
