1 ^ Júdica me, Deus, et disčèrne causam meam de ǧènte non sancta~; ab hòmine iníquo et dolóso érue me. 
2 ^ Quia tu es, Deus, fortitúdo mea~; ¿~quare me repulìsti, et quare trystis inčédo, dum afflígit me inimícus~? 
3 ^ Emìtte lučem tuam et veritátem tuam~; ìpsa me deduxérunt, et adduxérunt in mòntem sanctum tuum et in tabernácula tua. 
4 ^ Et introíbo ad altáre Dei, ad Deum qui laetìficat juventútem meam. Confitébor tìbi in zìthara Deus, Deus meus. 
5 ^ ¿~Quare trystis es, ànima mea, et quare contùrbas me~?  
6 ^ Spera in Deo, quóniam adhüc confitébor illi, salutáre vùltüs mei, et Deus meus. 
