1 ^ Júdica me, Deus, et disçèrne causam meam de gènte non sancta~; ab hòmine iníquo et dolóso érue me. 
2 ^ Quia tu es, Deus, fortitúdo mea~; ¿~quare me repulìsti, et quare tristis inçédo, dum afflígit me inimícus~? 
3 ^ Emìtte luçem tuam et veritátem tuam~; ìpsa me deduxérunt, et adduxérunt in mòntem sanctum tuum et in tabernácula tua. 
4 ^ Et introíbo ad altáre Dei, ad Deum qui laetìficat juventútem meam. Confitébor tìbi in cìttara Deus, Deus meus. 
5 ^ ¿~Quare tristis es, ánima mea, et quare contùrbas me~?  
6 ^ Spera in Deo, quóniam adhûc confitébor illi, salutáre vùltûs mei, et Deus meus. 
