1 ^ Júdica me, Deus, et discèrne caŭsam meam de ģènte non sancta~; ab hòmine iníqụo et dolóso érue me. ^ Judge me, O God, and distinguish my cause from the nation that is not holy~; deliver me from the unjust and deceitful man.
2 ^ Qụia tu es, Deus, fortitúdo mea~; ¿~qụare me repulìsti, et qụare tristis incédo, dum afflíģit me inimícus~? ^ For thou art, O God, my strength~; why hast thou cast me off, and why do I go sorrowful, whilst the enemy afflicteth me~?
3 ^ Emìtte lucem tuam et veritátem tuam~; ìpsa me deduxérunt, et adduxérunt in mòntem sanctum tuum et in tabernácula tua. ^ Send forth thy light and thy truth~; these have conducted me, and they brought me unto thy holy hill and into thy tabernacles.
4 ^ Et introíbo ad altáre Dei, ad Deum qụi laĕtìficat juventútem meam. Confitébor tìbi in cìttara Deus, Deus meus. ^ And I will go in to the altar of God, to God who giveth joy to my youth. To thee, O God my God, I will give praise upon the harp.
5 ^ ¿~Qụare tristis es, ánima mea, et qụare contùrbas me~?  ^ Why art thou sad, O my soul~? And why dost thou disquiet me~?
6 ^ Spera in Deo, qụóniam adhûc confitébor illi, salutáre vùltûs mei, et Deus meus. ^ Hope in God, for I will still give praise to him, the salvation of my countenance, and my God.
