2 ^ Deus, áuribus nostrîs audívimus~; patres nostri adnunziavérunt nobîs, opus quod operátus es in diébus eórum, et in diébus antíquîs. 
3 ^ Manus tua ģèntes dispèrdidit et plantavìsti eos~; afflixìsti pòpulos et expulìsti eos~; 
4 ^ nec ènim in glàdio suo possedérunt terram, et bráchium eórum non salvávit eos~; sed dèxtera tua et bráchium tuum, et illuminázio vùltûs tui, quóniam complaçuìsti in eîs. 
5 ^ Tu es ìpse rex meus et Deus meus, qui mandas salútes Jacóbi. 
6 ^ In te inimícos nostros ventilábimus cornu, et in nómine tuo spernémus insurgèntes in nobîs. 
7 ^ Non ènim in arcu meo sperábo, et glàdius meus non salvábit me. 
8 ^ Salvavìsti ènim nos de affligèntibus nos, et odièntes nos confudìsti. 
9 ^ In Deo laudábimur tota die, et in nómine tuo confitébimur in sáeculum. 
10 ^ Nunc autem repulìsti et confudìsti nos, et non egrediéris, Deus, in virtútibus nostrîs. 
11 ^ Avertìsti nos retrósum post inimícos nostros, et qui odérunt nos, diripiébant sìbi. 
12 ^ dedìsti nos tamquam oves escárum, et in ģèntibus dispersìsti nos. 
13 ^ Vendidìsti pòpulum tuum sine prèzio, et non fuit multitúdo in commutaziónibus eórum. 
14 ^ posuìsti nos oppróbrium vicínîs nostrîs~; subsannaziónem et derísum hîs qui sunt in çircùmitu nostro. 
15 ^ posuìsti nos in similitúdinem ģèntibus~; commoziónem cápitis in pòpulîs. 
16 ^ Tota die verecùndia mea còntra me est, et confúsio façiéi meae coopèruit me, 
17 ^ a voçe exprobràntis et obloquèntis, a fàçie inimíci et persequèntis. 
18 ^ Haec òmnia vênérunt super nos, nec oblíti sùmus te, et iníque non égimus in testamènto tuo. 
19 ^ Et non recèssit rètro cor nostrum, et declinavìsti sémitas nostras a via tua, 
20 ^ quóniam humiliavìsti nos in loco afflicziónis, et coopèruit nos ùmbra mortis. 
21 ^ Si oblíti sùmus nomen Dei nostri, et si expándimus mànûs nostras ad deum aliénum, 
22 ^ ¿~nonne Deus requíret ìsta~? Ìpse ènim novit abscòndita cordis. 
23 ^ Quóniam pròpter te mortificámur tota die~; aestimáti sùmus sicut oves occaesiónis. 
24 ^ Exsùrge~; ¿~quare obdórmîs, Dòmine~? Exsùrge et ne repèllas in finem. 
25 ^ ¿~Quare fàçiem tuam avèrtis~? ¿~Oblivísçeris inópiae nostrae et tribulaziónis nostrae~? 
26 ^ Quóniam humiliáta est in pùlvere ànima nostra~; conglutinátus est in terra vènter noster. 
27 ^ Exsùrge, Dòmine, àdjuva nos, et rèdime nos pròpter nomen tuum. 
