2 ^ Deus, áuribus nostrîs audívimus~; patres nostri adnunṭiavérunt nobîs, opus cvod operátus es in diébus eórum, et in diébus antícvîs. 
3 ^ Manus tua ǧèntes dispèrdidit et plantavìsti eos~; afflixìsti pòpulos et expulìsti eos~; 
4 ^ nec ènim in gládio suo possedérunt terram, et bráchium eórum non salvávit eos~; sed dèxtera tua et bráchium tuum, et illumináṭio vùltûs tui, cvóniam complacuìsti in eîs. 
5 ^ Tu es ìpse rex meus et Deus meus, cvi mandas salútes Jacóbi. 
6 ^ In te inimícos nostros ventilábimus cornu, et in nómine tuo spernémus insurǧèntes in nobîs. 
7 ^ Non ènim in arcu meo sperábo, et gládius meus non salvábit me. 
8 ^ Salvavìsti ènim nos de affliǧèntibus nos, et odièntes nos confudìsti. 
9 ^ In Deo laudábimur tota die, et in nómine tuo confitébimur in sáeculum. 
10 ^ Nunc autem repulìsti et confudìsti nos, et non egrediéris, Deus, in virtútibus nostrîs. 
11 ^ Avertìsti nos retrósum post inimícos nostros, et cvi odérunt nos, diripiébant sìbi. 
12 ^ dedìsti nos tamcvam oves escárum, et in ǧèntibus dispersìsti nos. 
13 ^ Vendidìsti pòpulum tuum sine prèṭio, et non fuit multitúdo in commutaṭiónibus eórum. 
14 ^ posuìsti nos oppróbrium vicínîs nostrîs~; subsannaṭiónem et derísum hîs cvi sunt in circùmitu nostro. 
15 ^ posuìsti nos in similitúdinem ǧèntibus~; commoṭiónem cápitis in pòpulîs. 
16 ^ Tota die verecùndia mea còntra me est, et confúșio fașiéi meae coopèruit me, 
17 ^ a voce exprobrántis et oblocvèntis, a fáčie inimíci et persecvèntis. 
18 ^ Haec òmnia vênérunt super nos, nec oblíti sùmus te, et inícve non éǧimus in testamènto tuo. 
19 ^ Et non recèssit rètro cor nostrum, et declinavìsti sémitas nostras a via tua, 
20 ^ cvóniam humiliavìsti nos in loco afflicṭiónis, et coopèruit nos ùmbra mortis. 
21 ^ Si oblíti sùmus nomen Dei nostri, et si expándimus manûs nostras ad deum aliénum, 
22 ^ ¿~nonne Deus recvíret ìsta~? Ìpse ènim novit abscòndita cordis. 
23 ^ Cvóniam pròpter te mortificámur tota die~; aestimáti sùmus sicut oves occaesiónis. 
24 ^ Exsùrǧe~; ¿~cvare obdórmîs, Dòmine~? Exsùrǧe et ne repèllas in finem. 
25 ^ ¿~Cvare fáčiem tuam avèrtis~? ¿~Oblivísceris inópiae nostrae et tribulaṭiónis nostrae~? 
26 ^ Cvóniam humiliáta est in pùlvere ánima nostra~; conglutinátus est in terra vènter noster. 
27 ^ Exsùrǧe, Dòmine, ádjuva nos, et rèdime nos pròpter nomen tuum. 
