2 ^ Òmnes ǧèntes pláudite mánibus~; jubiláte Deo in voce exsultaṭiónis. 
3 ^ Qụóniam Dòminus excèlsus, terrìbilis~; Rex magnus super òmnem terram. 
4 ^ Subjécit pòpulos nobîs, et ǧèntes sub pèdibus nostrîs. 
5 ^ Eléǧit nobîs hereditátem suam~; spèciem Jacóbis, qụam diléxit. 
6 ^ Ascènsit Deus in júbilo, et Dòminus in voce tubae. 
7 ^ Psállite Deo nostro, psállite~; psállite reǧi nostro, psállite. 
8 ^ Qụóniam rex òmnis terrae Deus~; psállite sapiènter. 
9 ^ Regnábit Deus super ǧèntes~; Deus sèdet super sedem sanctam suam. 
10 ^ Príncipes populórum congregáti sunt cum Deo Ábrahae, qụóniam dei fortes terrae vehemènter eleváti sunt. 
