2 ^ Audíte haec, òmnes ğèntes~; áuribus perčìpite, òmnes qui habitátis orbem, 
3 ^ quique terríğenae, et fílii hòminum, sìmul in unum dives et pauper. 
4 ^ Os meum loquétur sapiènziam, et meditázio cordis mei prudènziam. 
5 ^ Inclinábo in parábolam aurem meam~; apèriem in psaltério proposiziónem meam. 
6 ^ ¿~Cur timébo in die màla~? Iníquitas calcánei mei čircùmdabit me. 
7 ^ Qui confídunt in virtúte sua, et in multitúdine diviziárum suárum gloriàntur. 
8 ^ Frater non rèdimit, rèdimet hòmo~; non dabit Deo placaziónem suam, 
9 ^ et prèzium redempziónis ànimae suae, et laborábit in aetèrnum, 
10 ^ et vivet adhüc in finem; non vidébit intèritum, quum víderit sapièntes morièntes. 
11 ^ Sìmul insápiens et stultus períbunt, et relìnquent aliénïs divìzias suas. 
12 ^ Et sepùlchra eórum domüs illórum in aetèrnum, tabernácula eórum in proğènie et proğènie~; vocavérunt nómina sua in terrïs suïs. 
13 ^ Et hòmo, quum in honóre esset, non intelléxit~; comparátus est jumèntïs insapièntibus, et sìmilis fàctus est illïs. 
14 ^ Haec via illórum scándalum ìpsïs, et póstea in ore suo complačébunt. 
15 ^ sicut oves in infèrno pósiti sunt~; mors depásčet eos, et dominabùntur eórum justi in matutíno, et auxìlium eórum veteráscet in infèrno a glória eórum. 
16 ^ Verùmtamen Deus rèdimet ànimam meam de mànu ìnferi, quum acčéperit me. 
17 ^ Ne timúerïs quum dives fàctus fúerit hòmo, et quum multiplicáta fúerit glória domüs ejus, 
18 ^ quóniam, quum interíverit, non sumet òmnia, nèque desčèndet cum eo glória ejus. 
19 ^ Quia ànima ejus in vita ìpsius benedicétur~; confitébitur tìbi quum beneféčerïs ei. 
20 ^ Introíbit usque in proğènies pàtrum suórum, et usque in aetèrnum non vidébit lumen. 
21 ^ Hòmo, quum in honóre esset, non intelléxit~; comparátus est jumèntïs insapièntibus, et sìmilis fàctus est illïs. 
