3 ^ Miserére mei, Deus, secùndum magnam misericórdiam tuam, et secùndum multitúdinem miseraçiónum tuárum dele iniqvitátem meam. 
4 ^ Ámplius lava me ab iniqvitáte mea, et a peccáto meo mùnda me, 
5 ^ qvóniam iniqvitátem meam ego cognósco, et peccátum meum còntra me est sèmper. 
6 ^ Tìbi soli peccávi, et malum coram te feci, ut justificéris in sermónibus tuîs, et vincas qvum judicáris. 
7 ^ Ecce ènim in iniqvitátibus concèptus sum, et in peccátîs concépit me mater mea. 
8 ^ Ecce ènim veritátem dilexìsti~; incèrta et occùlta sapiènṭiae tuae manifestavìsti mìchi. 
9 ^ Aspèrǧes me hissópo, et mundábor~; lavábis me, et super nivem dealbábor. 
10 ^ Audítui meo dabis gáudium et laetìṭiam, et exsultábunt òssua humiliáta. 
11 ^ Áverte fáçiem tuam a peccátîs meîs, et òmnes iniqvitátes meas dele. 
12 ^ Cor mùndum crea in me, Deus, et spíritum rectum ìnnova in viscèribus meîs. 
13 ^ Ne projìcias me a fáçie tua, et spíritum sanctum tuum ne áuferas a me. 
14 ^ Redde mìchi laetìṭiam salutáris tui, et spíritu principáli confìrma me. 
15 ^ Docébo iníqvos vias tuas, et ìmpii ad te convertèntur. 
16 ^ Líbera me de sangvìnibus, Deus, Deus salútis meae, et exsultábit lìngva mea justìṭiam tuam. 
17 ^ Dòmine, lábia mea apèries, et os meum adnunçiábit laudem tuam. 
18 ^ Qvóniam si voluìsses sacrifìçium, dedìssem útiqve~; holocáustis non delectáberis. 
19 ^ Sacrifìçium Deo spíritus contribülátus~; cor contrítum et humiliátum, Deus, non despìçies. 
20 ^ Benígne fac, Dòmine, in bona voluntáte tua Siónem, ut aedificèntur muri Jerusalímis~; 
21 ^ tunc acceptábis sacrifìçium justìṭiae, oblaçiónes et holocáusta~; tunc impónent super altáre tuum vìtulos. 
