3 ^ ¿~Qüid gloriáris in malìzia, qüi potens es in iniqüitáte~? 
4 ^ Tota die injustìziam coğitávit lìngüa tua~; sicut novácula acúta feçìsti dolum. 
5 ^ Dilexìsti malìziam super benignitátem~; iniqüitátem mağis qüam loqüi aeqüitátem. 
6 ^ Dilexìsti òmnia vèrba praecipitaziónis, lìngüam dolósam. 
7 ^ Proptèrea Deus déstruet te in finem~; evèllet te, et emigrábit te de tabernáculo tuo, et radícem tuam de terra vivèntium. 
8 ^ Vidébunt justi, et timébunt, et super eum ridébunt, et dicent, 
9 ^ «~Ecçe hòmo qüi non pósuit Deum adjutórem suum, sed sperávit in multitúdine diviziárum suárum, et praeváluit in vanitáte sua.~»
10 ^ Ego autem, sicut olíva fructìfera in domu Dei, sperávi in misericórdia Dei in aetèrnum et in sáeculum sáeculi. 
11 ^ Confitébor tìbi in sáeculum, qüia feçìsti, et expectábo nomen tuum, qüóniam bonum est in conspèctu sanctórum tuórum. 
