3 ^ ¿~Qŭid gloriáris in malìția, qŭi potens es in iniqŭitáte~? ^ Why dost thou glory in malice, thou that art mighty in iniquity~?
4 ^ Tota die injustìțiam cogitávit lingŭa tua~; sicut novácula acúta fecìsti dolum. ^ All the day long thy tongue hath devised injustice~; as a sharp razor, thou hast wrought deceit.
5 ^ Dilexìsti malìțiam super benignitátem~; iniqŭitátem magis qŭam loqŭi aĕqŭitátem. ^ Thou hast loved malice more than goodness, and iniquity rather than to speak righteousness.
6 ^ Dilexìsti òmnia vèrba praĕcipitațiónis, lingŭam dolósam. ^ Thou hast loved all the words of ruin, a deceitful tongue.
7 ^ Proptèrea Deus déstruet te in finem~; evèllet te, et emigrábit te de tabernáculo tuo, et radícem tuam de terra vivèntium. ^ Therefore will God destroy thee for ever~; he will pluck thee out, and remove thee from thy dwelling place, and thy root out of the land of the living.
8 ^ Vǐdébunt justi, et timébunt, et super eum ridébunt, et dicent, ^ The just shall see and fear, and shall laugh at him, and say,
9 ^ «~Ecce hòmo qŭi non pósuit Deum adjutórem suum, sed sperávit in multitúdine divițiárum suárum, et praĕváluit in vanitáte sua.~»^ "Behold the man that made not God his helper, but trusted in the abundance of his riches, and prevailed in his vanity."
10 ^ Ego aŭtem, sicut olíva fructìfera in domu Dei, sperávi in misericórdia Dei in aĕtèrnum et in sáĕculum sáĕculi. ^ But I, as a fruitful olive tree in the house of God, have hoped in the mercy of God for ever, yea for ever and ever.
11 ^ Confitébor tìbi in sáĕculum, qŭia fecìsti, et expectábo nomen tuum, qŭóniam bonum est in conspèctu sanctórum tuórum. ^ I will praise thee for ever, because thou hast done it, and I will wait on thy name, for it is good in the sight of thy saints.
