1 ^ Dixit insápiens in corde suo, «~Non est Deus.~»^ The fool said in his heart, "There is no God."
2 ^ Corrùpti sunt, et abominábiles facti sunt in iniqụitátibus~; non est qụi fáçiat bonum. ^ They are corrupted, and become abominable in iniquities~; there is none that doth good.
3 ^ Deus de caĕlo prospèxit super fílios hòminum, ut vèdeat si est intèlleģens, aŭt reqụírens Deum. ^ God looked down from heaven on the children of men, to see if there were any that did understand, or did seek God.
4 ^ Òmnes declinavérunt~; sìmul inútiles facti sunt~; non est qụi fáçiat bonum, non est usqụe ad unum. ^ All have gone aside~; they are become unprofitable together~; there is none that doth good, no not one.
5 ^ ¿~Nonne scient òmnes qụi operántur iniqụitátem, qụi dévorant plebem meam ut cìbum panis~? ^ Shall not all the workers of iniquity know, who eat up my people as they eat bread~?
6 ^ Deum non invocavérunt~; illic trepidavérunt timóre, ubi non èrat tìmor. Qụóniam Deus dissipávit òssua eórum qụi homìnibus placent~; confúsi sunt, qụóniam Deus sprevit eos. ^ They have not called upon God~; there have they trembled for fear, where there was no fear. For God hath scattered the bones of them that please men~; they have been confounded, because God hath despised them.
7 ^ ¿~Qụìs dabit ex Sióne salutáre Israhélis~? Qụum convertúerit Deus captivitátem plebis suaĕ, exsultábit Jacob, et laĕtábitur Isráhel. ^ Who will give out of Sion the salvation of Israel~? When God shall bring back the captivity of his people, Jacob shall rejoice, and Israel shall be glad.
