3 ^ Deus, in nómine tuo salvum me fac, et in virtúte tua júdica me. 
4 ^ Deus exáŭdi orațiónem meam~; áŭribus pèrcipe vèrba oris mei. 
5 ^ Qụóniam aliéni insurrexérunt advèrsum me, et fortes qụaĕsivérunt ánimam meam, et non proposuérunt Deum ante conspectum suum. 
6 ^ Ecce ènim Deus ádjuvat me, et Dòminus suscèptor est ánimaĕ meaĕ. 
7 ^ Avèrte mala inimícîs meîs, et in veritáte tua dispèrde illos. 
8 ^ Voluntárie sacrificábo tìbi, et confitébor nómini tuo Dòmine, qụóniam bonum est~; 
9 ^ qụóniam ex òmni tribulațióne eripuìsti me, et super inimícos meos despèxit òculus meus. 
