2 ^ Exáudi Deus oraziónem meam, et ne despèxerîs deprecaziónem meam~; 
3 ^ intènde mìhi, et exáudi me. Contristátus sum in exercitazióne mea, et conturbátus sum, 
4 ^ a voçe inimíci, et a tribulazióne peccatóris. Quóniam declinavérunt in me iniquitátes, et in ira molèsti èrant mìhi. 
5 ^ Cor meum conturbátum est in me, et formído mortis càduit super me. 
6 ^ Tìmor et trèmor vênérunt super me, et contexérunt me tènebrae. 
7 ^ Et dixi, «~¿~Quìs dabit mìhi pennas sicut colùmbae, et vulábo et requiéscem~?~». 
8 ^ Ecçe elongávi fúģiens, et mansi in solitúdine. 
9 ^ Expectábam eum qui sàlvum me feçit a pusillanimitáte spíritûs et tempestáte. 
10 ^ Praeçìpita, Dòmine~; dívide lìnguas eórum~; quóniam vîdi iniquitátem et contradicziónem in çivitáte. 
11 ^ Die ac nòcte çircùmdabit eam super muros ejus iníquitas, et labor in mèdio ejus, 
12 ^ et injustìzia, et non deféçit de plassîs ejus usúra et dolus. 
13 ^ Quóniam si inimícus meus maledixìsset mìhi, sustinuìssem útique. Et si ìs qui óderat me super me magna locútus fuìsset, absconduìssem me fórsitan ab eo. 
14 ^ Tu vero hòmo unánimis, dux meus, et notus meus~; 
15 ^ Qui sìmul mecum dulçes capiébas cìbos~; in domu Dei ambulávimus cum consènsu. 
16 ^ Vèniat mors super illos, et desçèndant in infèrnum vivèntes~; quóniam nequìziae in habitáculîs eórum, in mèdio eórum. 
17 ^ Ego autem ad Deum clamávi, et Dòminus salvábit me. 
18 ^ Vèspere et mane et merídie narrábo et adnunziábo, et exáudiet voçem meam. 
19 ^ Rèdimet in paçe ànimam meam ab hîs qui appropìnquant mìhi, quóniam inter multos èrant mecum. 
20 ^ Exáudiet Deus, et humiliábit illos, qui est ànte sáecula. Non ènim est illîs commutázio, et non timuérunt Deum. 
21 ^ Extèndit mànum suam in retribuèndo~; contaminavérunt testamèntum ejus~; 
22 ^ divísi sunt ab ira vùltûs ejus, et appropinquávit cor ìllius. Mollíti sunt sermónes ejus super óleum, et ìpsi sunt jácula. 
23 ^ Jacta super Dòminum curam tuam, et ìpse te enútriet~; non dabit in aetèrnum fluctuaziónem justo. 
24 ^ Tu vero, Deus, dedúces eos in púteum intèritûs. Vìri sánguinum, et dolósi non dimidiábunt dies suos~; ego autem sperábo in te Dòmine. 
