2 ^ Miserére mei, Deus, miserére mei, qụóniam in te confídit ánima mea. Et in ùmbra alárum tuárum sperábo, donec tránsiat iníqụitas. 
3 ^ Clamábo ad Deum Altìssimum, Deum qụi benefécit mìchi. 
4 ^ Misit de caelo, et liberávit me~; dèdit in oppróbrium conculcántes me. Misit Deus misericórdiam suam et veritátem suam, 
5 ^ et erìpuit ánimam meam de mèdio catulórum leónum. Dormívi conturbátus. Fílii hòminum dèntes eórum arma et saģìttae, et lìngụa eórum gládius acútus. 
6 ^ Exaltáre super caelos, Deus, et in òmnem terram glória tua. 
7 ^ Láqụeum paravérunt pèdibus meîs, et incurvavérunt ánimam meam. Fodérunt ante fáçiem meam fóveam, et incaduérunt in eam. 
8 ^ Parátum cor meum, Deus, parátum cor meum~; cantábo et psalmum dicem. 
9 ^ Exsùrģe, glória mea~; exsùrģe, psaltérium et cìttara~; exsùrģem dilúculo. 
10 ^ Confitébor tìbi in pòpulîs, Dòmine, et psalmum dicem tìbi in ģèntibus, 
11 ^ qụóniam magnificáta est usqụe ad caelos misericórdia tua, et usqụe ad nubes vèritas tua. 
12 ^ Exaltáre super caelos, Deus, et super òmnem terram glória tua. 
