2 ^ Miserére mei, Deus, miserére mei, qvóniam in te confídit ánima mea. Et in ùmbra alárum tuárum sperábo, donec tránsiat iníqvitas. 
3 ^ Clamábo ad Deum Altìssimum, Deum qvi benefécit mìchi. 
4 ^ Misit de caelo, et liberávit me~; dèdit in oppróbrium conculcántes me. Misit Deus misericórdiam suam et veritátem suam, 
5 ^ et erìpuit ánimam meam de mèdio catulórum leónum. Dormívi conturbátus. Fílii hòminum dèntes eórum arma et saǧìttae, et lìngva eórum gládius acútus. 
6 ^ Exaltáre super caelos, Deus, et in òmnem terram glória tua. 
7 ^ Láqveum paravérunt pèdibus meîs, et incurvavérunt ánimam meam. Fodérunt ante fáciem meam fóveam, et incaduérunt in eam. 
8 ^ Parátum cor meum, Deus, parátum cor meum~; cantábo et psalmum dicem. 
9 ^ Exsùrǧe, glória mea~; exsùrǧe, psaltérium et cìttara~; exsùrǧem dilúculo. 
10 ^ Confitébor tìbi in pòpulîs, Dòmine, et psalmum dicem tìbi in ǧèntibus, 
11 ^ qvóniam magnificáta est usqve ad caelos misericórdia tua, et usqve ad nubes vèritas tua. 
12 ^ Exaltáre super caelos, Deus, et super òmnem terram glória tua. 
