2 ^ Si vere úticve justìṭiam locvìmini, recte judicáte, fílii hòminum. 
3 ^ Ètenim in corde inicvitátes operámini~; in terra injustìṭias manûs vèstrae concìnnant. 
4 ^ Alienáti sunt peccatóres a vulva, erravérunt ab útero~; locúti sunt falsa. 
5 ^ Furor illîs secùndum similitúdinem serpèntis, sicut áspidis surdae et obturántîs aures suas, 
6 ^ cvae non exáudiet vocem incantántium, et venéfici incantántis sapiènter. 
7 ^ Deus cònteret dèntes eórum in ore ipsórum~; molas leónum confrìnǧet Dòminus. 
8 ^ Ad nìhilum devènient tamcvam acva decùrrens~; intèndit arcum suum donec infirmèntur. 
9 ^ sicut cera cvae fluit auferèntur, supercáduit ìgnis, et non vîdérunt solem. 
10 ^ Priùscvam intellèǧerent spinae vèstrae ramnum, sicut vivèntes sic in ira absórbet eos. 
11 ^ Laetábitur justus cvum víderit vindìctam~; manûs suas lavábit in sángvine peccatóris. 
12 ^ Et dicet hòmo, «~Si úticve est fructûs justo, úticve est Deus júdicans eos in terra.~»
