2 ^ Si vere útiqve justìṭiam loqvìmini, recte judicáte, fílii hòminum. 
3 ^ Ètenim in corde iniqvitátes operámini~; in terra injustìṭias manûs vèstrae concìnnant. 
4 ^ Alienáti sunt peccatóres a vulva, erravérunt ab útero~; locúti sunt falsa. 
5 ^ Furor illîs secùndum similitúdinem serpèntis, sicut áspidis surdae et obturántîs aures suas, 
6 ^ qvae non exáudiet vocem incantántium, et venéfici incantántis sapiènter. 
7 ^ Deus cònteret dèntes eórum in ore ipsórum~; molas leónum confrìnget Dòminus. 
8 ^ Ad nìhilum devènient tamqvam aqva decùrrens~; intèndit arcum suum donec infirmèntur. 
9 ^ sicut cera qvae fluit auferèntur, supercáduit ìgnis, et non vîdérunt solem. 
10 ^ Priùsqvam intellègerent spinae vèstrae ramnum, sicut vivèntes sic in ira absórbet eos. 
11 ^ Laetábitur justus qvum víderit vindìctam~; manûs suas lavábit in sángvine peccatóris. 
12 ^ Et dicet hòmo, «~Si útiqve est fructûs justo, útiqve est Deus júdicans eos in terra.~»
