2 ^ Si vere útiqụe justìțiam loqụìmini, recte judicáte, fílii hòminum. ^ If in very deed ye speak justice, judge rightly, ye sons of men.
3 ^ Ètenim in corde iniqụitátes operámini~; in terra injustìțias manûs vèstraĕ concìnnant. ^ For in your heart you work iniquity~; your hands forge injustice in the earth.
4 ^ Alienáti sunt peccatóres a vulva, erravérunt ab útero~; locúti sunt falsa. ^ The wicked are alienated from the womb~; they have gone astray from the womb~; they have spoken false things.
5 ^ Furor illîs secùndum similitúdinem serpèntis, sicut áspidis surdaĕ et obturántîs aŭres suas, ^ Their madness is according to the likeness of a serpent, like the deaf asp that stoppeth her ears,
6 ^ qụaĕ non exáŭdiet vocem incantántium, et venéfici incantántis sapiènter. ^ which will not hear the voice of those enchanting, nor of the wizard that charmeth wisely.
7 ^ Deus cònteret dèntes eórum in ore ipsórum~; molas leónum confrìnģet Dòminus. ^ God shall break in pieces their teeth in their mouth~; the Lord shall break the grinders of the lions.
8 ^ Ad nìhilum devènient tamqụam aqụa decùrrens~; intèndit arcum suum donec infirmèntur. ^ They shall come to nothing, like water running down~; he hath bent his bow till they be weakened.
9 ^ sicut cera qụaĕ fluit aŭferèntur, supercáduit ìgnis, et non vîdérunt solem. ^ Like wax that melteth they shall be taken away, fire hath fallen on them, and they shall not see the sun.
10 ^ Priùsqụam intellèģerent spinaĕ vèstraĕ ramnum, sicut vivèntes sic in ira absórbet eos. ^ Before your thorns could know the brier, he swalloweth them up, as alive, in his wrath.
11 ^ Laĕtábitur justus qụum víderit vindìctam~; manûs suas lavábit in sángụine peccatóris. ^ The just shall rejoice when he shall see the revenge~; he shall wash his hands in the blood of the sinner.
12 ^ Et dicet hòmo, «~Si útiqụe est fructûs justo, útiqụe est Deus júdicans eos in terra.~»^ And man shall say, "If indeed there be fruit to the just, there is indeed a God that judgeth them on the earth."
