2 ^ Éripe me de inimícîs meîs, Deus meus, et ab insurgèntibus in me líbera me. 
3 ^ Éripe me de operántibus iniqvitátem, et de vìrîs sángvinum salva me. 
4 ^ Qvia ecçe çepérunt ánimam meam~; irruvérunt in me fortes. 
5 ^ Nèqve iníqvitas mea, nèqve peccátum meum, Dòmine~; sine iniqvitáte cucùrri, et diréxi. 
6 ^ Exsùrge in occùrsum meum, et vède. Et tu, Dòmine, Deus virtútum, Deus Israhélis, intènde ad visitándas òmnes gèntes~; non misereáris òmnibus qvi operántur iniqvitátem. 
7 ^ Convertèntur ad vèsperam, et famem patièntur ut canes, et çircumíbunt çivitátem. 
8 ^ Ecçe loqvèntur in ore suo, et gládius in lábiîs eórum~; ¿~qvóniam qvìs audívit~? 
9 ^ Et tu, Dòmine, deridébis eos~; ad nìhilum dedúces òmnes gèntes. 
10 ^ Fortitúdinem meam ad te custódiem, qvia Deus susçèptor meus es. 
11 ^ Deus meus, misericórdia ejus praevèniet me~; Deus ostèndet mìhi super inimícos meos. 
12 ^ Ne occáedas eos, neqvándo oblivisçántur pòpuli mei. Dispèrge illos in virtúte tua, et depóne eos, protéctor meus, Dòmine, 
13 ^ delìctum oris eórum, sermónem labiórum ipsórum, et comprehendantur in supèrbia sua. Et de exsecrazióne et mendáçio adnunziabùntur, 
14 ^ in consummazióne, in ira consummaziónis, et non èrunt. Et scient qvia Deus dominábitur Jacóbem, et fínium terrae. 
15 ^ Convertèntur ad vèsperam, et famem patièntur ut canes, et çircumíbunt çivitátem. 
16 ^ Ìpsi dispergèntur ad manducándum, si vero non fúerint saturáti, et murmurábunt. 
17 ^ Ego autem cantábo fortitúdinem tuam, et exsultábo mane misericórdiam tuam. Qvia factus es susçèptor meus, et refúgium meum, in die tribulaziónis meae. 
18 ^ Adjútor meus, tìbi psallem, qvia Deus susçèptor meus es~; Deus meus, misericórdia mea. 
