2 ^ Éripe me de inimícîs meîs, Deus meus, et ab insurgèntibus in me líbera me. 
3 ^ Éripe me de operàntibus iniqüitátem, et de vìrîs sángüinum salva me. 
4 ^ Qüia ecçe çepérunt ànimam meam~; irruvérunt in me fortes. 
5 ^ Nèqüe iníqüitas mea, nèqüe peccátum meum, Dòmine~; sine iniqüitáte cucùrri, et diréxi. 
6 ^ Exsùrge in occùrsum meum, et vìde. Et tu, Dòmine, Deus virtútum, Deus Israhélis, intènde ad visitándas òmnes ğèntes~; non misereáris òmnibus qüi operàntur iniqüitátem. 
7 ^ Convertèntur ad vèsperam, et famem patièntur ut cànes, et çircumíbunt çivitátem. 
8 ^ Ecçe loqüèntur in ore suo, et glàdius in lábiîs eórum~; ¿~qüóniam qüìs audívit~? 
9 ^ Et tu, Dòmine, deridébis eos~; ad nìhilum dedúces òmnes ğèntes. 
10 ^ Fortitúdinem meam ad te custódiem, qüia Deus susçèptor meus es. 
11 ^ Deus meus, misericórdia ejus praevèniet me~; Deus ostèndet mìhi super inimícos meos. 
12 ^ Ne occáedas eos, neqüándo obliviscàntur pòpuli mei. Dispèrge illos in virtúte tua, et depóne eos, protéctor meus, Dòmine, 
13 ^ delìctum oris eórum, sermónem labiórum ipsórum, et comprehendantur in supèrbia sua. Et de exsecrazióne et mendáçio adnunziabùntur, 
14 ^ in consummazióne, in ira consummaziónis, et non èrunt. Et scient qüia Deus dominábitur Jacóbem, et fínium terrae. 
15 ^ Convertèntur ad vèsperam, et famem patièntur ut cànes, et çircumíbunt çivitátem. 
16 ^ Ìpsi dispergèntur ad manducándum, si vero non fúerint saturáti, et murmurábunt. 
17 ^ Ego autem cantábo fortitúdinem tuam, et exsultábo mane misericórdiam tuam. Qüia factus es susçèptor meus, et refúğium meum, in die tribulaziónis meae. 
18 ^ Adjútor meus, tìbi psallem, qüia Deus susçèptor meus es~; Deus meus, misericórdia mea. 
