2 ^ Éripe me de inimícîs meîs, Deus meus, et ab insurģèntibus in me líbera me. ^ Deliver me from my enemies, O my God, and from them that rise up against me free me.
3 ^ Éripe me de operántibus iniqụitátem, et de vìrîs sángụinum salva me. ^ Deliver me from them that work iniquity, and save me from bloody men.
4 ^ Qụia ecce cepérunt ánimam meam~; irruvérunt in me fortes. ^ For behold they have caught my soul~; the mighty have rushed in upon me.
5 ^ Nèqụe iníqụitas mea, nèqụe peccátum meum, Dòmine~; sine iniqụitáte cucùrri, et diréxi. ^ Neither is it my iniquity, nor my sin, O Lord~; without iniquity have I run, and have I directed.
6 ^ Exsùrģe in occùrsum meum, et vède. Et tu, Dòmine, Deus virtútum, Deus Israhélis, intènde ad visitándas òmnes ģèntes~; non misereáris òmnibus qụi operántur iniqụitátem. ^ Rise up thou to meet me, and behold. And thou, O Lord, the God of hosts, the God of Israel, attend to visit all the nations~; have no mercy on all them that work iniquity.
7 ^ Convertèntur ad vèsperam, et famem pațièntur ut canes, et circumíbunt civitátem. ^ They shall return at evening, and shall suffer hunger as dogs, and shall go round about the city.
8 ^ Ecce loqụèntur in ore suo, et gládius in lábiîs eórum~; ¿~qụóniam qụìs aŭdívit~? ^ Behold they shall speak with their mouth, and a sword is in their lips~; for who has heard~?
9 ^ Et tu, Dòmine, deridébis eos~; ad nìhilum dedúces òmnes ģèntes. ^ But thou, O Lord, shalt laugh at them~; thou shalt bring all the nations to nothing.
10 ^ Fortitúdinem meam ad te custódiem, qụia Deus suscèptor meus es. ^ I will keep my strength to thee, for thou art my protector
11 ^ Deus meus, misericórdia ejus praĕvèniet me~; Deus ostèndet mìchi super inimícos meos. ^ My God, his mercy shall prevent me~; God shall let me see over my enemies.
12 ^ Ne occáĕdas eos, neqụándo obliviscántur pòpuli mei. Dispèrģe illos in virtúte tua, et depóne eos, protéctor meus, Dòmine, ^ Slay them not, lest at any time my people forget. Scatter them by thy power, and bring them down, my protector, O Lord,
13 ^ delìctum oris eórum, sermónem labiórum ipsórum, et comprehendantur in supèrbia sua. Et de exsecrațióne et mendácio adnunțiabùntur, ^ a sin of their mouth, a word of their lips, and let them be taken in their pride. And for their cursing and lying they shall be talked of,
14 ^ in consummațióne, in ira consummațiónis, et non èrunt. Et scient qụia Deus dominábitur Jacóbem, et fínium terraĕ. ^ when they are consumed, when they are consumed by thy wrath, and they shall be no more. And they shall know that God will rule Jacob, and all the ends of the earth.
15 ^ Convertèntur ad vèsperam, et famem pațièntur ut canes, et circumíbunt civitátem. ^ They shall return at evening, and shall suffer hunger as dogs, and shall go round about the city.
16 ^ Ìpsi disperģèntur ad manducándum, si vero non fúerint saturáti, et murmurábunt. ^ They shall be scattered abroad to eat, if truely they shall not be filled, and shall murmur.
17 ^ Ego aŭtem cantábo fortitúdinem tuam, et exsultábo mane misericórdiam tuam. Qụia factus es suscèptor meus, et refúģium meum, in die tribulațiónis meaĕ. ^ But I will sing thy strength, and will extol thy mercy in the morning. For thou art become my support, and my refuge, in the day of my trouble.
18 ^ Adjútor meus, tìbi psallem, qụia Deus suscèptor meus es~; Deus meus, misericórdia mea. ^ O my helper, will unto thee will I sing, for thou art God my defence~; my God, my mercy.
