3 ^ Deus, repulìsti nos, et destruxìsti nos~; irátus es, et misèrtus es nobîs. 
4 ^ Commovìsti terram, et conturbavìsti eam~; sana contriziónes ejus, quia commóta est. 
5 ^ Ostensìsti pòpulo tuo dura~; potavìsti nos vino compûncziónis. 
6 ^ dedìsti metuèntibus te significaziónem, ut fúğiant a fàçie arcûs, ut liberèntur dilécti tui. 
7 ^ Sàlvum fac dèxtera tua, et exáudi me. 
8 ^ Deus locútus est in sancto suo, «~Laetábor, et párzier Sìchimam, et convàllem tabernaculórum mézier.~»
9 ^ Meus est Giliádus, et meus est Manásses, et Ephrémus fortitúdo cápitis mei. Juda rex meus~; 
10 ^ Moab olla spei meae. In Iduméam extendem calçeamèntum meum~; mìhi alieníğenae sùbditi sunt. 
11 ^ ¿~Quìs dedúcet me in çivitátem munítam~? ¿~Quìs dedúcet me usque in Iduméam~? 
12 ^ ¿~Nonne tu, Deus, qui repulìsti nos~? ¿~Et non egrediéris Deus in virtútibus nostrîs~? 
13 ^ Da nobîs auxìlium de tribulazióne, quia vana sàlûs hòminis. 
14 ^ In Deo façiémus virtútem, et ìpse ad nìhilum dedúcet tribulàntes nos. 
