3 ^ Deus, repulìsti nos, et destruxìsti nos~; irátus ès, et misèrtus ès nobîs. ^ O God, thou hast cast us off, and hast destroyed us~; thou hast been angry, and hast had mercy on us.
4 ^ Commovìsti terram, et conturbavìsti eam~; sana contritiónes ejus, qŭia commóta èst. ^ Thou hast moved the earth, and hast troubled it~; heal thou the breaches thereof, for it has been moved.
5 ^ Ostensìsti pòpulo tuo dura~; potavìsti nos vino compunctiónis. ^ Thou hast shown thy people hard things~; thou hast made us drink the wine of sorrow.
6 ^ dedìsti metuèntibus te significatiónem, ut fúgiant a fácie arcûs, ut liberèntur dilècti tui. ^ Thou hast given a warning to them that fear thee, that they may flee from before the bow, that thy beloved may be delivered.
7 ^ Salvum fac dèxtera tua, et exáŭdi me. ^ Save me with thy right hand, and hear me.
8 ^ Deus locútus èst in sancto suo, «~Laĕtábor, et pártier Sìchimam, et convállem tabernaculórum métier.~»^ God hath spoken in his holy place, "I will rejoice, and I will divide Sichem, and will mete out the vale of tabernacles."
9 ^ Meus èst Gìliad, et meus èst Manásse, et Èfraim fortitúdo cápitis mei. Juda rex meus~; ^ Gìliad is mine, and Manasseh is mine, and Ephraim is the strength of my head. Judah is my king~;
10 ^ Moab olla spei meaĕ. In Iduméam extendem calceamèntum meum~; mìhi alienígenaĕ sùbditi sunt. ^ Moab is the pot of my hope. Into Idumea will I stretch out my shoe~; to me the foreigners are made subject.
11 ^ ¿~Qŭìs dedúcet me in civitátem munítam~? ¿~Qŭìs dedúcet me usqŭe in Iduméam~? ^ Who will bring me into the strong city~? Who will lead me into Idumea~?
12 ^ ¿~Nonne tu, Deus, qŭi repulìsti nos~? ¿~Et non egrediéris Deus in virtútibus nostrîs~? ^ Wilt not thou, O God, who hast cast us off~? And wilt not thou, O God, go out with our armies~?
13 ^ Da nobîs aŭxìlium de tribulatióne, qŭia vana salûs hòminis. ^ Give us help from trouble, for vain is the salvation of man.
14 ^ In Deo faciémus virtútem, et ipse ad nìhilum dedúcet tribulántes nos. ^ Through God we shall do mightily, and he shall bring to nothing them that afflict us.
