2 ^ Exáudi, Deus, oraṭiónem meam qụum déprecor~; a timóre inimíci éripe ánimam meam. 
3 ^ Protexìsti me a convèntu malignántium, a multitúdine operántium iniqụitátem. 
4 ^ Qụia exacuvérunt ut gládium lìngvas suas~; intendérunt arcum rem amáram, 
5 ^ ut saǧìttent in occùltîs immaculátum. 
6 ^ Sùbite sagittábunt eum, et non timébunt~; firmavérunt sìbi sermónem neqụam. Narravérunt ut abscònderent láqụeos~; dixérunt, «~¿~Qụìs vedébit eos~?~». 
7 ^ Scrutáti sunt iniqụitátes~; defečérunt scrutántes scrutìnio. Accédet hòmo ad cor altum, 
8 ^ et exaltábitur Deus. Saǧìttae parvulórum factae sunt plagae eórum, 
9 ^ et infirmátae sunt còntra eos lìngvae eórum. Conturbáti sunt òmnes qụi vedébant eos, 
10 ^ et tìmuit òmnis hòmo. Et adnunṭiavérunt ópera Dei, et facta ejus intellexérunt. 
11 ^ Laetábitur justus in Dòmino, et sperábit in eo, et laudabùntur òmnes recti corde. 
