2 ^ Te dècet hìmnus, Deus, in Sióne, et tìbi reddétur votum in Jerusalíme. 
3 ^ Exáŭdi orațiónem meam~; ad te òmnis carnis vèniet. 
4 ^ Vèrba iniqụórum praĕvaluérunt super nos, et impietátibus nostrîs tu propițiáberis. 
5 ^ Beátus qụem eleģìsti et assumpsìsti~; inhabitábit in átriîs tuîs. Replébimur in bonîs domûs tuaĕ~; sanctum est templum tuum, 
6 ^ mirábile in aĕqụitáte. Exáŭdi nos, Deus, salutáris noster, spes òmnium fínium terraĕ, et in mari longe. 
7 ^ Práĕparans mòntes in virtúte tua, accínctus potènția~; 
8 ^ qụi contùrbas profùndum maris, sonum flúctuum ejus. Turbabùntur ģèntes, 
9 ^ et timébunt qụi hábitant tèrminos a sìgnîs tuîs~; èxitûs matutíni et vèspere delectábis. 
10 ^ Visitavìsti terram et inebriavìsti eam~; multiplicavìsti locupletáre eam. Flumen Dei replétum est aqụîs~; paravìsti cìbum illórum, qụóniam ita est praĕparáțio ejus. 
11 ^ Rivos ejus inébria~; multìplica ģenìmina ejus~; in stillicádiîs ejus laĕtábitur ģèrminans. 
12 ^ Benedíces corónaĕ anni benignitátis tuaĕ, et campi tui replebùntur ubertáte. 
13 ^ Pingụéscent speciósa desèrti, et exsultațióne colles accinģèntur. 
14 ^ Indúti sunt aríetes óvium, et valles abundábunt frumènto~; clamábunt, ètenim hìmnum dicent. 
