1 ^ Jubiláte Deo, òmnis terra~; ^ Shout with joy to God, all the earth~;
2 ^ psalmum dícite nómini ejus~; date glóriam laŭdi ejus. ^ sing ye a psalm to his name~; give glory to his praise.
3 ^ Dícite Deo, «~Qụam terribìlia sunt ópera tua, Dòmine. In multitúdine virtútis tuaĕ mențièntur tìbi inimíci tui. ^ Say unto God, "How terrible are thy works, O Lord! In the multitude of thy strength thy enemies shall lie to thee.
4 ^ Òmnis terra adóret te, et psallat tìbi~; psalmum dícat nómini tuo.~»^ Let all the earth adore thee, and sing to thee~; let it say a psalm to thy name."
5 ^ Věníte, et vedéte ópera Dei~; terrìbilis in consìliîs super fílios hòminum. ^ Come and see the works of God~; terrible in his counsels over the sons of men.
6 ^ Qụi convèrtit mare in áridam~; in flúmine pertransíbunt pède~; ìbi laĕtábimur in ìpso. ^ Who turneth the sea into dry land~; in the river they shall pass on foot~; there shall we rejoice in him.
7 ^ Qụi dominátur in virtúte sua in aĕtèrnum~; òculi ejus super ģèntes respìciunt~; qụi exásperant non exaltèntur in semet ìpsîs. ^ Who by his power ruleth for ever~; his eyes behold the nations~; let not them that provoke him be exalted in themselves.
8 ^ Benedícite, ģèntes, Deum nostrum, et aŭdítam fáçite vocem laŭdis ejus, ^ O bless our God, ye Gentiles, and make the voice of his praise to be heard,
9 ^ qụi pósuit ánimam meam ad vitam, et non dèdit in commoțiónem pèdes meos. ^ Who hath set my soul to live, and hath not suffered my feet to be moved.
10 ^ Qụóniam probavìsti nos, Deus~; ìgne nos examinavìsti, sicut examinátur arģèntum. ^ For thou hast proved us, O God~; thou hast tried us by fire, as silver is tried.
11 ^ Induxìsti nos in láqụeum~; posuìsti tribulațiónes in dorso nostro~; ^ Thou hast brought us into a net~; thou hast laid afflictions on our back~;
12 ^ imposuìsti hòmines super cápita nostra. Transívimus per ìgnem et aqụam, et eduxìsti nos in refriģèrium. ^ Thou hast set men over our heads. We have passed through fire and water, and thou hast brought us out into a refreshment.
13 ^ Introíbo in domum tuam in holocaŭstîs~; reddem tìbi vota mea, ^ I will go into thy house with burnt offerings~; I will pay thee my vows,
14 ^ qụaĕ distinxérunt lábia mea, et locútum est os meum in tribulațióne mea. ^ which my lips have uttered, and my mouth hath spoken when I was in trouble.
15 ^ Holocaŭsta medulláta òfferem tìbi cum incènso aríetum~; òfferem tìbi boves cum hircîs. ^ I will offer up to thee holocaŭsts full of marrow with burnt offerings of rams~; I will offer to thee bullocks with goats.
16 ^ Věníte, aŭdíte, et narrábo, òmnes qụi timétis Deum, qụanta fecit ánimaĕ meaĕ. ^ Come, hear, and I will tell, all ye that fear God, what things he hath done for my soul.
17 ^ Ad ìpsum ore meo clamávi, et exaltávi sub lingụa mea. ^ I cried to him with my mouth, and I extolled him with my tongue.
18 ^ iniqụitátem si aspèxi in corde meo, non exáŭdiet Dòminus. ^ If I have looked at iniquity in my heart, the Lord will not hear me.
19 ^ Proptèrea exaŭdívit Deus, et attèndit voci deprecațiónis meaĕ. ^ Therefore hath God heard me, and hath attended to the voice of my supplication.
20 ^ Benedìctus Deus, qụi non amóvit orațiónem meam et misericórdiam suam a me. ^ Blessed be God, who hath not turned away my prayer and his mercy from me.
