2 ^ Deus misereátur nostri, et benedícat nobîs~; illúminet vùltum suum super nos, et misereátur nostri, 
3 ^ ut cognoscámus in terra viam tuam, in òmnibus ģèntibus salutáre tuum. 
4 ^ Confiteántur tìbi pòpuli, Deus~; confiteántur tìbi pòpuli òmnes. 
5 ^ Laĕtèntur et exsùltent ģèntes, qụóniam júdicas pòpulos in aĕqụitáte, et ģèntes in terra díriģis. 
6 ^ Confiteántur tìbi pòpuli, Deus~; confiteántur tìbi pòpuli òmnes. 
7 ^ Terra dèdit fructum suum~; benedícat nos Deus, Deus noster. 
8 ^ Benedícat nos Deus, et métuant eum òmnes fines terraĕ. 
