2 ^ Deus misereátur nostri, et benedíčat nobîs~; illúminet vùltum suum super nos, et misereátur nostri, ^ May God have mercy on us, and bless us~; may he cause the light of his countenance to shine upon us, and may he have mercy on us,
3 ^ ut cognoscámus in terra viam tuam, in òmnibus ǧèntibus salutáre tuum. ^ that we may know thy way upon earth, thy salvation in all nations.
4 ^ Confiteántur tìbi pòpuli, Deus~; confiteántur tìbi pòpuli òmnes. ^ Let people confess to thee, O God~; let all people give praise to thee.
5 ^ Laĕtèntur et exsùltent ǧèntes, qŭóniam júdicas pòpulos in aĕqŭitáte, et ǧèntes in terra díriǧis. ^ Let the nations be glad and rejoice, for thou judgest the people with justice, and directest the nations upon earth.
6 ^ Confiteántur tìbi pòpuli, Deus~; confiteántur tìbi pòpuli òmnes. ^ Let the people, O God, confess to thee~; let all the people give praise to thee.
7 ^ Terra dèdit fructum suum~; benedíčat nos Deus, Deus noster. ^ The earth hath yielded her fruit~; may God, our God bless us,
8 ^ Benedíčat nos Deus, et métuant eum òmnes fines terraĕ. ^ May God bless us, and all the ends of the earth fear him.
