2 ^ Exsùrgat Deus, et dissipèntur inimíci ejus, et fúgiant qvi odérunt eum, a fáçie ejus. 
3 ^ sicut défiçit fumus, defìçiant~; sicut fluit cera a fáçie ìgnis, sic pèreant peccatóres a fáçie Dei. 
4 ^ Et justi epulèntur, et exsùltent in conspèctu Dei, et delectèntur in laetìzia. 
5 ^ Cantáte Deo~; psalmum díçite nómini ejus~; ìter fáçite ei qvi asçèndit super occásum. Dòminus nomen illi~; exsultáte in conspèctu ejus. 
6 ^ Turbabùntur a fáçie ejus patris orfanórum et júdicis viduárum~; Deus in loco sancto suo. 
7 ^ Deus qvi inhabitáre façit únius moris in domu~; qvi edúçit vinctos in fortitúdine, simìliter eos qvi exásperant, qvi hábitant in sepùlcrîs. 
8 ^ Deus, qvum egrederéris in conspèctu pòpuli tui, qvum pertransíres in desèrto, 
9 ^ terra mota est, ètenim caeli stillavérunt a fáçie Dei Sinae, a fáçie Dei Israhélis. 
10 ^ Plúviam voluntáriam segregábis, Deus, hereditáti tuae, et infirmáta est, tu vero perfeçìsti eam. 
11 ^ Animália tua habitábunt in ea~; paravìsti in dulçédine tua páuperi, Deus. 
12 ^ Dòminus dabit vèrbum evangelisántibus, virtúte mùlta. 
13 ^ Rex virtútum dilécti, dilècti, et speçiéi domûs dividére spólia. 
14 ^ Si dormiátis inter mèdios cleros, pennae colùmbae deargentátae, et posterióra dorsi ejus in pallóre auri. 
15 ^ Dum disçèrnit caelèstis reges super eam, nive dealbabùntur in Selmon. 
16 ^ Mons Dei, mons pingvis~; mons coagulátus, mons pingvis. 
17 ^ ¿~Ut qvid suspicámini, mòntes coagulátos, mons, in qvo benepláçitum est Deo habitáre in eo~? Ètenim Dòminus habitábit in finem. 
18 ^ Currus Dei dèçem mìllibus mùltiplex, mìllia laetántium~; Dòminus in eîs in Sina, in sancto. 
19 ^ Ascensìsti in altum, çepìsti captivitátem, aċçepìsti dona in homìnibus~; ètenim non credèntes, inhabitáre Dòminum Deum. 
20 ^ Benedìctus Dòminus die qvotídie~; pròsperum ìter fáçiet nobîs Deus salutárium nostrórum. 
21 ^ Deus noster, Deus salvos façièndi, et Dòmini, Dòmini èxitûs mortis. 
22 ^ Verùmtamen Deus confrìnget cápita inimicórum suórum, vèrticem capìlli perambulántium in delìctîs suîs. 
23 ^ Dixit Dòminus, «~Èx Basáne convèrtem, convèrtem in profùndum maris, 
24 ^ ut intingátur pes tuus in sángvine~; lìngva canum tuórum ex inimícîs, ab ìpso.~»
25 ^ Vǐdérunt ingrèssûs tuos, Deus, ingrèssûs Dei mei, regis mei qvi est in sancto. 
26 ^ Praevenérunt prínçipes conjúncti psallèntibus, in mèdio juvenculárum timpanistriárum. 
27 ^ In ecclésiîs benedíçite Deo, Dòmino de fòntibus Israhélis. 
28 ^ Ìbi Beniamínus adolesçèntulus, in mentis excèssu~; prínçipes Judae, duces eórum~; prínçipes Sabulónis, prínçipes Neftalími. 
29 ^ Manda, Deus, virtúti tuae~; confìrma hoc, Deus, qvod operátus es in nobîs. 
30 ^ A templo tuo in Jerosólima, tìbi òfferent reges múnera. 
31 ^ Ìncrepa fèras arùndinis~; congregázio taurórum in vaccîs populórum, ut exclúdant eos qvi probáti sunt argènto. Dìssipa gèntes qvae bella volunt. 
32 ^ Vènient legáti ex Aegìpto~; Aeziópia praevèniet manûs ejus Deo. 
33 ^ Regna terrae, cantáte Deo~; psállite Dòmino~; psállite Deo, 
34 ^ qvi asçèndit super caelum caeli, ad orièntem~; eċçe dabit voçi suae voçem virtútis. 
35 ^ Date glóriam Deo~; super Israhélem magnifiçènzia ejus, et vìrtûs ejus in núbibus. 
36 ^ Mirábilis Deus in sanctîs suîs~; Deus Israhélis ìpse dabit virtútem et fortitúdinem plebi suae. Benedìctus Deus. 
