2 ^ Exsùrǧat Deus, et dissipèntur inimíci ejus, et fúǧiant qvi odérunt eum, a fácie ejus. 
3 ^ sicut déficit fumus, defìciant~; sicut fluit cera a fácie ìgnis, sic pèreant peccatóres a fácie Dei. 
4 ^ Et justi epulèntur, et exsùltent in conspèctu Dei, et delectèntur in laetìṭia. 
5 ^ Cantáte Deo~; psalmum dícite nómini ejus~; ìter fácite ei qvi ascèndit super occásum. Dòminus nomen illi~; exsultáte in conspèctu ejus. 
6 ^ Turbabùntur a fácie ejus patris orfanórum et júdicis viduárum~; Deus in loco sancto suo. 
7 ^ Deus qvi inhabitáre facit űnius moris in domu~; qvi edúcit vinctos in fortitúdine, simìliter eos qvi exásperant, qvi hábitant in sepùlcrîs. 
8 ^ Deus, qvum egrederéris in conspèctu pòpuli tui, qvum pertransíres in desèrto, 
9 ^ terra mota est, ètenim caeli stillavérunt a fácie Dei Sinae, a fácie Dei Israhélis. 
10 ^ Plúviam voluntáriam segregábis, Deus, hereditáti tuae, et infirmáta est, tu vero perfecìsti eam. 
11 ^ Animália tua habitábunt in ea~; paravìsti in dulcédine tua páuperi, Deus. 
12 ^ Dòminus dabit vèrbum evanǧelisántibus, virtúte mùlta. 
13 ^ Rex virtútum dilécti, dilècti, et speciéi domûs dividére spólia. 
14 ^ Si dormiátis inter mèdios cleros, pennae colùmbae dearǧentátae, et posterióra dorsi ejus in pallóre auri. 
15 ^ Dum discèrnit caelèstis reǧes super eam, nive dealbabùntur in Selmon. 
16 ^ Mons Dei, mons pingvis~; mons coagulátus, mons pingvis. 
17 ^ ¿~Ut qvid suspicámini, mòntes coagulátos, mons, in qvo beneplácitum est Deo habitáre in eo~? Ètenim Dòminus habitábit in finem. 
18 ^ Currus Dei dècem mìllibus mùltiplex, mìllia laetántium~; Dòminus in eîs in Sina, in sancto. 
19 ^ Ascensìsti in altum, cepìsti captivitátem, accepìsti dona in homìnibus~; ètenim non credèntes, inhabitáre Dòminum Deum. 
20 ^ Benedìctus Dòminus die qvotídie~; pròsperum ìter fáciet nobîs Deus salutárium nostrórum. 
21 ^ Deus noster, Deus salvos facièndi, et Dòmini, Dòmini èxitûs mortis. 
22 ^ Verùmtamen Deus confrìnǧet cápita inimicórum suórum, vèrticem capìlli perambülántium in delìctîs suîs. 
23 ^ Dixit Dòminus, «~Èx Basáne convèrtem, convèrtem in profùndum maris, 
24 ^ ut intinǧátur pes tuus in sángvine~; lìngva canum tuórum ex inimícîs, ab ìpso.~»
25 ^ Vǐdérunt ingrèssûs tuos, Deus, ingrèssûs Dei mei, reǧis mei qvi est in sancto. 
26 ^ Praevenérunt príncipes conjúncti psallèntibus, in mèdio juvenculárum timpanistriárum. 
27 ^ In ecclésiîs benedícite Deo, Dòmino de fòntibus Israhélis. 
28 ^ Ìbi Benjamin adolescèntulus, in mentis excèssu~; príncipes Judae, duces eórum~; príncipes Zábulon, príncipes Neftáli. 
29 ^ Manda, Deus, virtúti tuae~; confìrma hoc, Deus, qvod operátus es in nobîs. 
30 ^ A templo tuo in Jerusalíme, tìbi òfferent reǧes múnera. 
31 ^ Ìncrepa fèras arùndinis~; congregáṭio taurórum in vaccîs populórum, ut exclúdant eos qvi probáti sunt arǧènto. Dìssipa ǧèntes qvae bella volunt. 
32 ^ Vènient legáti ex Aeǧìpto~; Aetiópia praevèniet manûs ejus Deo. 
33 ^ Regna terrae, cantáte Deo~; psállite Dòmino~; psállite Deo, 
34 ^ qvi ascèndit super caelum caeli, ad orièntem~; ecce dabit voci suae vocem virtútis. 
35 ^ Date glóriam Deo~; super Israhélem magnificènṭia ejus, et vìrtûs ejus in núbibus. 
36 ^ Mirábilis Deus in sanctîs suîs~; Deus Israhélis ìpse dabit virtútem et fortitúdinem plebi suae. Benedìctus Deus. 
