2 ^ Exsùrgat Deus, et dissipèntur inimíci ejus, et fúğiant qui odérunt eum, a fàçie ejus. 
3 ^ sicut défiçit fumus, defìçiant~; sicut fluit cera a fàçie ìgnis, sic pèreant peccatóres a fàçie Dei. 
4 ^ Et justi epulèntur, et exsùltent in conspèctu Dei, et delectèntur in laetìzia. 
5 ^ Cantáte Deo~; psalmum dícite nómini ejus~; ìter fàçite ei qui asçèndit super occásum. Dòminus nomen illi~; exsultáte in conspèctu ejus. 
6 ^ Turbabùntur a fàçie ejus pàtris orphanórum et júdiçis viduárum~; Deus in loco sancto suo. 
7 ^ Deus qui inhabitáre fàçit únius moris in domu~; qui edúcit vinctos in fortitúdine, simìliter eos qui exásperant, qui hábitant in sepùlcrîs. 
8 ^ Deus, quum egrederéris in conspèctu pòpuli tui, quum pertransíres in desèrto, 
9 ^ terra mota est, ètenim çaeli stillavérunt a fàçie Dei Sinae, a fàçie Dei Israhélis. 
10 ^ Plúviam voluntáriam segregábis, Deus, hereditáti tuae, et infirmáta est, tu vero perfeçìsti eam. 
11 ^ Animália tua habitábunt in ea~; paravìsti in dulçédine tua páuperi, Deus. 
12 ^ Dòminus dabit vèrbum evanğelisàntibus, virtúte mùlta. 
13 ^ Rex virtútum dilécti, dilècti, et speçiéi domûs dividére spólia. 
14 ^ Si dormiátis inter mèdios cleros, pennae colùmbae dearğentátae, et posterióra dorsi ejus in pallóre auri. 
15 ^ Dum disçèrnit çaelèstis reğes super eam, nive dealbabùntur in Selmon. 
16 ^ Mons Dei, mons pinguis~; mons coagulátus, mons pinguis. 
17 ^ ¿~Ut quid suspicámini, mòntes coagulátos, mons, in quo benepláçitum est Deo habitáre in eo~? Ètenim Dòminus habitábit in finem. 
18 ^ Currus Dei dèçem mìllibus mùltiplex, mìllia laetàntium~; Dòminus in eîs in Sina, in sancto. 
19 ^ Asçensìsti in altum, çepìsti captivitátem, acçepìsti dona in homìnibus~; ètenim non credèntes, inhabitáre Dòminum Deum. 
20 ^ Benedìctus Dòminus die quotídie~; pròsperum ìter fàçiet nobîs Deus salutárium nostrórum. 
21 ^ Deus noster, Deus sàlvos façièndi, et Dòmini, Dòmini èxitûs mortis. 
22 ^ Verùmtamen Deus confrìnget cápita inimicórum suórum, vèrticem capìlli perambulàntium in delìctîs suîs. 
23 ^ Dixit Dòminus, «~Èx Basáne convèrtem, convèrtem in profùndum maris, 
24 ^ ut intingátur pes tuus in sánguine~; lìngua cànum tuórum ex inimícîs, ab ìpso.~»
25 ^ Vidérunt ingrèssûs tuos, Deus, ingrèssûs Dei mei, reğis mei qui est in sancto. 
26 ^ Praevenérunt prínçipes conjúncti psallèntibus, in mèdio juvenculárum timpanistriárum. 
27 ^ In ecclésiîs benedícite Deo, Dòmino de fòntibus Israhélis. 
28 ^ Ìbi Beniamínus adolesҫèntulus, in mentis exçèssu~; prínçipes Judae, duces eórum~; prínçipes Sabulónis, prínçipes Nefthalími. 
29 ^ Manda, Deus, virtúti tuae~; confìrma hoc, Deus, quod operátus es in nobîs. 
30 ^ A templo tuo in Jerosólima, tìbi òfferent reğes múnera. 
31 ^ Ìncrepa fèras arùndinis~; congregázio taurórum in vaccîs populórum, ut exclúdant eos qui probáti sunt arğènto. Dìssipa ğèntes quae bella volunt. 
32 ^ Vènient legáti ex Aeğìpto~; Aethiópia praevèniet mànûs ejus Deo. 
33 ^ Regna terrae, cantáte Deo~; psàllite Dòmino~; psàllite Deo, 
34 ^ qui asçèndit super çaelum çaeli, ad orièntem~; ecçe dabit voçi suae voçem virtútis. 
35 ^ Date glóriam Deo~; super Israhélem magnifiçènzia ejus, et vìrtûs ejus in núbibus. 
36 ^ Mirábilis Deus in sanctîs suîs~; Deus Israhélis ìpse dabit virtútem et fortitúdinem plebi suae. Benedìctus Deus. 
