1 ^ In te Dòmine sperávi, non confùndar in aetèrnum. 
2 ^ In justìzia tua líbera me, et éripe me~; inclína ad me aurem tuam, et sàlva me. 
3 ^ Esto mìhi in Deum protectórem, et in locum munítum, ut sàlvum me fàçias, qüóniam firmamèntum meum et refúğium meum es tu. 
4 ^ Deus meus, éripe me de mànu peccatóris, et de mànu còntra leğem agèntis et iníqüi, 
5 ^ qüóniam tu es patiènzia mea, Dòmine~; Dòmine, spes mea ab juventúte mea. 
6 ^ In te confirmátus sum ex útero~; de vèntre matris meae tu es protéctor meus~; in te cantázio mea sèmper. 
7 ^ Tàmqüam prodìğium factus sum mùltîs, et tu adjútor fortis. 
8 ^ Repleátur os meum laude, ut cantem glóriam tuam~; tota die magnitúdinem tuam. 
9 ^ Ne projìçias me in tèmpore senectútis~; qüum deféçerit vìrtûs mea, ne derelìnqüas me. 
10 ^ Qüia dixérunt inimíci mei mìhi, et qüi custodiébant ànimam meam consìlium feçérunt in unum, 
11 ^ dicèntes, «~Deus derelíqüit eum~; perseqüìmini et comprehèndite eum, qüia non est qüi erìpiat.~»
12 ^ Deus, ne elongéris a me~; Deus meus, in auxìlium meum rèspiçe. 
13 ^ Confundàntur et defìçiant detrahèntes ànimae meae~; operiàntur confusióne et pudóre qüi qüaerunt màla mìhi. 
14 ^ Ego autem sèmper sperábo, et adjìçiem super òmnem laudem tuam. 
15 ^ Os meum adnunziábit justìziam tuam, tota die salutáre tuum, qüóniam non cognóvi litteratúram. 
16 ^ Introíbo in potènzias Dòmini~; Dòmine, memorábor justìziae tuae sólius. 
17 ^ Deus, docuìsti me ab juventúte mea, et usqüe nunc pronunziábo mirabìlia tua. 
18 ^ Et usqüe in senèctam et sènium, Deus, ne derelìnqüas me, donec adnúnziem bráchium tuum ğenerazióni òmni qüae ventúra est. 
19 ^ Potènziam tuam et justìziam tuam Deus usqüe in altìssima, qüae feçìsti magnália~; ¿~Deus qüìs sìmilis tìbi~? 
20 ^ Qüantas ostensìsti mìhi tribulaziónes mùltas et màlas, et convèrsus vivificavìsti me, et de abỳssîs terrae ìterum reduxìsti me. 
21 ^ Multiplicavìsti magnifiçènziam tuam, et convèrsus consolátus es me. 
22 ^ Nam et ego confitébor tìbi in vasîs psalmi veritátem tuam, Deus~; psallem tìbi in zìthara, sanctus Israhélis. 
23 ^ Exsultábunt lábia mea qüum cantávero tìbi, et ànima mea qüam redemìsti. 
24 ^ Sed et lìngüa mea tota die meditábitur justìziam tuam, qüum confúsi et revèriti fúerint qüi qüaerunt màla mìhi. 
