1 ^ In te Dòmine sperávi, non confùndar in aĕtèrnum. ^ In thee, O Lord, I have hoped, let me never be put to confusion.
2 ^ In justìția tua líbera me, et éripe me~; inclína ad me aŭrem tuam, et salva me. ^ Deliver me in thy justice, and rescue me~; incline thy ear unto me, and save me.
3 ^ Esto mìhi in Deum protectórem, et in locum munítum, ut salvum me fácias, qŭóniam firmamèntum meum et refúgium meum es tu. ^ Be thou unto me a God, a protector, and a place of strength, that thou mayst make me safe, for thou art my firmament and my refuge.
4 ^ Deus meus, éripe me de manu peccatóris, et de manu contra legem agèntis et iníqŭi, ^ Deliver me, O my God, out of the hand of the sinner, and out of the hand of the transgressor of the law and of the unjust,
5 ^ qŭóniam tu es pațiènția mea, Dòmine~; Dòmine, spes mea a juventúte mea. ^ for thou art my patience, O Lord~; my hope, O Lord, from my youth.
6 ^ In te confirmátus sum ex útero~; de vèntre matris meaĕ tu es protéctor meus~; in te cantáțio mea sèmper. ^ By thee have I been confirmed from the womb~; from my mother's womb thou art my protector~; in thee is my song always.
7 ^ Tamqŭam prodìgium factus sum mùltîs, et tu adjútor fortis. ^ I am become unto many as a wonder, but thou art a strong helper.
8 ^ Repleátur os meum laŭde, ut cantem glóriam tuam~; tota die magnitúdinem tuam. ^ Let my mouth be filled with praise, that I may sing thy glory~; thy greatness all the day long.
9 ^ Ne projìcias me in tèmpore senectútis~; qŭum defécerit vìrtûs mea, ne derelìnqŭas me. ^ Cast me not off in the time of old age~; when my strength shall fail, do not thou forsake me.
10 ^ Qŭia dixérunt inimíci mei mìhi, et qŭi custodiébant ánimam meam consìlium fecérunt in unum, ^ For my enemies have spoken against me~; and they that watched my soul have consulted together,
11 ^ dicèntes, «~Deus derelíqŭit eum~; perseqŭìmini et comprehèndite eum, qŭia non est qŭi erìpiat.~»^ Saying, "God hath forsaken him~; pursue and take him, for there is none to deliver him."
12 ^ Deus, ne elongéris a me~; Deus meus, in aŭxìlium meum rèspice. ^ O God, be not thou far from me~; O my God, make haste to my help.
13 ^ Confundántur et defìciant detrahèntes ánimaĕ meaĕ~; operiántur confusióne et pudóre qŭi qŭaĕrunt mala mìhi. ^ Let them be confounded and come to nothing that detract my soul~; let them be covered with confusion and blame that seek my hurt.
14 ^ Ego aŭtem sèmper sperábo, et adjìciem super òmnem laŭdem tuam. ^ But I will always hope, and will add to all thy praise.
15 ^ Os meum adnunțiábit justìțiam tuam, tota die salutáre tuum, qŭóniam non cognóvi litteratúram. ^ My mouth shall show forth thy justice, thy salvation all the day long, because I have not known learning.
16 ^ Introíbo in potènțias Dòmini~; Dòmine, memorábor justìțiaĕ tuaĕ sólius. ^ I will enter into the powers of the Lord~; O Lord, I will be mindful of thy justice alone.
17 ^ Deus, docuìsti me a juventúte mea, et usqŭe nunc pronunțiábo mirabìlia tua. ^ Thou hast taŭght me, O God, from my youth, and till now I will declare thy wonderful works.
18 ^ Et usqŭe in senèctam et sènium, Deus, ne derelìnqŭas me, donec adnúnțiem bráchium tuum generațióni òmni qŭaĕ ventúra est. ^ And unto old age and grey hairs, O God, forsake me not, until I show forth thy arm to all the generation that is to come.
19 ^ Potènțiam tuam et justìțiam tuam Deus usqŭe in altìssima, qŭaĕ fecìsti magnália~; ¿~Deus qŭìs sìmilis tìbi~? ^ Thy power and thy justice, O God, even to the highest great things thou hast done~; O God, who is like to thee~?
20 ^ Quantas ostensìsti mìhi tribulațiónes mùltas et malas, et convèrsus vivificavìsti me, et de abìssîs terraĕ ìterum reduxìsti me. ^ How great troubles, many and grievous, hast thou shown me, and turning thou hast brought me to life, and hast brought me back again from the depths of the earth.
21 ^ Multiplicavìsti magnificènțiam tuam, et convèrsus consolátus es me. ^ Thou hast multiplied thy magnificence, and turning to me thou hast comforted me.
22 ^ Nam et ego confitébor tìbi in vasîs psalmi veritátem tuam, Deus~; psallem tìbi in cìttara, sanctus Israhélis. ^ For I will also confess to thee thy truth with the instruments of psaltery, O God~; I will sing to thee with the harp, thou holy one of Israel.
23 ^ Exsultábunt lábia mea qŭum cantávero tìbi, et ánima mea qŭam redemìsti. ^ My lips shall greatly rejoice when I shall sing to thee~; and my soul which thou hast redeemed.
24 ^ Sed et lingŭa mea tota die meditábitur justìțiam tuam, qŭum confúsi et revèriti fúerint qŭi qŭaĕrunt mala mìhi. ^ Yea and my tongue shall meditate on thy justice all the day, when they shall be confounded and put to shame that seek evils to me.
