2 ^ Deus, judìcium tuum reǧi da, et justìṭiam tuam fílio reǧis~; 
3 ^ judicáre pòpulum tuum in justìṭia, et páuperes tuos in judìcio. 
4 ^ Suscìpiant mòntes pacem pòpulo, et colles justìṭiam. 
5 ^ Judicábit páuperes pòpuli, et salvos fáçiet fílios páuperum, et humiliábit calumniatórem. 
6 ^ Et permanébit cum sole, et ante lunam, in ǧeneraṭióne et ǧeneraṭiónem. 
7 ^ Descèndet sicut plúvia in vellus, et sicut stillicádia stillántia super terram. 
8 ^ Oriétur in diébus ejus justìṭia, et abundánṭia pacis, donec auferátur luna. 
9 ^ Et dominábitur a mari usqụe ad mare, et a flúmine usqụe ad tèrminos orbis terrárum. 
10 ^ Coram illo prócadent Aetiópes, et inimíci ejus terram lìnǧent. 
11 ^ Reǧes Tarsis et ìnsulae múnera òfferent~; reǧes Arábum et Saba dona addúcent. 
12 ^ Et adorábunt eum òmnes reǧes terrae~; òmnes ǧèntes sèrvient ei. 
13 ^ Qụia liberábit páuperem a potènte, et páuperem cui non èrat adjútor. 
14 ^ Parcet páuperi et ìnopi, et ánimas páuperum salvas fáçiet. 
15 ^ Èx usúrîs et iniqụitáte rèdimet ánimas eórum, et honorábile nomen eórum coram illo. 
16 ^ Et vivet, et dábitur ei de auro Arábiae, et adorábunt de ìpso sèmper~; tota die benedícent ei. 
17 ^ Et èrit firmamèntum in terra in summîs mòntium~; superextollétur super Lìbanum fructus ejus, et florébunt de civitáte sicut foenum terrae. 
18 ^ Sit nomen ejus benedìctum in sáecula~; ante solem pèrmanet nomen ejus. Et benedicèntur in ìpso òmnes trìbûs terrae~; òmnes ǧèntes magnificábunt eum. 
19 ^ Benedìctus Dòminus, Deus Israhélis, qụi façit mirabìlia solus. 
20 ^ Et benedìctum nomen majestátis ejus in aetèrnum, et replébitur majestáte ejus òmnis terra. Fiat, fiat. 
