2 ^ Confitébimur tìbi, Deus~; confitébimur, et invocábimus nomen tuum~; narrábimus mirabìlia tua. ^ We will praise thee, O God~; we will praise, and we will call upon thy name~; we will relate thy wondrous works.
3 ^ Qŭum accépero tempus, ego justìțias judicábo. ^ When I shall take a time, I will judge justices.
4 ^ Liqŭefácta est terra et òmnes qŭi hábitant in ea~; ego confirmávi colùmnas ejus. ^ The earth is melted and all that dwell therein~; I have established the pillars thereof.
5 ^ Dixi iníqŭîs, «~Nolíte iníqŭe áǧere~», et delinqŭèntibus, «~Nolíte exaltáre cornu, ^ I said to the wicked, "Do not act wickedly," and to the sinners, "Lift not up the horn,
6 ^ nolíte extòllere in altum cornu vèstrum~; nolíte loqŭi advèrsus Deum iniqŭitátem.~»^ lift not up your horn on high~; speak not iniquity against God."
7 ^ Qŭia nèqŭe ab oriènte, nèqŭe ab occidènte, nèqŭe a desèrtîs mòntibus, ^ For neither from the east, nor from the west, nor from the desert hills,
8 ^ qŭóniam Deus judex est. Hunc humìliat, et hunc exáltat~; ^ For God is the judge. One he putteth down, and another he lifteth up~;
9 ^ qŭia calix in manu Dòmini vini mèri plénus mìxto, et inclinávit ex hoc in hoc, verùmtamen faĕx ejus non est exinaníta~; bibent òmnes peccatóres terraĕ. ^ for in the hand of the Lord there is a cup of strong wine full of mixture, and he hath poured it out from this to that, but the dregs thereof are not emptied~; all the sinners of the earth shall drink.
10 ^ Ego aŭtem adnunțiábo in sáĕculum~; cantábo Deo Jacóbis~; ^ But I will declare for ever~; I will sing to the God of Jacob~;
11 ^ et òmnia cornua peccatórum confrìnǧem, et exaltabùntur córnua justi. ^ and I will break all the horns of sinners, but the horns of the just shall be exalted.
