2 ^ Confitēbimur tibī, Deus~; confitēbimur, et invocābimus nōmen tuum~; narrābimus mīrābilia tua. ^ We will praise thee, O God~; we will praise, and we will call upon thy name~; we will relate thy wondrous works.
3 ^ Quum accēperō tempus, egō jūstitiās jūdicābō. ^ When I shall take a time, I will judge justices.
4 ^ Liquefacta est terra et omnēs quī habitant in eā~; egō confirmāvī columnās ejus. ^ The earth is melted and all that dwell therein~; I have established the pillars thereof.
5 ^ Dīxī inīquīs, «~Nōlīte inīquē agere~», et dēlinquentibus, «~Nōlīte exaltāre cornū, ^ I said to the wicked, "Do not act wickedly," and to the sinners, "Lift not up the horn,
6 ^ nōlīte extollere in altum cornū vestrum~; nōlīte loquī adversus Deum inīquitātem.~»^ lift not up your horn on high~; speak not iniquity against God."
7 ^ Quia neque ab oriente, neque ab occidente, neque ā dēsertīs montibus, ^ For neither from the east, nor from the west, nor from the desert hills,
8 ^ quoniam Deus jūdex est. Hunc humiliat, et hunc exaltat~; ^ For God is the judge. One he putteth down, and another he lifteth up~;
9 ^ quia calix in manū Dominī vīnī merī plēnus mixtō, et inclīnāvit ex hōc in hōc, vērumtamen faex ejus nōn est exinānīta~; bibent omnēs peccātōrēs terrae. ^ for in the hand of the Lord there is a cup of strong wine full of mixture, and he hath poured it out from this to that, but the dregs thereof are not emptied~; all the sinners of the earth shall drink.
10 ^ Egō autem adnūntiābō in saeculum~; cantābō Deō Jācōbis~; ^ But I will declare for ever~; I will sing to the God of Jacob~;
11 ^ et omnia cornua peccātōrum confringem, et exaltābuntur cornua jūstī. ^ and I will break all the horns of sinners, but the horns of the just shall be exalted.
