2 ^ Notus in Judéa Deus~; in Israhéle magnum nomen ejus. ^ In Judea God is known~; his name is great in Israel.
3 ^ Et factus est in pace locus ejus, et habitátio ejus in Sióne. ^ And his place is in peace, and his abode in Sion.
4 ^ Ìbi confrégit potèntias árcuum, scutum, gládium, et bellum. ^ There hath he broken the powers of bows, the shield, the sword, and the battle.
5 ^ Illúminans tu mirabìliter a mòntibus aĕtèrnîs. ^ Thou enlightenest wonderfully from the everlasting hills.
6 ^ Turbáti sunt òmnes insapièntes corde~; dormivérunt somnum suum, et nìhil invenérunt òmnes vìri divitiárum in mánibus suîs. ^ All the foolish of heart were troubled~; they have slept their sleep, and all the men of riches have found nothing in their hands.
7 ^ Ab increpatióne tua, Deus Jacóbis, dormitavérunt qŭi ascensérunt èqŭos. ^ At thy rebuke, O God of Jacob, they have all slumbered that mounted on horseback.
8 ^ Tu terrìbilis es, ¿~et qŭìs resìstet tìbi~? Èx tunc ira tua. ^ Thou art terrible, and who shall resist thee~? From that time is thy wrath.
9 ^ De caĕlo aŭdítum fecìsti judìcium~; terra trémuit et quiévit, ^ Thou hast caused judgment to be heard from heaven~; the earth trembled and was still,
10 ^ qŭum exsurgéret in judìcium Deus, ut salvos fáceret òmnes mansuétos terraĕ. ^ when God arose in judgment, to save all the meek of the earth.
11 ^ Qŭóniam cogitátio hòminis confitébitur tìbi, et relìquiaĕ cogitatiónis diem festum agent tìbi. ^ For the thought of man shall give praise to thee, and the remainders of the thought shall keep holiday to thee.
12 ^ Vovéte et rèddite Dòmino Deo vèstro~; òmnes qŭi in circùmitu ejus affèrtis múnera terrìbili, ^ Vow ye, and pay to the Lord your God~; all you that are round about him bring presents to him that is terrible,
13 ^ et ei qŭi aŭfert spíritum princìpium~; terrìbili apud reges terraĕ. ^ and to him who taketh away the spirit of princes~; to the terrible before the kings of the earth.
