2 ^ Voče mea ad Dòminum clamávi~; voče mea ad Deum, et intèndit mìhi. 
3 ^ In die tribulaziónis meae Deum exquisívi, mànibus meïs nòcte còntra eum, et non sum dečèptus~; renúvit consolári ànima mea. 
4 ^ Mèmor fui Dei, et delectátus sum, et exerčitátus sum, et deféčit spíritus meus. 
5 ^ Antičipavérunt viğìlias òculi mei~; turbátus sum, et non sum locútus. 
6 ^ Coğitávi dies antíquos, et annos aetèrnos in mente hábui, 
7 ^ Et meditátus sum nòcte cum corde meo, et exerčitábar, et inspičiébam spíritum meum. 
8 ^ ¿~Numquid in aetèrnum projìčiet Deus, et non appónet ut complačìtior sit adhüc~? 
9 ^ ¿~Aut in finem misericórdiam suam absčìndet, a ğenerazióne in ğeneraziónem~? 
10 ^ ¿~Aut obliviscétur miseréri Deus~? ¿~Aut continébit in ira sua misericórdias suas~? 
11 ^ Et dixi, «~Nunc coepi~; haec mutázio dèxterae Exčèlsi.~»
12 ^ Mèmor fui óperum Dòmini, quia mèmor èro ab inìzio mirabílium tuórum, 
13 ^ et meditábor in òmnibus opèribus tuïs, et in adinvenziónibus tuïs exerčébor. 
14 ^ Deus, in sancto via tua~; ¿~quìs Deus magnus sicut Deus noster~? 
15 ^ Tu es Deus qui fàčis mirabìlia~; notam fečìsti in pòpulïs virtútem tuam. 
16 ^ Redemìsti in bráchio tuo pòpulum tuum, fílios Jacóbi et Joséphi. 
17 ^ Vïdérunt te aquae, Deus~; vïdérunt te aquae, et timuérunt, et turbátae sunt abỳssi. 
18 ^ Multitúdo sonátüs aquárum~; vočem dedérunt nubes, ètenim sağìttae tuae trànseunt. 
19 ^ Vox tonìtrui tui in rota~; illuxérunt coruscaziónes tuae orbi terrae~; commóta est, et contrèmuit terra. 
20 ^ In mari via tua, et sémitae tuae in aquïs mùltïs, et vestíğia tua non cognoscèntur. 
21 ^ Deduxìsti sicut oves pòpulum tuum, in mànu Moýsis et Aharónis. 
