2 ^ Voçe mea ad Dòminum clamávi~; voçe mea ad Deum, et intèndit mìhi. 
3 ^ In die tribulaziónis meae Deum exqüisívi, mànibus meîs nòcte còntra eum, et non sum deçèptus~; renúvit consolári ànima mea. 
4 ^ Mèmor fui Dei, et delectátus sum, et exerçitátus sum, et deféçit spíritus meus. 
5 ^ Antiçipavérunt viğìlias òculi mei~; turbátus sum, et non sum locútus. 
6 ^ Coğitávi dies antíqüos, et annos aetèrnos in mente hábui, 
7 ^ Et meditátus sum nòcte cum corde meo, et exerçitábar, et inspiçiébam spíritum meum. 
8 ^ ¿~Numqüid in aetèrnum projìçiet Deus, et non appónet ut complaçìtior sit adhûc~? 
9 ^ ¿~Aut in finem misericórdiam suam absçìndet, a ğenerazióne in ğeneraziónem~? 
10 ^ ¿~Aut obliviscétur miseréri Deus~? ¿~Aut continébit in ira sua misericórdias suas~? 
11 ^ Et dixi, «~Nunc coepi~; haec mutázio dèxterae Exçèlsi.~»
12 ^ Mèmor fui óperum Dòmini, qüia mèmor èro ab inìzio mirabílium tuórum, 
13 ^ et meditábor in òmnibus opèribus tuîs, et in adinvenziónibus tuîs exerçébor. 
14 ^ Deus, in sancto via tua~; ¿~qüìs Deus magnus sicut Deus noster~? 
15 ^ Tu es Deus qüi fàçis mirabìlia~; notam feçìsti in pòpulîs virtútem tuam. 
16 ^ Redemìsti in bráchio tuo pòpulum tuum, fílios Jacóbi et Joséphi. 
17 ^ Vîdérunt te aqüae, Deus~; vîdérunt te aqüae, et timuérunt, et turbátae sunt abỳssi. 
18 ^ Multitúdo sonátûs aqüárum~; voçem dedérunt nubes, ètenim sağìttae tuae trànseunt. 
19 ^ Vox tonìtrui tui in rota~; illuxérunt coruscaziónes tuae orbi terrae~; commóta est, et contrèmuit terra. 
20 ^ In mari via tua, et sémitae tuae in aqüîs mùltîs, et vestíğia tua non cognoscèntur. 
21 ^ Deduxìsti sicut oves pòpulum tuum, in mànu Moýsis et Aharónis. 
