1 ^ Attèndite, pòpule meus, leǧem meam~; inclináte aurem vèstram in vèrba oris mei. 
2 ^ Apèriem in parábolïs os meum~; loquer proposiziónes ab inìzio. 
3 ^ Quanta audívimus, et cognóvimus ea, et pàtres nostri narravérunt nobïs. 
4 ^ Non sunt occultáta a fíliïs eórum in ǧenerazióne àltera. Narràntes laudes Dòmini, et virtútes ejus, et mirabìlia ejus quae fečit. 
5 ^ Et susčitávit testimónium in Jacóbe, et leǧem pósuit in Israhéle, quanta mandávit pàtribus nostrïs nota fàčere ea fíliïs suïs, 
6 ^ ut cognóscat ǧenerázio àltera, fílii qui nascèntur, et exsùrgent et narrábunt fíliïs suïs, 
7 ^ ut pónant in Deo spem suam, et non obliviscàntur óperum Dei, et mandáta ejus exquírant, 
8 ^ ne fiant sicut pàtres eórum, ǧenerázio práva et exásperans, ǧenerázio quae non diréxit cor suum, et non est créditus cum Deo spíritüs ejus. 
9 ^ Fílii Ephrémi intendèntes et mittèntes arcum~; convèrsi sunt in die belli. 
10 ^ Non custodivérunt testamèntum Dei, et in leǧe ejus noluérunt ambuláre. 
11 ^ Et oblíti sunt benefactórum ejus, et mirabílium ejus quae ostènsit eïs, 
12 ^ coram pàtribus eórum fečit mirabìlia in terra Aeǧỳpti, in campo Tanis. 
13 ^ Interrúpit mare, et perdúxit eos~; statúvit aquas quasi in utre, 
14 ^ et dedúxit eos in nube diéi, et tota nòcte in illúminazióne ìgnis. 
15 ^ Interrúpit pètram in erémo, et adaquávit eos vèlut in abỳsso mùlto. 
16 ^ Et edúxit aquam de pètra, et dedúxit tàmquam flúmina aquas. 
17 ^ Et apposuérunt adhüc peccáre ei~; in iram exčitavérunt Exčèlsum in inaquóso. 
18 ^ Et tentavérunt Deum in córdibus suïs, ut pèterent escas animábus suïs. 
19 ^ Et male locúti sunt de Deo, et dixérunt, «~¿~Numquid póterit Deus paráre mènsam in desèrto~?~». 
20 ^ Quóniam percùssit pètram, et fluxérunt aquae, et torrèntes inundavèrunt. ¿~Numquid et panem póterit dare, aut paráre mènsam pòpulo suo~? 
21 ^ Ìdeo audívit Dòminus, et dìstulit, et ìgnis acčènsus est in Jacóbe, et ira asčènsit in Israhéle. 
22 ^ Quia non credidérunt in Deo, nec speravérunt in salutári ejus. 
23 ^ Et mandávit núbibus désuper, et jánuas čaeli apèruit. 
24 ^ Et plúvit illïs mannam ad manducándum, et panem čaeli dèdit eïs. 
25 ^ Panem anǧelórum manducávit hòmo~; čibária misit eïs in abundànzia. 
26 ^ Trànstulit austrum de čaelo, et indúxit in virtúte sua Áfricum. 
27 ^ Et pluvit super eos sicut pùlverem càrnes, et sicut arénam maris vulatìlia pennáta. 
28 ^ Et caduérunt in mèdio castrórum eórum, čìrca tabernácula eórum. 
29 ^ Et manducavérunt, et saturáti sunt nìmis, et desidèrium eórum àttulit eïs~; 
30 ^ non sunt fraudáti a desidèrio suo. Adhüc escae eórum èrant in ore ipsórum, 
31 ^ et ira Dei asčènsit super eos, et occáesit pìngües eórum, et eléctos Israhélis impedívit. 
32 ^ In òmnibus hïs peccavérunt adhüc, et non credidérunt in mirabìlibus ejus. 
33 ^ Et defečérunt in vanitáte dies eórum, et anni eórum cum festinazióne. 
34 ^ Quum occáederet eos, quaerébant eum, et revertebàntur, et dilúculo věniébant ad eum. 
35 ^ Et rememoráti sunt quia Deus adjútor est eórum, et Deus exčèlsus redèmptor eórum est. 
36 ^ Et dilexérunt eum in ore suo, et lìngüa sua mentíti sunt ei. 
37 ^ Cor autem eórum non èrat rectum cum eo, nec fidéles hábiti sunt in testamènto ejus. 
38 ^ Ìpse autem est misèricors, et propìzius fíet peccátïs eórum, et non dispèrdet eos, et abundávit ut avèrteret iram suam, et non acčèndit òmnem iram suam. 
39 ^ Et recordátus est quia càro sunt, spíritus vadens et non rèdiens. 
40 ^ Quóziens exačerbavérunt eum in desèrto~; in iram cončitavérunt eum in inaquóso. 
41 ^ Et convèrsi sunt, et tentavérunt Deum, et sanctum Israhélis exačerbavérunt. 
42 ^ Non sunt recordáti mànüs ejus, die qua redémit eos de mànu tribulàntis~; 
43 ^ sicut pósuit in Aeǧỳpto sìgna sua, et prodìǧia sua in campo Tanis. 
44 ^ Et convèrsit in sángüinem flúmina eórum, et imbres eórum, ne bìberent. 
45 ^ misit in eos chynómiam, et comédit eos, et ranam, et dispèrdidit eos. 
46 ^ Et dèdit aerúgini fructüs eórum, et labóres eórum locústae. 
47 ^ Et occáesit in grándine víneas eórum, et moros eórum in pruína. 
48 ^ Et trádidit grándini jumènta eórum, et possessiónem eórum ìgni. 
49 ^ misit in eos iram indignaziónis suae, indignaziónem et iram et tribulaziónem, immissiónes per ànǧelos màlos. 
50 ^ Viam fečit sémitae irae suae~; non pepèrcit a morte animábus eórum, et jumènta eórum in morte conclúsit. 
51 ^ Et percùssit omne primoǧènitum in terra Aeǧỳpti~; primìzias òmnis labóris eórum in tabernáculïs Čami. 
52 ^ Et àbstulit sicut oves pòpulum suum, et perdúxit eos tàmquam grèǧem in desèrto. 
53 ^ Et dedúxit eos in spe, et non timuérunt, et inimícos eórum opèruit mare. 
54 ^ Et indúxit eos in mòntem sanctificaziónis suae, mòntem quem acquisívit dèxtera ejus. 
55 ^ Et ejéčit a fàčie eórum ǧèntes, et sorte divísit eïs terram in funículo distribuziónis, et habitáre fečit in tabernáculïs eórum trìbüs Israhélis. 
56 ^ Et tentavérunt, et exačerbavérunt Deum exčèlsum, et testimónia ejus non custodivérunt. 
57 ^ Et avertérunt se, et non servavérunt pactum, quemádmodum pàtres eórum~; convèrsi sunt in arcum pravum. 
58 ^ In iram cončitavérunt eum in còllibus suïs, et in sculptìlibus suïs ad aemulaziónem eum provocavérunt. 
59 ^ Audívit Deus, et sprevit, et ad nìhilum redégit vàlde Israhélem. 
60 ^ Et rèpulit tabernáculum Silónis, tabernáculum suum, ubi habitávit in homìnibus. 
61 ^ Et trádidit in captivitátem virtútem eórum, et pulchritúdinem eórum in mànüs inimíci. 
62 ^ Et conclúsit in glàdio pòpulum suum, et hereditátem suam sprevit. 
63 ^ Júvenes eórum comédit ignïs, et vìrǧines eórum non sunt lamentátae. 
64 ^ Sačerdótes eórum in glàdio caduérunt, et vìduae eórum non plorabàntur. 
65 ^ Et exčitátus est tàmquam dormiens Dòminus, tàmquam potens crapulátus a vino. 
66 ^ Et percùssit inimícos suos in posterióra~; oppróbrium sempitèrnum dédit illïs. 
67 ^ Et rèpulit tabernáculum Joséphi, et trìbum Ephraímis non elégit, 
68 ^ sed elégit trìbum Judae, mòntem Siónis quem diléxit. 
69 ^ Et aedificávit sicut unicórnium sanctifìčium suum, in terra quam fundávit in sáecula. 
70 ^ Et elégit Davídem servum suum, et sùstulit eum de grèǧibus óvium~; 
71 ^ De post fetàntes acčépit eum, pásčere Jacóbem servum suum, et Israhélem hereditátem suam. 
72 ^ Et pávit eos in innočènzia cordis sui, et in intelléctibus mànuum suárum dedúxit eos. 
