1 ^ Attèndite, pòpule meus, legem meam~; inclináte aurem vèstram in vèrba oris mei. 
2 ^ Apèriem in parábolîs os meum~; loqver proposiziónes ab inìzio. 
3 ^ Qvanta audívimus, et cognóvimus ea, et patres nostri narravérunt nobîs. 
4 ^ Non sunt occultáta a fíliîs eórum in generazióne áltera. Narrántes laudes Dòmini, et virtútes ejus, et mirabìlia ejus qvae feçit. 
5 ^ Et susçitávit testimónium in Jacóbe, et legem pósuit in Israhéle, qvanta mandávit pátribus nostrîs nota fáçere ea fíliîs suîs, 
6 ^ ut cognósçat generázio áltera, fílii qvi nasçèntur, et exsùrgent et narrábunt fíliîs suîs, 
7 ^ ut pónant in Deo spem suam, et non oblivisçántur óperum Dei, et mandáta ejus exqvírant, 
8 ^ ne fiant sicut patres eórum, generázio práva et exásperans, generázio qvae non diréxit cor suum, et non est créditus cum Deo spíritûs ejus. 
9 ^ Fílii Efrémi intendèntes et mittèntes arcum~; convèrsi sunt in die belli. 
10 ^ Non custodivérunt testamèntum Dei, et in lege ejus noluérunt ambuláre. 
11 ^ Et oblíti sunt benefactórum ejus, et mirabílium ejus qvae ostènsit eîs, 
12 ^ coram pátribus eórum feçit mirabìlia in terra Aegìpti, in campo Tanis. 
13 ^ Interrúpit mare, et perdúxit eos~; statúvit aqvas qvasi in utre, 
14 ^ et dedúxit eos in nube diéi, et tota nòcte in illúminazióne ìgnis. 
15 ^ Interrúpit pètram in erémo, et adaqvávit eos vèlut in abìsso mùlto. 
16 ^ Et edúxit aqvam de pètra, et dedúxit tamqvam flúmina aqvas. 
17 ^ Et apposuérunt adhûc peccáre ei~; in iram excitavérunt Exçèlsum in inaqvóso. 
18 ^ Et tentavérunt Deum in córdibus suîs, ut pèterent escas animábus suîs. 
19 ^ Et male locúti sunt de Deo, et dixérunt, «~¿~Numqvid póterit Deus paráre mensam in desèrto~?~». 
20 ^ Qvóniam percùssit pètram, et fluxérunt aqvae, et torrèntes inundavèrunt. ¿~Numqvid et panem póterit dare, aut paráre mensam pòpulo suo~? 
21 ^ Ìdeo audívit Dòminus, et dìstulit, et ìgnis acçènsus est in Jacóbe, et ira asçènsit in Israhéle. 
22 ^ Qvia non credidérunt in Deo, nec speravérunt in salutári ejus. 
23 ^ Et mandávit núbibus désuper, et jánuas caeli apèruit. 
24 ^ Et plúvit illîs mannam ad manducándum, et panem caeli dèdit eîs. 
25 ^ Panem angelórum manducávit hòmo~; cibária misit eîs in abundánzia. 
26 ^ Tránstulit austrum de caelo, et indúxit in virtúte sua Áfricum. 
27 ^ Et pluvit super eos sicut pùlverem carnes, et sicut arénam maris vulatìlia pennáta. 
28 ^ Et caduérunt in mèdio castrórum eórum, cìrca tabernácula eórum. 
29 ^ Et manducavérunt, et saturáti sunt nìmis, et desidèrium eórum áttulit eîs~; 
30 ^ non sunt fraudáti a desidèrio suo. Adhûc escae eórum èrant in ore ipsórum, 
31 ^ et ira Dei asçènsit super eos, et occáesit pingves eórum, et eléctos Israhélis impedívit. 
32 ^ In òmnibus hîs peccavérunt adhûc, et non credidérunt in mirabìlibus ejus. 
33 ^ Et defeçérunt in vanitáte dies eórum, et anni eórum cum festinazióne. 
34 ^ Qvum occáederet eos, qvaerébant eum, et revertebántur, et dilúculo věniébant ad eum. 
35 ^ Et rememoráti sunt qvia Deus adjútor est eórum, et Deus exçèlsus redèmptor eórum est. 
36 ^ Et dilexérunt eum in ore suo, et lìngva sua mentíti sunt ei. 
37 ^ Cor autem eórum non èrat rectum cum eo, nec fidéles hábiti sunt in testamènto ejus. 
38 ^ Ìpse autem est misèricors, et propìzius fíet peccátîs eórum, et non dispèrdet eos, et abundávit ut avèrteret iram suam, et non acçèndit òmnem iram suam. 
39 ^ Et recordátus est qvia carnis sunt, spíritus vadens et non rèdiens. 
40 ^ Qvóziens exaçerbavérunt eum in desèrto~; in iram conçitavérunt eum in inaqvóso. 
41 ^ Et convèrsi sunt, et tentavérunt Deum, et sanctum Israhélis exaçerbavérunt. 
42 ^ Non sunt recordáti manûs ejus, die qva redémit eos de manu tribulántis~; 
43 ^ sicut pósuit in Aegìpto sìgna sua, et prodìgia sua in campo Tanis. 
44 ^ Et convèrsit in sángvinem flúmina eórum, et imbres eórum, ne bìberent. 
45 ^ misit in eos cinómiam, et comédit eos, et ranam, et dispèrdidit eos. 
46 ^ Et dèdit aerúgini fructûs eórum, et labóres eórum locùstae. 
47 ^ Et occáesit in grándine víneas eórum, et moros eórum in pruína. 
48 ^ Et trádidit grándini jumènta eórum, et possessiónem eórum ìgni. 
49 ^ misit in eos iram indignaziónis suae, indignaziónem et iram et tribulaziónem, immissiónes per ángelos malos. 
50 ^ Viam feçit sémitae irae suae~; non pepèrcit a morte animábus eórum, et jumènta eórum in morte conclúsit. 
51 ^ Et percùssit omne primogènitum in terra Aegìpti~; primìzias òmnis labóris eórum in tabernáculîs Çami. 
52 ^ Et ábstulit sicut oves pòpulum suum, et perdúxit eos tamqvam grègem in desèrto. 
53 ^ Et dedúxit eos in spe, et non timuérunt, et inimícos eórum opèruit mare. 
54 ^ Et indúxit eos in mòntem sanctificaziónis suae, mòntem qvem acqvisívit dèxtera ejus. 
55 ^ Et ejécit a fáçie eórum gèntes, et sorte divísit eîs terram in funículo distribuziónis, et habitáre feçit in tabernáculîs eórum trìbûs Israhélis. 
56 ^ Et tentavérunt, et exaçerbavérunt Deum exçèlsum, et testimónia ejus non custodivérunt. 
57 ^ Et avertérunt se, et non servavérunt pactum, qvemádmodum patres eórum~; convèrsi sunt in arcum pravum. 
58 ^ In iram conçitavérunt eum in còllibus suîs, et in sculptìlibus suîs ad aemulaziónem eum provocavérunt. 
59 ^ Audívit Deus, et sprevit, et ad nìhilum redégit valde Israhélem. 
60 ^ Et rèpulit tabernáculum Silónis, tabernáculum suum, ubi habitávit in homìnibus. 
61 ^ Et trádidit in captivitátem virtútem eórum, et pulcritúdinem eórum in manûs inimíci. 
62 ^ Et conclúsit in gládio pòpulum suum, et hereditátem suam sprevit. 
63 ^ Júvenes eórum comédit ignîs, et vìrgines eórum non sunt lamentátae. 
64 ^ Saçerdótes eórum in gládio caduérunt, et vìduae eórum non plorabántur. 
65 ^ Et excitátus est tamqvam dormiens Dòminus, tamqvam potens crapulátus a vino. 
66 ^ Et percùssit inimícos suos in posterióra~; oppróbrium sempitèrnum dédit illîs. 
67 ^ Et rèpulit tabernáculum Joséfi, et trìbum Efraímis non elégit, 
68 ^ sed elégit trìbum Judae, mòntem Siónis qvem diléxit. 
69 ^ Et aedificávit sicut unicórnium sanctifìçium suum, in terra qvam fundávit in sáecula. 
70 ^ Et elégit Davídem servum suum, et sùstulit eum de grègibus óvium~; 
71 ^ De post fetántes acçépit eum, pásçere Jacóbem servum suum, et Israhélem hereditátem suam. 
72 ^ Et pávit eos in innoçènzia cordis sui, et in intelléctibus mánuum suárum dedúxit eos. 
