1 ^ Deus, vênérunt ǧèntes in hereditátem tuam~; polluvérunt templum sanctum tuum~; posuérunt Jerúsalim in pomórum custódiam. 
2 ^ Posuérunt morticína servórum tuórum escas vulatìlibus caeli~; carnes sanctórum tuórum béstiîs terrae. 
3 ^ Effudérunt sángụinem eórum tamqụam aqụam in circùmitu Jerusalíme, et non èrat qụi sepelíret. 
4 ^ Facti sùmus oppróbrium vicínîs nostrîs~; subsannáṭio et illúsio hîs qụi in circùmitu nostro sunt. 
5 ^ ¿~Úsqụeqụo, Dòmine~? ¿~Irásceris in finem~? ¿~Accendétur vèlut ìgnis zelus tuus~? 
6 ^ Effùnde iram tuam in ǧèntes qụae te non novérunt, et in regna qụae nomen tuum non invocavérunt, 
7 ^ qụia comedérunt Jacóbem, et locum ejus desolavérunt. 
8 ^ Ne memìnerîs iniqụitátum nostrárum antiqụárum~; cìto antìcipent nos misericórdiae tuae, qụia páuperes facti sùmus nìmis. 
9 ^ Ádjuva nos, Deus salutáris noster, et pròpter glóriam nóminis tui, Dòmine, líbera nos, et propìṭius èsto peccátîs nostrîs, pròpter nomen tuum, 
10 ^ ne forte dicant in ǧèntibus, «~¿~Ubi est Deus eórum~?~», et innotéscat in naṭiónibus coram òculîs nostrîs ùlṭio sángụinis servórum tuórum qụi effúsus est. 
11 ^ Intróeat in conspèctu tuo ǧèmitus compeditórum~; secùndum magnitúdinem bráchii tui pòsside fílios mortificatórum, 
12 ^ et redde vicínîs nostrîs septùplum in sìnu eórum, impropèrium ipsórum qụod exprobravérunt tìbi, Dòmine. 
13 ^ Nos autem pòpulus tuus, et oves páscuae tuae, confitébimur tìbi in sáeculum~; in ǧeneraṭiónem et ǧeneraṭiónem adnunṭiábimus laudem tuam. 
