2 ^ Exsultáte Deo adjutóri nostro~; jubiláte Deo Jacóbis. 
3 ^ Súmite psalmum, et date tìmpanum~; psaltérium jucùndum cum cìttara. 
4 ^ In luna nova bucináte tuba, in die insìgni solemnitátis vèstraĕ, 
5 ^ qụia praĕcèptum in Israhéle est, et judìcium Deo Jacóbis. 
6 ^ Testimónium in Joséfo pósuit illud, qụum exíret de terra Aĕģìpti~; lìngụam qụam non nóverat, aŭdívit. 
7 ^ Divèrtit ab onèribus dorsum ejus~; manûs ejus in còfino servivérunt. 
8 ^ In tribulațióne invocavìsti me, et liberávi te~; exaŭdívi te in abscòndito tempestátis~; probávi te apud aqụam contradicțiónis. 
9 ^ Aŭdi, pòpulus meus, et contestábor te~; Isráhel, si aŭdíverîs me. 
10 ^ Non èrit in te deus rècens, nèqụe adorábis deum aliénum. 
11 ^ Ego ènim sum Dòminus Deus tuus, qụi edúxi te de terra Aĕģìpti~; diláta os tuum, et implébo illud. 
12 ^ Et non aŭdívit pòpulus meus vocem meam, et Isráhel non intèndit mìchi. 
13 ^ Et dimísi eos secùndum desidèria cordis eórum~; ibunt in adinvențiónibus suîs. 
14 ^ Si pòpulus meus aŭdivìsset me, Isráhel si in viîs meîs ambulavìsset, 
15 ^ pro nìhilo fórsitan inimícos eórum humiliavìssem, et super tribulántes eos misìssem manum meam. 
16 ^ Inimíci Dòmini mentíti sunt ei, et èrit tempus eórum in sáĕcula. 
17 ^ Et cibávit eos ex ádipe frumènti, et de pètra, melle saturávit eos. 
