2 ^ Exsultáte Deo adjutóri nostro~; jubiláte Deo Jacóbis. 
3 ^ Súmite psalmum, et date tìmpanum~; psaltérium jucùndum cum cìttara. 
4 ^ In luna nova bucináte tuba, in die insìgni solemnitátis vèstrae, 
5 ^ cvia praecèptum in Israhéle est, et judìcium Deo Jacóbis. 
6 ^ Testimónium in Joséfo pósuit illud, cvum exíret de terra Aeǧìpti~; lìngvam cvam non nóverat, audívit. 
7 ^ Divèrtit ab onèribus dorsum ejus~; manûs ejus in còfino servivérunt. 
8 ^ In tribülaṭióne invocavìsti me, et liberávi te~; exaudívi te in abscòndito tempestátis~; probávi te apud acvam contradicṭiónis. 
9 ^ Audi, pòpulus meus, et contestábor te~; Isráhel, si audíverîs me. 
10 ^ Non èrit in te deus rècens, nècve adorábis deum aliénum. 
11 ^ Ego ènim sum Dòminus Deus tuus, cvi edúxi te de terra Aeǧìpti~; diláta os tuum, et implébo illud. 
12 ^ Et non audívit pòpulus meus vocem meam, et Isráhel non intèndit mìchi. 
13 ^ Et dimísi eos secùndum desidèria cordis eórum~; ibunt in adinvenṭiónibus suîs. 
14 ^ Si pòpulus meus audivìsset me, Isráhel si in viîs meîs ambülavìsset, 
15 ^ pro nìhilo fórsitan inimícos eórum humiliavìssem, et super tribülántes eos misìssem manum meam. 
16 ^ Inimíci Dòmini mentíti sunt ei, et èrit tempus eórum in sáecula. 
17 ^ Et cibávit eos ex ádipe frumènti, et de pètra, melle saturávit eos. 
