1 ^ Deus stètit in sinagóga deórum, in mèdio autem Deos dijúdicat. 
2 ^ ¿~Úsqụeqụo judicátis iniqụitátem, et fáçies peccatórum súmitis~? 
3 ^ Judicáte eģéno et pupìllo~; húmilem et páuperem justificáte. 
4 ^ Erìpite páuperem, et eģénum de manu peccatóris liberáte. 
5 ^ Nescivérunt, nèqụe intellexérunt~; in tènebrîs ámbulant~; movebùntur òmnia fundamènta terrae. 
6 ^ Ego dixi, «~Dei èstis, et fílii excèlsi òmnes. 
7 ^ Vos autem sicut hòmines moriémini, et sicut unus de princìpibus cadétis.~»
8 ^ Sùrģe, Deus, júdica terram, qụóniam tu hereditábis in òmnibus ģèntibus. 
