1 ^ Inclína, Dòmine, aŭrem tuam, et exáŭdi me, qụóniam inops et paŭper sum ego. 
2 ^ Custódi ánimam meam, qụóniam sanctus sum~; salvum fac servum tuum, Deus meus, sperántem in te. 
3 ^ Miserére mei, Dòmine, qụóniam ad te clamávi tota die. 
4 ^ Laĕtìfica ánimam sèrvi tui, qụóniam ad te, Dòmine, ánimam meam levávi. 
5 ^ Qụóniam tu, Dòmine, suávis et mítis, et mùltaĕ misericórdiaĕ òmnibus invocántibus te. 
6 ^ Áŭribus pèrcipe, Dòmine, orațiónem meam, et intènde voci deprecațiónis meaĕ. 
7 ^ In die tribulațiónis meaĕ clamávi ad te, qụia exaŭdivìsti me. 
8 ^ Non est sìmilis tui in deîs, Dòmine, et non est secùndum ópera tua. 
9 ^ Òmnes ģèntes qụascúmqụe fecìsti vènient, et adorábunt coram te, Dòmine, et glorificábunt nomen tuum. 
10 ^ Qụóniam magnus es tu, et fáçiens mirabìlia~; tu es Deus solus. 
11 ^ Dedúce me, Dòmine, in via tua, et ingrédier in veritáte tua~; laĕtétur cor meum ut tìmeat nomen tuum. 
12 ^ Confitébor tìbi, Dòmine Deus meus, in toto corde meo, et glorificábo nomen tuum in aĕtèrnum~; 
13 ^ qụia misericórdia tua magna est super me, et eruvìsti ánimam meam ex infèrno inferióri. 
14 ^ Deus, iníqụi insurrexérunt super me, et sinagóga potentium qụaĕsivérunt ánimam meam, et non proposuérunt te in conspèctu suo. 
15 ^ Et tu, Dòmine Deus, miserátor et misèricors~; páțiens, et mùltaĕ misericórdiaĕ, et verax. 
16 ^ Rèspice in me, et miserére mei~; da impèrium tuum púero tuo, et salvum fac fílium ancìllaĕ tuaĕ. 
17 ^ Fac mecum sìgnum in bonum, ut vèdeant qụi odérunt me, et confundántur~; qụóniam tu, Dòmine, adjuvìsti me, et consolátus es me. 
