1 ^ Inclína, Dòmine, aurem tuam, et exáudi me, qụóniam inops et pauper sum ego. 
2 ^ Custódi ánimam meam, qụóniam sanctus sum~; salvum fac servum tuum, Deus meus, sperántem in te. 
3 ^ Miserére mei, Dòmine, qụóniam ad te clamávi tota die. 
4 ^ Laetìfica ánimam sèrvi tui, qụóniam ad te, Dòmine, ánimam meam levávi. 
5 ^ Qụóniam tu, Dòmine, suávis et mítis, et mùltae misericórdiae òmnibus invocántibus te. 
6 ^ Áuribus pèrcipe, Dòmine, oraṭiónem meam, et intènde voci deprecaṭiónis meae. 
7 ^ In die tribülaṭiónis meae clamávi ad te, qụia exaudivìsti me. 
8 ^ Non est sìmilis tui in deîs, Dòmine, et non est secùndum ópera tua. 
9 ^ Òmnes ǧèntes qụascúmqụe fečìsti vènient, et adorábunt coram te, Dòmine, et glorificábunt nomen tuum. 
10 ^ Qụóniam magnus es tu, et fáčiens mirabìlia~; tu es Deus solus. 
11 ^ Dedúce me, Dòmine, in via tua, et ingrédier in veritáte tua~; laetétur cor meum ut tìmeat nomen tuum. 
12 ^ Confitébor tìbi, Dòmine Deus meus, in toto corde meo, et glorificábo nomen tuum in aetèrnum~; 
13 ^ qụia misericórdia tua magna est super me, et eruvìsti ánimam meam ex infèrno inferióri. 
14 ^ Deus, iníqụi insurrexérunt super me, et sinagóga potentium qụaesivérunt ánimam meam, et non proposuérunt te in conspèctu suo. 
15 ^ Et tu, Dòmine Deus, miserátor et misèricors~; páṭiens, et mùltae misericórdiae, et verax. 
16 ^ Rèspiče in me, et miserére mei~; da impèrium tuum púero tuo, et salvum fac fílium ancìllae tuae. 
17 ^ Fac mecum sìgnum in bonum, ut vèdeant qụi odérunt me, et confundántur~; qụóniam tu, Dòmine, adjuvìsti me, et consolátus es me. 
