1 ^ Fundāmenta ejus in montibus sanctīs~; ^ The foundations thereof are the holy mountains.
2 ^ dīligit Dominus portās Siōnis super omnia tabernācula Jācōbis. ^ The Lord loveth the gates of Sion above all the tabernacles of Jacob.
3 ^ Glōriōsa dicta sunt dē tē, cīvitās Deī. ^ Glorious things are said of thee, O city of God.
4 ^ Memor erō Rahab, et Babilōnis scientium mē. Ecce aliēnigenae et Tīrus et populus Aetiōpum, hī fuērunt illīc. ^ I will be mindful of Rahab and of Babylon knowing me. Behold the foreigners and Tyre and the people of the Ethiopians, these were there.
5 ^ ¿~Numquid Siōn dīcet, «~Homō et homō nātus est in eā, et ipse fundāvit eam Altissimus~»~? ^ Shall not Sion say, "This man and that man is born in her, and the Highest himself hath founded her"~?
6 ^ Dominus narrābit in scrīptūrīs populōrum, et principum, hōrum, quī fuērunt in eā. ^ The Lord shall tell in his writings of peoples and of princes, of them that have been in her.
7 ^ Sīcut laetantium omnium habitātiō est in tē. ^ The dwelling in thee is as it were of all rejoicing.
