2 ^ Misericordiās Dominī in aeternum cantābō~; in generātiōnem et generātiōnem adnuntiābō vēritātem tuam in ōre meō, ^ The mercies of the Lord I will sing for ever~; I will show forth thy truth with my mouth to generation and generation,
3 ^ quoniam dixistī, «~In aeternum misericordia aedificābitur in caelīs.~»Praeparābitur vēritās tua in eīs. ^ for thou hast said, "Mercy shall be built up for ever in the heavens." Thy truth shall be prepared in them.
4 ^ «~Disposuī testāmentum ēlectīs meīs, jūrāvī Dāvid servō meō, ^ I have made a covenant with my elect~; I have sworn to David my servant,
5 ^ ‹ Usque in aeternum praeparābō sēmen tuum, et aedificābō in generātiōnem et generātiōnem sēdem tuam. ›~»^ 'Thy seed will I settle for ever, and I will build up thy throne unto generation and generation.'"
6 ^ Confitēbuntur caelī mīrābilia tua, Domine, etenim vēritātem tuam in ecclēsiā sanctōrum, ^ The heavens shall confess thy wonders, O Lord, and thy truth in the church of the saints,
7 ^ ¿~quoniam quis in nūbibus aequābitur Dominō~; similis erit Deō in fīliīs Deī~? ^ for who in the clouds can be compared to the Lord~; who among the sons of God shall be like to God~?
8 ^ Deus, quī glōrificātur in consiliō sanctōrum, magnus et terribilis super omnēs quī in circumitū ejus sunt. ^ God, who is glorified in the assembly of the saints, great and terrible above all them that are about him.
9 ^ Domine Deus virtūtum, ¿~quis similis tibī~? Potens es, Domine, et vēritās tua in circumitū tuō. ^ O Lord God of hosts, who is like to thee~? Thou art mighty, O Lord, and thy truth is round about thee.
10 ^ Tū domināris potestātī maris~; mōtum autem fluctuum ejus tū mītigās. ^ Thou rulest the power of the sea~; thou also appeasest the motion of the waves.
11 ^ Tū humiliāvistī sīcut vulnerātum, superbum~; in bracchiō virtūtis tuae dispersistī inimīcōs tuōs. ^ Thou hast humbled the proud one, as one that is slain~; with the arm of thy strength thou hast scattered thy enemies.
12 ^ Tuī sunt caelī, et tua est terra~; orbem terrae et plēnitūdinem ejus tū fundāvistī. ^ Thine are the heavens, and thine is the earth~; the world and the fulness thereof thou hast founded.
13 ^ Aquilōnem et mare tū creāvistī~; Tābor et Hermōn in nōmine tuō exsultābunt. ^ The north and the sea thou hast created~; Tabor and Hermon shall rejoice in thy name.
14 ^ Tuum bracchium cum potentiā~; firmētur manus tua, et exaltētur dextera tua. ^ Thy arm is with might~; let thy hand be strengthened, and thy right hand exalted.
15 ^ Jūstitia et jūdicium praeparātiō sēdis tuae~; misericordia et vēritās praecēdent faciem tuam. ^ Justice and judgment are the preparation of thy throne~; mercy and truth shall go before thy face.
16 ^ Beātus populus quī scit jūbilātiōnem~; Domine, in lūmine vultūs tuī ambulābunt, ^ Blessed is the people that knoweth jubilation~; O Lord, they shall walk in the light of thy countenance,
17 ^ et in nōmine tuō exsultābunt tōtā diē, et in jūstitiā tuā exaltābuntur, ^ and in thy name they shall rejoice all the day, and in thy justice they shall be exalted,
18 ^ quoniam glōria virtūtis eōrum tū es, et in benēplacitō tuō exaltābitur cornū nostrum, ^ for thou art the glory of their strength, and in thy good pleasure shall our horn be exalted,
19 ^ quia Dominī est assumptiō nostra, et sanctī Isrāēlis rēgis nostrī. ^ for our protection is of the Lord, and of our king the holy one of Israel.
20 ^ Tunc locūtus es in vīsiōne sanctīs tuīs, et dixistī, «~Posuī adjūtōrium in potente, et exaltāvī ēlectum dē plēbe meā.~»^ Then thou spokest in a vision to thy saints, and saidst, "I have laid help upon one that is mighty, and have exalted one chosen out of my people."
21 ^ Invēnī Dāvid servum meum~; oleō sanctō meō unxī eum. ^ I have found David my servant~; with my holy oil I have anointed him.
22 ^ Manus enim mea auxiliābitur eī, et bracchium meum confortābit eum. ^ For my hand shall help him, and my arm shall strengthen him.
23 ^ Nihil prōficiet inimīcus in eō, et fīlius inīquitātis nōn appōnet nocēre eī. ^ The enemy shall have no advantage over him, nor the son of iniquity have power to hurt him.
24 ^ Et concīdem ā faciē ipsīus inimīcōs ejus, et odientēs eum in fugam convertem. ^ And I will cut down his enemies before his face, and them that hate him I will put to flight.
25 ^ Et vēritās mea et misericordia mea cum ipsō, et in nōmine meō exaltābitur cornū ejus. ^ And my truth and my mercy shall be with him, and in my name shall his horn be exalted.
26 ^ Et pōnem in marī manum ejus, et in flūminibus dexteram ejus. ^ And I will set his hand in the sea, and his right hand in the rivers.
27 ^ Ipse invocābit mē, «~Pater meus es tū, Deus meus, et susceptor salūtis meae.~»^ He shall cry out to me, "Thou art my father, my God, and the support of my salvation."
28 ^ Et egō prīmōgenitum pōnem illum, excelsum prae rēgibus terrae. ^ And I will make him my firstborn, high above the kings of the earth.
29 ^ In aeternum servābō illī misericordiam meam, et testāmentum meum fidēle ipsī. ^ I will keep my mercy for him for ever, and my covenant faithful to him.
30 ^ Et pōnem in saeculum saeculī sēmen ejus, et tronum ejus sīcut diēs caelī. ^ And I will make his seed to endure for evermore, and his throne as the days of heaven.
31 ^ Sī autem dērelīquerint fīliī ejus lēgem meam, et in jūdiciīs meīs nōn ambulāverint, ^ If his children forsake my law, and walk not in my judgments,
32 ^ sī jūstitiās meās prōfānāverint, et mandāta mea nōn custōdīverint, ^ if they profane my justices, and keep not my commandments,
33 ^ vīsitābō in virgā inīquitātēs eōrum, et in verberibus peccāta eōrum. ^ I will visit their iniquities with a rod, and their sins with stripes.
34 ^ Misericordiam autem meam nōn dispergem ab eō, neque nocēbō in vēritāte meā, ^ But my mercy I will not take away from him, nor will I suffer my truth to fail.
35 ^ neque prōfānābō testāmentum meum, et quae prōcēdunt dē labiīs meīs nōn faciam irrita. ^ Neither will I profane my covenant, and the words that proceed from my mouth I will not make void.
36 ^ Semel jūrāvī in sanctō meō, sī Dāvidī mentier~; ^ Once have I sworn by my holiness, if I will lie unto David~;
37 ^ sēmen ejus in aeternum manēbit, et tronus ejus sīcut sōl in conspectū meō, ^ his seed shall endure for ever, and his throne as the sun before me,
38 ^ et sīcut lūna perfecta in aeternum, et testis in caelō fidēlis. ^ and as the moon perfect for ever, and a faithful witness in heaven.
39 ^ Tū vērō repulistī et dēspexistī~; distulistī chrīstum tuum. ^ But thou hast rejected and despised~; thou hast been angry with my anointed.
40 ^ Ēvertistī testāmentum servī tuī~; prōfānāvistī in terrā sanctuārium ejus. ^ Thou hast overthrown the covenant of thy servant~; thou hast profaned his sanctuary on the earth.
41 ^ Dēstruxistī omnēs sēpēs ejus~; posuistī firmāmentum ejus formīdinem. ^ Thou hast broken down all his hedges~; thou hast made his strength fear.
42 ^ Dīripuērunt eum omnēs transientēs viam~; factus est opprobrium vīcīnīs suīs. ^ All that pass by the way have robbed him~; he is become a reproach to his neighbours.
43 ^ Exaltāvistī dexteram dēprimentium eum~; laetificāvistī omnēs inimīcōs ejus. ^ Thou hast set up the right hand of them that oppress him~; thou hast made all his enemies to rejoice.
44 ^ Āvertistī adjūtōrium gladiī ejus, et nōn es auxiliātus eī in bellō. ^ Thou hast turned away the help of his sword, and hast not assisted him in battle.
45 ^ Dēstruxistī eum ab ēmundātiōne, et sēdem ejus in terram collīsistī. ^ Thou hast made his purification to cease, and thou hast cast his throne down to the ground.
46 ^ Minōrāvistī diēs temporis ejus~; perfūdistī eum confūsiōne. ^ Thou hast shortened the days of his time~; thou hast covered him with confusion.
47 ^ ¿~Usquequō, Domine, āvertis in fīnem~? ¿~Exardēscet sīcut ignis īra tua~? ^ How long, O Lord, turnest thou away unto the end~? Shall thy anger burn like fire~?
48 ^ Memorāre quae mea substantia~; ¿~numquid enim vānē constitūvistī omnēs fīliōs hominum~? ^ Remember what my substance is~; for hast thou constituted all the children of men in vain~?
49 ^ ¿~Quis est homō quī vīvet et nōn vidēbit mortem, ēruet animam suam dē manū inferī~? ^ Who is the man that shall live and not see death, that shall deliver his soul from the hand of hell~?
50 ^ ¿~Ubi sunt misericordiae tuae antīquae, Domine, sīcut jūrāvistī Dāvid in vēritāte tuā~? ^ Where are thy ancient mercies, O Lord, according to what thou didst swear to David in thy truth~?
51 ^ Memor estō, Domine, opprobriī servōrum tuōrum, quod continuī in sinū meō, multārum gentium, ^ Be mindful, O Lord, of the reproach of thy servants, which I have held in my bosom, of many nations.
52 ^ quod exprobrāvērunt inimīcī tuī, Domine, quod exprobrāvērunt commūtātiōnem chrīstī tuī. ^ Wherewith thy enemies have reproached, O Lord, wherewith they have reproached the change of thy anointed.
53 ^ Benedictus Dominus in aeternum. Fīat, fīat. ^ Blessed be the Lord for evermore. So be it, so be it.
