1 ^ Dòmine, refúǧium factus es nobîs a ǧeneraṭióne in ǧeneraṭiónem. 
2 ^ Priuscvam mòntes fíerent, aut formarétur terra et orbis, a sáeculo et uscve in sáeculum tu es Deus. 
3 ^ Ne avèrtas hòminem in humilitátem. Et dixìsti, «~Convertìmini, fílii hòminum.~»
4 ^ Cvóniam mille anni ante òculos tuos tamcvam dies hestèrna cvae praeterívit, et custódia in nòcte. 
5 ^ Cvae pro nìhilo habèntur, eórum anni èrunt. 
6 ^ Mane sicut herba tránsiat~; mane flóriat, et tránsiat~; vèspere décadat, indúret, et aréscat. 
7 ^ Cvia deféčimus in ira tua, et in furóre tuo turbáti sùmus. 
8 ^ posuìsti inicvitátes nostras in conspèctu tuo~; sáeculum nostrum in illuminaṭióne vùltûs tui. 
9 ^ Cvóniam òmnes dies nostri defečérunt, et in ira tua deféčimus. Anni nostri sicut aránea meditabùntur~; 
10 ^ dies annórum nostrórum in ìpsîs, septuaǧìnta anni. Si autem in potentátibus octoǧìnta anni, et ámplius eórum labor et dolor~; cvóniam supervénit mansuetúdo, et corripiémur. 
11 ^ ¿~Cvìs novit potestátem irae tuae, et prae timóre tuo iram tuam dinumeráre~? 
12 ^ dèxteram tuam sic notam fac, et erudítos corde in sapiènṭia. 
13 ^ Convèrtere, Dòmine~; ¿~úscvecvo~? Et deprecábilis èsto super sèrvos tuos. 
14 ^ Repléti sùmus mane misericórdia tua, et exsultávimus et delectáti sùmus òmnibus diébus nostrîs. 
15 ^ Laetáti sùmus pro diébus cvìbus nos humiliavìsti~; annîs cvìbus vídimus mala. 
16 ^ Rèspiče in sèrvos tuos, et in ópera tua, et díriǧe fílios eórum. 
17 ^ Et sit splendor Dòmini Dei nostri super nos, et ópera mánuum nostrárum díriǧe super nos, et opus mánuum nostrárum díriǧe. 
