1 ^ Deus ulṭiónum Dòminus~; Deus ulṭiónum líbere eǧit. 
2 ^ Exaltáre, cvi júdicas terram~; redde retribuṭiónem supèrbîs. 
3 ^ ¿~Úscvecvo peccatóres, Dòmine, úscvecvo peccatóres gloriabùntur~? 
4 ^ ¿~Effabùntur et locvèntur inicvitátem~; locvèntur òmnes cvi operántur injustìṭiam~? 
5 ^ Pópulum tuum, Dòmine, humiliavérunt, et hereditátem tuam vexavérunt. 
6 ^ Vìduam et ádvenam interfečérunt, et pupìllos occaesérunt. 
7 ^ Et dixérunt, «~Non vedébit Dòminus, nec intèlleǧet Deus Jacóbis.~»
8 ^ Intellèǧite, insapièntes in pòpulo; et stùlti, alicvándo sápite. 
9 ^ Cvi plantávit aurem, ¿~non áudiet~? Aut cvi fînxit òculum, ¿~non consíderat~? 
10 ^ Cvi córripit ǧèntes, ¿~non árguet, cvi dòcet hòminem sciènṭiam~? 
11 ^ Dòminus scit coǧitaṭiónes hòminum, cvóniam vanae sunt. 
12 ^ Beátus hòmo, cvem tu erudíverîs Dòmine, et de leǧe tua docùerîs eum, 
13 ^ ut mítiges ei a diébus malîs, donec fodiátur peccatóri fóvea. 
14 ^ Cvia non repèllet Dòminus plebem suam, et hereditátem suam non derelìncvet, 
15 ^ cvoadúscve justìṭia convertátur in judìcium, et cvi juxta illam òmnes cvi recto sunt corde. 
16 ^ ¿~Cvìs consùrǧet mìchi advèrsus malignántes, aut cvìs stabit mecum advèrsus operántes inicvitátem~? 
17 ^ Nisi cvia Dòminus adjúvit me, paulo mìnus habitavìsset in infèrno ánima mea. 
18 ^ Si dicébam, «~Motus est pes meus~; misericórdia tua, Dòmine, adjuvábat me.~»
19 ^ Secùndum multitúdinem dolórum meórum in corde meo, consolaṭiónes tuae laetificavérunt ánimam meam. 
20 ^ ¿~Numcvid adháeret tìbi sedes inicvitátis, cvi fìnǧis labórem in praecèpto~? 
21 ^ Captábunt in ánimam justi, et sángvinem innocèntem condemnábunt. 
22 ^ Et factus est mìchi Dòminus in refúǧium, et Deus meus in adjutórium spei meae. 
23 ^ Et reddet illîs inicvitátem ipsórum, et in malìṭia eórum dispèrdet eos~; dispèrdet illos Dòminus Deus noster. 
