1 ^ Věníte, exsultémus Dòmino~; jubilémus Deo salutári nostro~; ^ Come, let us praise the Lord with joy~; let us joyfully sing to God our saviour~;
2 ^ praĕoccupémus fáciem ejus in confessióne, et in psalmîs jubilémus ei~; ^ let us come before his presence with thanksgiving~; and make a joyful noise to him with psalms~;
3 ^ qŭóniam Deus magnus Dòminus, et Rex magnus super omnes Deos. ^ for the Lord is a great God, and a great King above all gods.
4 ^ Qŭia in manu ejus sunt omnes fines terraĕ, et altitúdines mòntium ipsíus sunt~; ^ For in his hand are all the ends of the earth, and the heights of the mountains are his~;
5 ^ qŭóniam ipsíus est mare, et ipse fecit illud, et siccam manûs ejus formavérunt. ^ for the sea is his, and he made it, and his hands formed the dry land.
6 ^ Věníte, adorémus et procidámus, et plorémus ante Dòminum qŭi fecit nos~; ^ Come, let us adore and fall down, and weep before the Lord that made us~;
7 ^ qŭia ipse est Dòminus Deus noster, et nos pòpulus páscuaĕ ejus, et oves manûs ejus. ^ for he is the Lord our God, and we are the people of his pasture and the sheep of his hand.
8 ^ Hódie si vocem ejus aŭdiverítis, nolíte obduráre corda vèstra, sicut in irritatióne, secùndum diem tentatiónis in desèrto, ^ Today if you shall hear his voice, harden not your hearts, as in the provocation, according to the day of temptation in the wilderness,
9 ^ ubi tentavérunt me patres vèstri, probavérunt me, et vîdérunt ópera mea. ^ where your fathers tempted me, they proved me, and saw my works.
10 ^ Quadragìnta annîs offènsus fui generatióni illi, et dixi, «~Semper hi errant corde.~»^ Forty years long was I offended with that generation, and I said, "These always err in heart."
11 ^ Et ìsti non cognovérunt vias meas~; ut jurávi in ira mea, «~Si introíbunt in rèquiem meam.~»^ And these men have not known my ways~; so I swore in my wrath, "If they shall not enter into my rest."
