1 ^ Dominus regnāvit~; exsultet terra~; laetentur insulae multae. ^ The Lord hath reigned~; let the earth rejoice~; let many islands be glad.
2 ^ Nūbēs et cālīgō in circumitū ejus~; jūstitia et jūdicium corrēctiō sēdis ejus. ^ Clouds and darkness are round about him~; justice and judgment are the establishment of his throne.
3 ^ Ignis ante ipsum praecēdet, et inflammābit in circumitū inimīcōs ejus. ^ A fire shall go before him, and shall burn his enemies round about.
4 ^ Illūxērunt fulgura ejus orbī terrae~; vīdit, et commōta est terra. ^ His lightnings have shone forth to the world~; the earth saw and trembled.
5 ^ Montēs sīcut cēra flūxērunt ā faciē Dominī~; ā faciē Dominī omnis terrae. ^ The mountains melted like wax at the presence of the Lord~; at the presence of the Lord of all the earth.
6 ^ Adnūntiāvērunt caelī jūstitiam ejus, et vīdērunt omnēs populī glōriam ejus. ^ The heavens declared his justice, and all people saw his glory.
7 ^ Confundantur omnēs quī adōrant sculptilia, et quī glōriantur in simulācrīs suīs. Adōrāte eum omnēs angelī ejus. ^ Let them be all confounded that adore graven things, and that glory in their idols. Adore him, all you his angels.
8 ^ Audīvit, et laetāta est Siōn, et exsultāvērunt fīliae Jūdae propter jūdicia tua, Domine. ^ Sion heard and was glad, and the daughters of Judah rejoiced because of thy judgments, O Lord.
9 ^ Quoniam tū Dominus altissimus super omnem terram~; nimis exaltātus es super omnēs deōs. ^ For thou art the most high Lord over all the earth~; thou art exalted exceedingly above all gods.
10 ^ Quī dīligitis Dominum, odītē malum~; custōdit Dominus animās sānctōrum suōrum~; dē manū peccātōris līberābit eōs. ^ You that love the Lord, hate evil~; the Lord preserveth the souls of his saints~; he will deliver them out of the hand of the sinner.
11 ^ Lūx orta est jūstō, et rēctīs corde laetitia. ^ Light is risen to the just, and joy to the right of heart.
12 ^ Laetāminī, jūstī, in Dominō, et confitēminī memoriae sānctificātiōnis ejus. ^ Rejoice, ye just, in the Lord, and give praise to the remembrance of his holiness.
