1 ^ Cantáte Dòmino cánticum novum, qụia mirabìlia fecit. Salvávit sìbi dèxtera ejus, et bráchium sanctum ejus. 
2 ^ Notum fecit Dòminus salutáre suum~; in conspèctu ģèntium revelávit justìṭiam suam. 
3 ^ Recordátus est misericórdiae suae et veritátis suae dómui Israhélis. Vîdérunt òmnes tèrmini terrae salutáre Dei nostri. 
4 ^ Jubiláte Deo òmnis terra~; cantáte, et exsultáte, et psállite. 
5 ^ Psállite Dòmino in cìttara, in cìttara et voce psalmi. 
6 ^ In tubîs ductìlibus et voce tubae córneae, jubiláte in conspèctu reģis Dòmini. 
7 ^ Moveátur mare et plenitúdo ejus~; orbis terrárum et qụi hábitant in eo. 
8 ^ Flúmina plaudent manu~; sìmul mòntes exsultábunt a conspèctu Dòmini, 
9 ^ qụóniam vênit judicáre terram. Judicábit orbem terrárum in justìṭia, et pòpulos in aeqụitáte. 
