1 ^ Dòminus regnávit~; irascántur pòpuli. Qụi sèdet super cherubíma~; moveátur terra. 
2 ^ Dòminus in Sióne magnus, et excèlsus super òmnes pòpulos. 
3 ^ Confiteántur nómini tuo magno, qụóniam terrìbile et sanctum est. 
4 ^ Et honor reģis judìcium díliģit~; tu paravìsti direcțiónes~; judìcium et justìțiam in Jacóbe tu fecìsti. 
5 ^ Exaltáte Dòminum Deum nostrum, et adoráte scabèllum pèdum ejus, qụóniam sanctum est. 
6 ^ Moses et Áharon in sacerdótibus ejus, et Sámuel inter eos qụi ìnvocant nomen ejus. Invocábant Dòminum, et ìpse exaŭdiébat eos. 
7 ^ In colùmna nubis loqụebátur ad eos~; custodiébant testimónia ejus, et praĕcèptum qụod dèdit illîs. 
8 ^ Dòmine Deus noster, tu exaŭdiébas eos~; Deus tu propìțius fuìsti eîs, et ulcíscens in òmnes adinvențiónes eórum. 
9 ^ Exaltáte Dòminum Deum nostrum, et adoráte in mònte sancto ejus, qụóniam sanctus Dòminus Deus noster. 
