2 ^ Dòmine exáudi oraṭiónem meam, et clamor meus ad te vèniat. 
3 ^ Non avèrtas fáčiem tuam a me. In qụacùmqụe die trìbulor, inclína ad me aurem tuam~; in qụacùmqụe die invocávero te, velóciter exáudi me. 
4 ^ Qụia defečérunt sicut fumus dies mei, et òssua mea sicut crèmium aruérunt. 
5 ^ Percùssus sum ut foenum, et áruit cor meum, qụia oblítus sum comèdere panem meum. 
6 ^ A voce ǧèmitûs mei adháesit òssu meum carni meae. 
7 ^ Sìmilis factus sum pelicáno solitúdinis~; factus sum sicut noctìcorax in domicìlio. 
8 ^ Viǧilávi, et factus sum sicut passer solitárius in tecto. 
9 ^ Tota die exprobrábant mìchi inimíci mei, et qụi laudábant me advèrsum me jurábant~; 
10 ^ qụia cìnerem tamqụam panem manducábam, et potum meum cum flétu miscébam, 
11 ^ a fáčie irae et indignaṭiónis tuae~; qụia élevans allisìsti me. 
12 ^ Dies mei sicut ùmbra declinavérunt, et ego sicut foenum árui. 
13 ^ Tu autem, Dòmine, in aetèrnum pèrmanes, et memoriále tuum in ǧeneraṭiónem et ǧeneraṭiónem. 
14 ^ Tu exsùrǧens miseréberis Siónis, qụia tempus miserèndi ejus, qụia vênit tempus. 
15 ^ Qụóniam placuérunt sèrvîs tuîs lápides ejus, et terrae ejus miserebùntur. 
16 ^ Et timébunt ǧèntes nomen tuum, Dòmine, et òmnes reǧes terrae glóriam tuam. 
17 ^ Qụia aedificávit Dòminus Siónem, et vedébitur in glória sua. 
18 ^ Respèxit in oraṭiónem humìlium et non sprevit prècem eórum. 
19 ^ Scribántur haec in ǧeneraṭióne áltera, et pòpulus qụi creábitur laudábit Dòminum. 
20 ^ Qụia prospèxit de excèlso sancto suo~; Dòminus de caelo in terram aspèxit, 
21 ^ ut audíret ǧèmitûs compeditórum~; ut sòlveret fílios interemptórum~; 
22 ^ ut adnúnṭiet in Sióne nomen Dòmini, et laudem ejus in Jerusalíme. 
23 ^ In convenièndo pòpulos in ünum, et reǧes ut sèrviant Dòmino. 
24 ^ Respòndit ei in via virtútis suae, «~Paucitátem diérum meórum núnṭia mìchi.~»
25 ^ Ne rèvoces me in dimìdio diérum meórum, in ǧeneraṭiónem et ǧeneraṭiónem anni tui. 
26 ^ Inìṭio tu, Dòmine, terram fundavìsti, et ópera mánuum tuárum sunt caeli. 
27 ^ Ìpsi períbunt, tu autem pèrmanes, et òmnes sicut vestimèntum veteráscent, et sicut opertórium mutábis eos, et mutabùntur~; 
28 ^ tu autem ídem ìpse es, et anni tui non defìčient. 
29 ^ Fílii servórum tuórum habitábunt, et semen eórum in sáeculum diriǧétur. 
