2 ^ Dòmine exáŭdi orațiónem meam, et clamor meus ad te vèniat. ^ Hear, O Lord, my prayer, and let my cry come to thee.
3 ^ Non avèrtas fáçiem tuam a me. In qŭacùmqŭe die trìbulor, inclína ad me aŭrem tuam~; in qŭacùmqŭe die invocávero te, velóciter exáŭdi me. ^ Turn not away thy face from me. In the day when I am in trouble, incline thy ear to me; in what day soever I shall call upon thee, hear me speedily.
4 ^ Qŭia defecérunt sicut fumus dies mei, et òssua mea sicut crèmium aruérunt. ^ For my days are vanished like smoke, and my bones are grown dry like fuel for the fire.
5 ^ Percùssus sum ut foĕnum, et áruit cor meum, qŭia oblítus sum comèdere panem meum. ^ I am smitten as grass, and my heart is withered, because I forgot to eat my bread.
6 ^ A voce ģèmitûs mei adháĕsit òssu meum carni meaĕ. ^ Through the voice of my groaning, my bone hath cleaved to my flesh.
7 ^ Sìmilis factus sum pelicáno solitúdinis~; factus sum sicut noctìcorax in domicìlio. ^ I am become like to a pelican of the wilderness; I am like a night raven in the house.
8 ^ Viģilávi, et factus sum sicut passer solitárius in tecto. ^ I have watched, and am become as a sparrow all alone on the housetop.
9 ^ Tota die exprobrábant mìchi inimíci mei, et qŭi laŭdábant me advèrsum me jurábant~; ^ All the day long my enemies reproached me, and they that praised me did swear against me.
10 ^ qŭia cìnerem tamqŭam panem manducábam, et potum meum cum flétu miscébam, ^ For I did eat ashes like bread, and mingled my drink with weeping,
11 ^ a fáçie iraĕ et indignațiónis tuaĕ~; qŭia élevans allisìsti me. ^ because of thy anger and indignation~; for having lifted me up thou hast thrown me down.
12 ^ Dies mei sicut ùmbra declinavérunt, et ego sicut foĕnum árui. ^ My days have declined like a shadow, and I am withered like grass.
13 ^ Tu aŭtem, Dòmine, in aĕtèrnum pèrmanes, et memoriále tuum in ģenerațiónem et ģenerațiónem. ^ But thou, O Lord, endurest for ever, and thy memorial to all generations.
14 ^ Tu exsùrģens miseréberis Siónis, qŭia tempus miserèndi ejus, qŭia vênit tempus. ^ Thou shalt arise and have mercy on Sion, for it is time to have mercy on it, for the time is come.
15 ^ Qŭóniam placuérunt sèrvîs tuîs lápides ejus, et terraĕ ejus miserebùntur. ^ For the stones thereof have pleased thy servants, and they shall have pity on the earth thereof.
16 ^ Et timébunt ģèntes nomen tuum, Dòmine, et òmnes reģes terraĕ glóriam tuam. ^ All the Gentiles shall fear thy name, O Lord, and all the kings of the earth thy glory.
17 ^ Qŭia aĕdificávit Dòminus Siónem, et vedébitur in glória sua. ^ For the Lord hath built up Sion, and he shall be seen in his glory.
18 ^ Respèxit in orațiónem humìlium et non sprevit prècem eórum. ^ He hath had regard to the prayer of the humble, and he hath not despised their petition.
19 ^ Scribántur haĕc in ģenerațióne áltera, et pòpulus qŭi creábitur laŭdábit Dòminum. ^ Let these things be written unto another generation, and the people that shall be created shall praise the Lord,
20 ^ Qŭia prospèxit de excèlso sancto suo~; Dòminus de caĕlo in terram aspèxit, ^ because he hath looked forth from his high sanctuary~; from heaven the Lord hath looked upon the earth,
21 ^ ut aŭdíret ģèmitûs compeditórum~; ut sòlveret fílios interemptórum~; ^ that he might hear the groans of them that are in fetters~; that he might release the children of the slain~;
22 ^ ut adnúnțiet in Sióne nomen Dòmini, et laŭdem ejus in Jerusalíme. ^ that they may declare the name of the Lord in Sion, and his praise in Jerusalem.
23 ^ In convenièndo pòpulos in unum, et reģes ut sèrviant Dòmino. ^ When the people assemble together, and kings, to serve the Lord.
24 ^ Respòndit ei in via virtútis suaĕ, «~Paŭcitátem diérum meórum núnția mìchi.~»^ He answered him in the way of his strength, "Declare unto me the fewness of my days."
25 ^ Ne rèvoces me in dimìdio diérum meórum, in ģenerațiónem et ģenerațiónem anni tui. ^ Call me not away in the midst of my days~; thy years are unto generation and generation.
26 ^ Inìțio tu, Dòmine, terram fundavìsti, et ópera mánuum tuárum sunt caĕli. ^ In the beginning, O Lord, thou foundedst the earth, and the heavens are the works of thy hands.
27 ^ Ìpsi períbunt, tu aŭtem pèrmanes, et òmnes sicut vestimèntum veteráscent, et sicut opertórium mutábis eos, et mutabùntur~; ^ They shall perish but thou remainest, and all of them shall grow old like a garment, and as a vesture thou shalt change them, and they shall be changed.
28 ^ tu aŭtem ídem ìpse es, et anni tui non defìcient. ^ But thou art always the selfsame, and thy years shall not fail.
29 ^ Fílii servórum tuórum habitábunt, et semen eórum in sáĕculum diriģétur. ^ The children of thy servants shall continue and their seed shall be directed for ever.
