1 ^ Benedíce, ànima mea, Dòmino, et òmnia quae intra me sunt nómini sancto ejus. 
2 ^ Benedíce, ànima mea, Dòmino, et noli oblivísci òmnes retribuziónes ejus. 
3 ^ Qui propiziátur òmnibus iniquitátibus tuïs~; qui sanat òmnes infirmitátes tuas. 
4 ^ Qui rèdimit de intèritu vitam tuam~; qui corónat te in misericórdia et miseraziónibus. 
5 ^ Qui rèplet in bonïs desidèrium tuum~; renovábitur ut àquilae juvèntüs tua. 
6 ^ Fáčiens misericórdias Dòminus, et judìčium òmnibus injúriam patièntibus. 
7 ^ Notas fečit vias suas Moýsi~; fíliïs Israhélis voluntátes suas. 
8 ^ Miserátor et misèricors Dòminus~; longánimis et mùltum misèricors. 
9 ^ Non in perpétuum irascétur, nèque in aetèrnum comminábitur. 
10 ^ Non secùndum peccáta nostra fečit nobïs, nèque secùndum iniquitátes nostras retrìbuit nobïs. 
11 ^ Quóniam secùndum altitúdinem čaeli a terra, corroborávit misericórdiam suam super timèntes se. 
12 ^ Quantum dìstat ortus ab ocčidènte, longe fečit a nobïs iniquitátes nostras. 
13 ^ Quómodo miserétur pàter filiórum, misèrtus est Dòminus timèntibus se. 
14 ^ Quóniam ìpse cognóvit figmèntum nostrum, recordátus est quóniam pùlvis sùmus. 
15 ^ hòmo, sicut foenum dies ejus, tàmquam flos agri sic efflorébit. 
16 ^ Quóniam spíritus pertransívit in illo, et non subsìstet, et non cognóscet àmplius locum suum. 
17 ^ Misericórdia autem Dòmini ab aetèrno et usque in aetèrnum super timèntes eum, et justìzia ìllius in fílios filiórum, 
18 ^ hïs qui servant testamèntum ejus, et mèmores sunt mandatórum ìpsius ad fačièndum ea. 
19 ^ Dòminus in čaelo parávit sedem suam, et regnum ìpsius òmnibus dominábitur. 
20 ^ Benedícite Dòmino, òmnes ànǧeli ejus~; potèntes virtúte, fačièntes vèrbum ìllius, ad audièndam vočem sermónum ejus. 
21 ^ Benedícite Dòmino, òmnes virtútes ejus, minìstri ejus, qui fàčitis voluntátem ejus. 
22 ^ Benedícite Dòmino, òmnia ópera ejus~; in òmni loco dominaziónis ejus, benedíče, ànima mea, Dòmino. 
