2 ^ Parátum cor meum Deus, parátum cor meum~; cantábo, et psallem in glória mea. 
3 ^ Exsùrge, glória mea~; exsùrge, psaltérium et zìtara~; exsùrgem dilúculo. 
4 ^ Confitébor tìbi in pòpulîs, Dòmine, et psallem tìbi in naziónibus, 
5 ^ quia magna est super caelos misericórdia tua, et usque ad nubes vèritas tua. 
6 ^ Exaltáre super caelos, Deus, et super òmnem terram glória tua, 
7 ^ ut liberèntur dilécti tui~; sàlvum fac dèxtera tua, et exáudi me. 
8 ^ Deus locútus est in sancto suo, «~Exsultábo, et dívidem Sìchimam, et convàllem tabernaculórum dimézier. 
9 ^ Meus est Giliádus, et meus est Manásses, et Efrémus susçèpzio cápitis mei~; Juda rex meus. 
10 ^ Moab lebes spei meae~; in Iduméam extèndem calceamèntum meum~; mìhi alieníğenae amici facti sunt.~»
11 ^ ¿~Quìs dedúcet me in çivitátem munítam~? ¿~Quìs dedúcet me usque in Iduméam~? 
12 ^ ¿~Nonne tu, Deus, qui repulìsti nos~? ¿~Et non exíbis, Deus, in virtútibus nostrîs~? 
13 ^ Da nobîs auxìlium de tribulazióne, quia vana sàlûs hòminis. 
14 ^ In Deo façiémus virtútem, et ìpse ad nìhilum dedúcet inimícos nostros. 
