2 ^ Deus, laudem meam nē tacuerīs, quia ōs peccātōris et ōs dolōsī super mē apertum est. ^ O God, be not thou silent in my praise, for the mouth of the wicked and the mouth of the deceitful man is opened against me.
3 ^ Locūtī sunt adversum mē linguā dolōsā, et sermōnibus odiī circumdedērunt mē, et expugnāvērunt mē grātīs. ^ They have spoken against me with deceitful tongues, and they have compassed me about with words of hatred, and have fought against me without cause.
4 ^ Prō eō ut mē dīligerent, dētrahēbant mihī~; egō autem ōrābam. ^ Instead of making me a return of love, they detracted me~; I however gave myself to prayer.
5 ^ Et posuērunt adversum mē mala prō bonīs, et odium prō dīlectiōne meā. ^ And they repaid me evil for good, and hatred for my love.
6 ^ Constitue super eum peccātōrem, et diabolus stet ā dextrīs ejus. ^ Set thou the sinner over him, and may the devil stand at his right hand.
7 ^ Quum jūdicātur, exiat condemnātus, et ōrātiō ejus fīat in peccātum. ^ When he is judged, may he go out condemned, and may his prayer be turned to sin.
8 ^ Fīant diēs ejus paucī, et epīscopātum ejus accipiat alter. ^ May his days be few, and his bishopric let another take.
9 ^ Fīant fīliī ejus orfanī, et uxor ejus vidua. ^ May his children be fatherless, and his wife a widow.
10 ^ Nūtantēs transferantur fīliī ejus et mendīcent, et ējiciantur dē habitātiōnibus suīs. ^ Let his children be carried about vagabonds and beg, and let them be cast out of their dwellings.
11 ^ Scrūtētur foenerātor omnem substantiam ejus, et dīripiant aliēnī labōrēs ejus. ^ May the usurer search all his substance, and let strangers plunder his labours.
12 ^ Non sit illī adjūtor, nec sit quī misereātur pūpillīs ejus. ^ May there be none to help him, nor none to pity his fatherless offspring.
13 ^ Fīant nātī ejus in interitum~; in generātiōne ūnā dēleātur nōmen ejus. ^ May his posterity be cut off~; in one generation may his name be blotted out.
14 ^ In memoriam rediat inīquitās patrum ejus in conspectū Dominī, et peccātum mātris ejus non dēleātur. ^ May the iniquity of his fathers be remembered in the sight of the Lord, and let not the sin of his mother be blotted out.
15 ^ Fīant contrā Dominum semper, et dispereat dē terrā memoria eōrum, ^ May they be before the Lord continually, and let the memory of them perish from the earth,
16 ^ prō eō quod non est recordātus facere misericordiam, et persecūtus est hominem inopem et mendīcum, et compunctum corde, mortificāre. ^ because he remembered not to show mercy, but persecuted the poor man and the beggar, and the broken in heart, to put him to death.
17 ^ Et dīlexit maledictiōnem, et veniet eī. Et nōluit benedictiōnem, et ēlongābitur ab eō. ^ And he loved cursing, and it shall come unto him. And he would not have blessing, and it shall be far from him.
18 ^ Et indūvit maledictiōnem sīcut vestimentum, et intrāvit sīcut aqua in interiōra ejus, et sīcut oleum in ossibus ejus. ^ And he put on cursing like a garment, and it went in like water into his entrails, and like oil in his bones.
19 ^ Fīat eī sīcut vestimentum, quō operītur, et sīcut zōna quā semper praecingitur. ^ May it be unto him like a garment which covereth him, and like a girdle with which he is girded continually.
20 ^ Hoc opus eōrum quī dētrahunt mihī apud Dominum, et quī loquuntur mala adversus animam meam. ^ This is the work of them who detract me before the Lord~; and who speak evils against my soul.
21 ^ Et tū, Domine, Domine, fac mēcum propter nōmen tuum, quia suāvis est misericordia tua. ^ But thou, O Lord, O Lord, do with me for thy name's sake, because thy mercy is sweet.
22 ^ Līberā mē, quia egēnus et pauper egō sum, et cor meum conturbātum est intrā mē. ^ Deliver me, for I am poor and needy, and my heart is troubled within me.
23 ^ Sīcut umbra quum dēclīnat ablātus sum, et excussus sum sīcut locustae. ^ Like the shadow when it declineth I am taken away, and I am shaken off as locusts.
24 ^ Genua mea infirmāta sunt ā jējūniō, et carō mea immūtāta est propter oleum. ^ My knees are weakened through fasting, and my flesh is changed for oil.
25 ^ Et egō factus sum opprobrium illīs~; vīdērunt mē, et mōvērunt capita sua. ^ And I am become a reproach to them~; they saw me and they shaked their heads.
26 ^ Adjuvā mē, Domine Deus meus~; salvum mē fac secundum misericordiam tuam. ^ Help me, O Lord my God~; save me according to thy mercy.
27 ^ Et sciant quia manus tua haec, et tū, Domine, fēcistī eam. ^ And let them know that this is thy hand, and that thou, O Lord, hast done it.
28 ^ Maledīcent illī, et tū benedīcēs~; quī insurgunt in mē, confundantur, servus autem tuus laetābitur. ^ They will curse and thou wilt bless~; them that rise up against me, be confounded, thy servant however shall rejoice.
29 ^ Induantur quī dētrahunt mihī pudōre, et operiantur sīcut diploide confūsiōne suā. ^ Let them that detract me be clothed with shame, and let them be covered with their confusion as with a double cloak.
30 ^ Confitēbor Dominō nimis in ōre meō, et in mediō multōrum laudābō eum. ^ I will give great thanks to the Lord with my mouth, and in the midst of many I will praise him.
31 ^ Quia astitit ā dextrīs pauperis, ut salvam faceret ā persequentibus animam meam. ^ Because he hath stood at the right hand of the poor, to save my soul from persecutors.
