1 ^ Dixit Dòminus Dòmino meo, «~Sede a dèxtrîs meîs, donec ponam inimícos tuos scabèllum pèdum tuórum.~»
2 ^ Vìrgam virtútis tuae emìttet Dòminus ex Sióne~; domináre in mèdio inimicórum tuórum. 
3 ^ Tecum prinçìpium in die virtútis tuae, in splendóribus sanctórum~; ex útero ante luçìferum gènui te. 
4 ^ Jurávit Dòminus et non poenitébit eum, «~Tu es sáçerdos in aetèrnum secùndum órdinem Melcisedécis.~»
5 ^ Dòminus a dèxtrîs tuîs~; confrégit in die irae suae reges. 
6 ^ Judicábit in naziónibus, implébit ruínas~; conqvassábit cápita in terra multórum. 
7 ^ De torrènte in via bìbet~; proptèrea exaltábit caput. 
