1 ^ Confitébor tìbi, Dòmine, in toto corde meo~; in consìlio justórum et congregațióne. 
2 ^ Magna ópera Dòmini, exqụisíta in òmnes voluntátes ejus. 
3 ^ Confèssio et magnificènția opus ejus, et justìția ejus manet in sáĕculum sáĕculi. 
4 ^ Memóriam fecit mirabílium suórum~; misèricors et miserátor Dòminus. 
5 ^ Éscam dèdit timèntibus se. Mèmor èrit in sáĕculum testamènti sui. 
6 ^ virtútem óperum suórum adnunțiábit pòpulo suo, 
7 ^ ut det illîs hereditátem ģèntium~; ópera mánuum ejus vèritas et judìcium. 
8 ^ Fidélia òmnia mandáta ejus, confirmáta in sáĕculum sáĕculi, facta in veritáte et aĕqụitáte. 
9 ^ Redempțiónem misit pòpulo suo~; mandávit in aĕtèrnum testamèntum suum. sanctum, et terrìbile nomen ejus. 
10 ^ Inìtium sapiènțiaĕ tìmor Dòmini~; intelléctus bonus òmnibus facièntibus eum. Laŭdáțio ejus manet in sáĕculum sáĕculi. 
