1 ^ Beátus vìr qui tìmet Dòminum~; in mandátîs ejus volet nìmis. 
2 ^ Potens in terra èrit semen ejus~; generázio rectórum benedicétur. 
3 ^ Glória et divìziae in domu ejus, et justìzia ejus manet in sáeculum sáeculi. 
4 ^ Exórtum est in tènebrîs lumen rectîs~; misèricors, et miserátor, et justus. 
5 ^ Jucùndus hòmo qui miserétur et còmmodat~; dispónet sermónes suos in judìçio, 
6 ^ quia in aetèrnum non commovébitur. 
7 ^ In memória aetèrna èrit justus~; ab audizióne mala non timébit~; parátum cor ejus speráre in Dòmino. 
8 ^ Confirmátum est cor ejus~; non commovébitur donec despìçiat inimícos suos. 
9 ^ Dispèrsit~; dèdit paupèribus~; justìzia ejus manet in sáeculum sáeculi~; cornu ejus exaltábitur in glória. 
10 ^ Peccátor vedébit, et irascétur~; dèntibus suîs frèmet et tabéscet~; desidèrium peccatórum períbit. 
