1 ^ Beátus vìr cvi tìmet Dòminum~; in mandátîs ejus volet nìmis. 
2 ^ Potens in terra èrit semen ejus~; ǧeneráṭio rectórum benedicétur. 
3 ^ Glória et divìṭiae in domu ejus, et justìṭia ejus manet in sáeculum sáeculi. 
4 ^ Exórtum est in tènebrîs lumen rectîs~; misèricors, et miserátor, et justus. 
5 ^ Jucùndus hòmo cvi miserétur et còmmodat~; dispónet sermónes suos in judìcio, 
6 ^ cvia in aetèrnum non commovébitur. 
7 ^ In memória aetèrna èrit justus~; ab audiṭióne mala non timébit~; parátum cor ejus speráre in Dòmino. 
8 ^ Confirmátum est cor ejus~; non commovébitur donec despìčiat inimícos suos. 
9 ^ Dispèrsit~; dèdit paupèribus~; justìṭia ejus manet in sáeculum sáeculi~; cornu ejus exaltábitur in glória. 
10 ^ Peccátor vedébit, et irascétur~; dèntibus suîs frèmet et tabéscet~; desidèrium peccatórum períbit. 
