1 ^ Laŭdáte, púeri, Dòminum~; laŭdáte nomen Dòmini. 
2 ^ Sit nomen Dòmini benedìctum, ex hoc nunc, et usqụe in sáĕculum. 
3 ^ A solis ortu usqụe ad occásum laŭdábile nomen Dòmini. 
4 ^ Excèlsus super òmnes ģèntes Dòminus, et super caĕlos glória ejus. 
5 ^ ¿~Qụìs sicut Dòminus Deus noster, qụi in altîs hábitat, 
6 ^ et humìlia rèspicit in caĕlo et in terra~? 
7 ^ Sùscitans a terra ìnopem, et de stèrcore ériģens páŭperem, 
8 ^ Ut còllocet eum cum princìpibus, cum princìpibus pòpuli sui. 
9 ^ Qụi habitáre façit stèrilem in domu, matrem filiórum laĕtántem. 
