1 ^ Laudáte, púeri, Dòminum~; laudáte nomen Dòmini. 
2 ^ Sit nomen Dòmini benedìctum, ex hoc nunc, et usqve in sáeculum. 
3 ^ A solis ortu usqve ad occásum laudábile nomen Dòmini. 
4 ^ Excèlsus super òmnes gèntes Dòminus, et super caelos glória ejus. 
5 ^ ¿~Qvìs sicut Dòminus Deus noster, qvi in altîs hábitat, 
6 ^ et humìlia rèspicit in caelo et in terra~? 
7 ^ Sùscitans a terra ìnopem, et de stèrcore érigens páuperem, 
8 ^ Ut còllocet eum cum prinçìpibus, cum prinçìpibus pòpuli sui. 
9 ^ Qvi habitáre façit stèrilem in domu, matrem filiórum laetántem. 
