1 ^ In èxitu Isráhel de Aeǧìpto, domus Jacóbis de pòpulo bárbaro, 
2 ^ facta est Judéa sanctificáṭio ejus~; Isráhel potèstas ejus. 
3 ^ Mare vîdit et fuǧívit~; Jordánis convèrsus est retrósum. 
4 ^ Mòntes exsultavérunt ut aríetes, et colles sicut agni óvium. 
5 ^ ¿~Cvid est tìbi, mare, cvod fuǧivìsti~? ¿~Et tu, Jordánis, cvia convèrsus es retrósum~? 
6 ^ Mòntes, ¿~exsultavìstis sicut aríetes~? Et colles, ¿~sicut agni óvium~? 
7 ^ A fáčie Dòmini mota est terra, a fáčie Dei Jacóbis, 
8 ^ cvi convèrtuit pètram in stagna acvárum, et rupem in fontes acvárum. 
9 ^ Non nobîs, Dòmine, non nobîs, sed nómini tuo da glóriam, super misericórdia tua et veritáte tua, 
10 ^ necvándo dicant ǧèntes, «~¿~Ubi est Deus eórum~?~». 
11 ^ Deus autem noster in caelo~; òmnia cvaecumcve vóluit fečit. 
12 ^ Simulácra ǧèntium arǧèntum et aurum, ópera mánuum hòminum. 
13 ^ Os habent, et non locvèntur~; òculos habent, et non vedébunt. 
14 ^ Aures habent, et non audient~; nares habent, et non odorábunt. 
15 ^ Manûs habent, et non palpábunt~; pèdes habent, et non ambülábunt~; non clamábunt in gùtture suo. 
16 ^ Sìmiles illîs fiant cvi fáčiunt ea, et òmnes cvi confídunt in eîs. 
17 ^ Domus Israhélis sperávit in Dòmino~; adjútor eórum et protéctor eórum est. 
18 ^ Domus Aharónis sperávit in Dòmino~; adjútor eórum et protéctor eórum est. 
19 ^ Cvi tìment Dòminum, speravérunt in Dòmino~; adjútor eórum et protéctor eórum est. 
20 ^ Dòminus mèmor fuit nostri, et benedíxit nobîs. Benedíxit dómui Israhélis~; benedíxit dómui Aharónis. 
21 ^ benedíxit òmnibus cvi tìment Dòminum, pusìllîs cum majóribus. 
22 ^ Adjìciat Dòminus super vos~; super vos et super fílios vèstros. 
23 ^ Benedìcti vos a Dòmino, cvi fečit caelum et terram. 
24 ^ Caelum caeli Dòmino~; terram autem dèdit fíliîs hòminum. 
25 ^ Non mórtui laudábunt te, Dòmine, nècve òmnes cvi descèndunt in infèrnum. 
26 ^ Sed nos cvi vívimus benedícimus Dòmino, ex hoc nunc et uscve in sáeculum. 
