1 ^ Confitémini Dòmino, qụóniam bonus, qụóniam in sáĕculum misericórdia ejus. 
2 ^ Dicat nunc Isráhel qụóniam bonus, qụóniam in sáĕculum misericórdia ejus. 
3 ^ Dicat nunc domus Aharónis, qụóniam in sáĕculum misericórdia ejus. 
4 ^ Dicant nunc qụi tìment Dòminum, qụóniam in sáĕculum misericórdia ejus. 
5 ^ De tribulațióne invocávi Dòminum, et exaŭdívit me in latitúdinem Dòminus. 
6 ^ Dòminus mìchi adjútor~; non timébo qụid fáçiat mìchi hòmo. 
7 ^ Dòminus mìchi adjútor, et ego despìciam inimícos meos. 
8 ^ Bonum est confídere in Dòmino, qụam confídere in hòmine. 
9 ^ Bonum est speráre in Dòmino, qụam speráre in princìpibus. 
10 ^ Òmnes ģèntes circumivérunt me, et in nómine Dòmini qụia ultus sum in eos. 
11 ^ Circumdántes circumdedérunt me, et in nómine Dòmini qụia ultus sum in eos. 
12 ^ Circumdedérunt me sicut apes, et exarsérunt sicut ìgnis in spinîs, et in nómine Dòmini qụia ultus sum in eos. 
13 ^ Impùlsus evèrsus sum ut cáderem, et Dòminus suscépit me. 
14 ^ Fortitúdo mea et laŭs mea Dòminus, et factus est mìchi in salútem. 
15 ^ Vox exsultațiónis et salútis in tabernáculîs justórum. dèxtera Dòmini fecit virtútem. 
16 ^ dèxtera Dòmini exaltávit me~; dèxtera Dòmini fecit virtútem. 
17 ^ Non mórier, sed vivem, et narrábo ópera Dòmini. 
18 ^ Castígans castigávit me Dòminus, et morti non trádidit me. 
19 ^ Aperíte mìchi portas justìțiaĕ~; ingrèssus in eas confitébor Dòmino. 
20 ^ Haĕc porta Dòmini~; justi intrábunt in eam. 
21 ^ Confitébor tìbi qụóniam exaŭdivìsti me, et factus es mìchi in salútem. 
22 ^ Lápidem qụem reprobavérunt aĕdificántes, hic factus est in caput ánguli. 
23 ^ A Dòmino factum est ìstud, et est mirábile in òculîs nostrîs. 
24 ^ Haĕc est dies qụam fecit Dòminus~; exsultémus, et laĕtémur in ea. 
25 ^ O Dòmine, salvum me fac. O Dòmine, bène prosperáre. 
26 ^ Benedìctus qụi vênit in nómine Dòmini. Benedíximus vobîs de domu Dòmini. 
27 ^ Deus Dòminus, et illúxit nobîs. Constitúite diem solèmnem in condènsîs, usqụe ad cornu altáris. 
28 ^ Deus meus es tu, et confitébor tìbi~; Deus meus es tu, et exaltábo te. Confitébor tìbi qụóniam exaŭdivìsti me, et factus es mìchi in salútem. 
29 ^ Confitémini Dòmino, qụóniam bonus, qụóniam in sáĕculum misericórdia ejus. 
