1 ^ Confitémini Dòmino, qŭóniam bonus, qŭóniam in sáĕculum misericórdia ejus. ^ Give praise to the Lord, for he is good, for his mercy endureth for ever.
2 ^ Dicat nùnc Isráhel qŭóniam bonus, qŭóniam in sáĕculum misericórdia ejus. ^ Let Israel now say, that he is good, that his mercy endureth for ever.
3 ^ Dicat nùnc domus Aharónis, qŭóniam in sáĕculum misericórdia ejus. ^ Let the house of Aaron now say, that his mercy endureth for ever.
4 ^ Dicant nùnc qŭi tìment Dòminum, qŭóniam in sáĕculum misericórdia ejus. ^ Let them that fear the Lord now say, that his mercy endureth for ever.
5 ^ De tribulatióne invocávi Dòminum, et exaŭdívit me in latitúdinem Dòminus. ^ In my trouble I called upon the Lord, and the Lord hearkened me into broadness.
6 ^ Dòminus mìhi adjútor~; non timébo qŭid fáciat mìhi hòmo. ^ The Lord is my helper~; I will not fear what man can do unto me.
7 ^ Dòminus mìhi adjútor, et ego despìciam inimícos meos. ^ The Lord is my helper, and I will look over my enemies.
8 ^ Bonum èst confídere in Dòmino, qŭam confídere in hòmine. ^ It is good to confide in the Lord, rather than to have confidence in man.
9 ^ Bonum èst speráre in Dòmino, qŭam speráre in princìpibus. ^ It is good to trust in the Lord, rather than to trust in princes.
10 ^ Òmnes gèntes circumivérunt me, et in nómine Dòmini qŭia ultus sùm in eos. ^ All nations compassed me about, and in the name of the Lord I have been revenged on them.
11 ^ Circumdántes circumdedérunt me, et in nómine Dòmini qŭia ultus sùm in eos. ^ Surrounding me they compassed me about, and in the name of the Lord I have been revenged on them.
12 ^ Circumdedérunt me sicut apes, et exarsérunt sicut ìgnis in spinîs, et in nómine Dòmini qŭia ultus sùm in eos. ^ They surrounded me like bees, and they burned like fire among thorns, and in the name of the Lord I was revenged on them.
13 ^ Impùlsus evèrsus sùm ut cáderem, et Dòminus suscépit me. ^ Being pushed I was overturned that I might fall, but the Lord supported me.
14 ^ Fortitúdo mea et laŭs mea Dòminus, et factus èst mìhi in salútem. ^ The Lord is my strength and my praise, and he is become my salvation.
15 ^ Vox exsultatiónis et salútis in tabernáculîs justórum. dèxtera Dòmini fecit virtútem. ^ The voice of rejoicing and of salvation is in the tabernacles of the just. The right hand of the Lord hath wrought strength.
16 ^ dèxtera Dòmini exaltávit me~; dèxtera Dòmini fecit virtútem. ^ The right hand of the Lord hath exalted me~; the right hand of the Lord hath wrought strength.
17 ^ Non mórier, sed vivem, et narrábo ópera Dòmini. ^ I shall not die, but live, and shall declare the works of the Lord.
18 ^ Castígans castigávit me Dòminus, et morti non trádidit me. ^ The Lord chastising hath chastised me, but he hath not delivered me over to death.
19 ^ Aperíte mìhi portas justìtiaĕ~; ingrèssus in eas confitébor Dòmino. ^ Open ye to me the gates of justice~; having entered into to them I will give praise to the Lord.
20 ^ Haĕc porta Dòmini~; justi intrábunt in eam. ^ This is the gate of the Lord~; the just shall enter into it.
21 ^ Confitébor tìbi qŭóniam exaŭdivìsti me, et factus ès mìhi in salútem. ^ I will give glory to thee because thou hast heard me, and art become my salvation.
22 ^ Lápidem qŭem reprobavérunt aĕdificántes, hic factus èst in caput ánguli. ^ The stone which the builders rejected~; this is become the head of the corner.
23 ^ A Dòmino factum èst ìstud, et èst mirábile in òculîs nostrîs. ^ This is the Lord's doing, and it is wonderful in our eyes.
24 ^ Haĕc èst dies qŭam fecit Dòminus~; exsultémus, et laĕtémur in ea. ^ This is the day which the Lord hath made~; let us be glad and rejoice therein.
25 ^ O Dòmine, salvum me fac. O Dòmine, bène prosperáre. ^ O Lord, save me. O Lord, give good success.
26 ^ Benedìctus qŭi vênit in nómine Dòmini. Benedíximus vobîs de domu Dòmini. ^ Blessed be he that cometh in the name of the Lord. We have blessed you out of the house of the Lord.
27 ^ Deus Dòminus, et illúxit nobîs. Constitúite diem solèmnem in condènsîs, usqŭe ad cornu altáris. ^ The Lord is God, and he hath shone upon us. Appoint a solemn day with shady boughs, even to the horn of the altar.
28 ^ Deus meus ès tu, et confitébor tìbi~; Deus meus ès tu, et exaltábo te. Confitébor tìbi qŭóniam exaŭdivìsti me, et factus ès mìhi in salútem. ^ Thou art my God, and I will praise thee~; thou art my God, and I will exalt thee. I will praise thee because thou hast heard me, and art become my salvation.
29 ^ Confitémini Dòmino, qŭóniam bonus, qŭóniam in sáĕculum misericórdia ejus. ^ O praise ye the Lord, for he is good, for his mercy endureth for ever.
