164 ^ Sèpties in die laŭdem dixi tìbi, super judìcia justìțiaĕ tuaĕ. ^ Seven times a day I have given praise to thee, for the judgments of thy justice.
165 ^ Pax mùlta diliģèntibus leģem tuam, et non est illîs scándalum. ^ Much peace have they that love thy law, and to them there is no stumbling block.
166 ^ Expectábam salutáre tuum, Dòmine, et mandáta tua diléxi. ^ I looked for thy salvation, O Lord, and I loved thy commandments.
167 ^ Custodívit ánima mea testimónia tua, et diléxit ea vehemènter. ^ My soul hath kept thy testimonies and hath loved them exceedingly.
168 ^ Servávi mandáta tua et testimónia tua, qụia òmnes viaĕ meaĕ in conspèctu tuo. ^ I have kept thy commandments and thy testimonies, because all my ways are in thy sight.
169 ^ Appropìnqụet deprecáțio mea in conspèctu tuo, Dòmine~; juxta elóqụium tuum da mìchi intelléctum. ^ Let my supplication, O Lord, come near in thy sight~; give me understanding according to thy word.
170 ^ Intret postuláțio mea in conspèctu tuo~; secùndum elóqụium tuum éripe me. ^ Let my request come in before thee~; deliver thou me according to thy word.
171 ^ Eructábunt lábia mea hìmnum, qụum docùerîs me justificațiónes tuas. ^ My lips shall utter a hymn, when thou shalt teach me thy justifications.
172 ^ Pronunțiábit lìngụa mea elóqụium tuum, qụia òmnia mandáta tua áĕqụitas. ^ My tongue shall pronounce thy word, because all thy commandments are justice.
173 ^ Fiat manus tua ut salvet me, qụóniam mandáta tua eléģi. ^ Let thy hand be with me to save me~; for I have chosen thy precepts.
174 ^ Concupívi salutáre tuum, Dòmine, et lex tua meditáțio mea est. ^ I have longed for thy salvation, O Lord, and thy law is my meditation.
175 ^ Vivet ánima mea, et laŭdábit te, et judìcia tua adjuvábunt me. ^ My soul shall live, and it shall praise thee, and thy judgments shall help me.
176 ^ Errávi sicut ovis qụaĕ perívit~; qụaĕre servum tuum, qụia mandáta tua non sum oblítus. ^ I have gone astray like a sheep that is lost~; seek thy servant, because I have not forgotten thy commandments.
