1 ^ Beáti immaculáti in via, qụi ámbulant in leģe Dòmini. ^ Blessed are the undefiled in the way, who walk in the law of the Lord.
2 ^ Beáti qụi scrutántur testimónia ejus~; in toto corde exqụírent eum. ^ Blessed are they that search his testimonies~; they will seek him with their whole heart.
3 ^ Non ènim qụi operántur iniqụitátem in viîs ejus ambulavérunt. ^ For they that work iniquity have not walked in his ways.
4 ^ Tu mandavìsti mandáta tua custodíri nìmis. ^ Thou hast commanded thy commandments to be kept most diligently.
5 ^ Útinam diriģántur viaĕ meaĕ ad custodièndas justificațiónes tuas. ^ O that my ways may be directed to keep thy justifications.
6 ^ Tunc non confùndar, qụum perspèxero in òmnibus mandátîs tuîs. ^ Then shall I not be confounded, when I shall look into all thy commandments.
7 ^ Confitébor tìbi in direcțióne cordis, in eo qụod dìdici judìcia justìțiaĕ tuaĕ. ^ I will praise thee with uprightness of heart, when I shall have learned the judgments of thy justice.
8 ^ Justificațiónes tuas custódiem~; non me derelìnqụas usqụeqụáqụe. ^ I will keep thy justifications~; do not thou utterly forsake me.
9 ^ ¿~In qụo córriģit adolescènțior viam suam~? In custodièndo sermónes tuos. ^ By what doth a young man correct his way~? By observing thy words.
10 ^ In toto corde meo exqụisívi te~; ne repèllas me a mandátîs tuîs. ^ With my whole heart have I sought after thee~; let me not stray from thy commandments.
11 ^ In corde meo abscòndui elóqụia tua, ut non peccem tìbi. ^ Thy words have I hidden in my heart, that I may not sin against thee.
12 ^ Benedìctus es Dòmine~; dòce me justificațiónes tuas. ^ Blessed art thou, O Lord~; teach me thy justifications.
13 ^ In lábiîs meîs pronunțiávi òmnia judìcia oris tui. ^ With my lips I have pronounced all the judgments of thy mouth.
14 ^ In via testimoniórum tuórum delectátus sum, sicut in òmnibus divìtiîs. ^ I have been delighted in the way of thy testimonies, as in all riches.
15 ^ In mandátîs tuîs exercébor, et considerábo vias tuas. ^ I will meditate on thy commandments, and I will consider thy ways.
16 ^ In justificațiónibus tuîs meditábor~; non oblivíscer sermónes tuos. ^ I will think of thy justifications~; I will not forget thy words.
17 ^ Retrìbue servo tuo~; vivìfica me, et custódiem sermónes tuos. ^ Give bountifully to thy servant~; enliven me, and I shall keep thy words.
18 ^ Revéla òculos meos, et considerábo mirabìlia de leģe tua. ^ Open thou my eyes, and I will consider the wondrous things of thy law.
19 ^ Ìncola ego sum in terra~; non abscòndas a me mandáta tua. ^ I am a sojourner on the earth~; do not hide thy commandments from me.
20 ^ Concupívit ánima mea desideráre justificațiónes tuas in òmni tèmpore. ^ My soul hath coveted to long for thy justifications at all times.
21 ^ Increpavìsti supèrbos~; maledìcti qụi declínant a mandátîs tuîs. ^ Thou hast rebuked the proud~; they are cursed who decline from thy commandments.
22 ^ Aŭfer a me oppróbrium et contèmptum, qụia testimónia tua exqụisívi. ^ Remove from me reproach and contempt, because I have sought after thy testimonies.
23 ^ Ètenim sedérunt príncipes, et advèrsum me loqụebántur~; sèrvus aŭtem tuus exercebátur in justificațiónibus tuîs. ^ For princes sat, and spoke against me~; yet thy servant was employed in thy justifications.
24 ^ Nam et testimónia tua meditáțio mea est, et consìlium meum justificațiónes tuaĕ. ^ For thy testimonies are my meditation, and thy justifications my counsel.
25 ^ Adhaĕsit pavimènto ánima mea~; vivìfica me secùndum vèrbum tuum. ^ My soul hath cleaved to the pavement~; quicken thou me according to thy word.
26 ^ Vias meas enunțiávi, et exaŭdivìsti me~; dòce me justificațiónes tuas. ^ I have declared my ways, and thou hast heard me~; teach me thy justifications.
27 ^ Viam justificațiónum tuárum ìnstrue me, et exercébor in mirabìlibus tuîs. ^ Make me to understand the way of thy justifications, and I shall be exercised in thy wondrous works.
28 ^ Dormitávit ánima mea praĕ táĕdio~; confìrma me in vèrbîs tuîs. ^ My soul hath slumbered through heaviness~; strengthen thou me in thy words.
29 ^ Viam iniqụitátis ámove a me, et de leģe tua miserére mei. ^ Remove from me the way of iniquity, and out of thy law have mercy on me.
30 ^ Viam veritátis eléģi~; judìcia tua non sum oblítus. ^ I have chosen the way of truth~; thy judgments I have not forgotten.
31 ^ Adháĕsi testimóniîs tuîs, Dòmine~; noli me confùndere. ^ I have stuck to thy testimonies, O Lord~; put me not to shame.
32 ^ Viam mandatórum tuórum cucùrri, qụum dilatavìsti cor meum. ^ I have run the way of thy commandments, when thou didst enlarge my heart.
33 ^ Leģem pone mìchi, Dòmine, viam justificațiónum tuárum, et exqụíram eam sèmper. ^ Set for me a law, O Lord, the way of thy justifications, and I will always seek after it.
34 ^ Da mìchi intelléctum, et scrutábor leģem tuam, et custódiem illam in toto corde meo. ^ Give me understanding, and I will search thy law, and I will keep it with my whole heart.
35 ^ Dedúce me in sémitam mandatórum tuórum, qụia ìpsam vólui. ^ Lead me into the path of thy commandments, for I have desired it.
36 ^ Inclína cor meum in testimónia tua, et non in avarìțiam. ^ Incline my heart into thy testimonies, and not to covetousness.
37 ^ Avèrte òculos meos ne vèdeant vanitátem~; in via tua vivìfica me. ^ Turn away my eyes that they may not behold vanity~; quicken me in thy way.
38 ^ Státue servo tuo elóqụium tuum in timóre tuo. ^ Establish thy word to thy servant in thy fear.
39 ^ Ámputa oppróbrium meum qụod suspicátus sum, qụia judìcia tua jucùnda. ^ Turn away my reproach which I have apprehended, for thy judgments are delightful.
40 ^ Ecce concupívi mandáta tua~; in aĕqụitáte tua vivìfica me. ^ Behold I have longed after thy precepts~; quicken me in thy justice.
41 ^ Et vèniat super me misericórdia tua, Dòmine~; salutáre tuum secùndum elóqụium tuum. ^ And let thy mercy also come upon me, O Lord~; thy salvation according to thy word.
42 ^ Et respondébo exprobrántibus mìchi vèrbum, qụia sperávi in sermónibus tuîs. ^ And I shall answer them that reproach me in any thing~; that I have trusted in thy words.
43 ^ Et ne áŭferas de ore meo vèrbum veritátis usqụeqụáqụe, qụia in judìciîs tuîs supersperávi. ^ And take not thou the word of truth utterly out of my mouth, for in thy words I have hoped exceedingly.
44 ^ Et custódiem leģem tuam sèmper, in sáĕculum et in sáĕculum sáĕculi. ^ And I shall always keep thy law, for ever and for ever and ever.
45 ^ Et ambulábam in latitúdine, qụia mandáta tua exqụisívi. ^ And I walked at large, because I have sought after thy commandments.
46 ^ Et loqụébar in testimóniîs tuîs in conspèctu reģum, et non confundébar. ^ And I spoke of thy testimonies before kings, and I was not ashamed.
47 ^ Et meditábar in mandátîs tuîs, qụaĕ diléxi. ^ And I meditated on thy commandments, which I loved.
48 ^ Et levávi manûs meas ad mandáta tua, qụaĕ diléxi, et exercébar in justificațiónibus tuîs. ^ And I lifted up my hands to thy commandments, which I loved, and I was exercised in thy justifications.
49 ^ Mèmor èsto vèrbi tui servo tuo, in qụo mìchi spem dedìsti. ^ Be thou mindful of thy word to thy servant, in which thou hast given me hope.
50 ^ Haĕc me consoláta est in humilitáte mea, qụia elóqụium tuum vivificávit me. ^ This hath comforted me in my humiliation, because thy word hath enlivened me.
51 ^ Supèrbi iníqụe aģébant usqụeqụáqụe, a leģe aŭtem tua non declinávi. ^ The proud did iniquitously altogether, but I declined not from thy law.
52 ^ Mèmor fui judiciórum tuórum a sáĕculo Dòmine, et consolátus sum. ^ I remembered, O Lord, thy judgments of old, and I was comforted.
53 ^ Defècțio tènuit me, pro peccatóribus derelinqụèntibus leģem tuam. ^ A fainting hath taken hold of me, because of the wicked that forsake thy law.
54 ^ Cantábiles mìchi èrant justificațiónes tuaĕ in loco peregrinațiónis meaĕ. ^ Thy justifications were the subject of my song, in the place of my pilgrimage.
55 ^ Mèmor fui nòcte nóminis tui Dòmine, et custodívi leģem tuam. ^ In the night I have remembered thy name, O Lord, and have kept thy law.
56 ^ Haĕc facta est mìchi, qụia justificațiónes tuas exqụisívi. ^ This happened to me, because I sought after thy justifications.
57 ^ Pórțio mea, Dòmine~; dixi custodíre leģem tuam. ^ My portion, O Lord~; I have said I would keep thy law.
58 ^ Deprecátus sum fáçiem tuam in toto corde meo~; miserére mei secùndum elóqụium tuum. ^ I entreated thy face with all my heart~; have mercy on me according to thy word.
59 ^ Coģitávi vias meas, et convèrtui pèdes meos in testimónia tua. ^ I have thought on my ways, and turned my feet unto thy testimonies.
60 ^ Parátus sum, et non sum turbátus, ut custódiam mandáta tua. ^ I am ready, and am not troubled, that I may keep thy commandments.
61 ^ Funes peccatórum circumplèxi sunt me, et leģem tuam non sum oblítus. ^ The cords of the wicked have encompassed me, but I have not forgotten thy law.
62 ^ Mèdia nòcte surģébam, ad confitèndum tìbi super judìcia justificațiónis tuaĕ. ^ I rose at midnight to give praise to thee, for the judgments of thy justification.
63 ^ Párticeps ego sum òmnium timèntium te, et custodièntium mandáta tua. ^ I am a partaker with all them that fear thee, and that keep thy commandments.
64 ^ Misericórdia tua, Dòmine, plena est terra~; justificațiónes tuas dòce me. ^ The earth, O Lord, is full of thy mercy~; teach me thy justifications.
65 ^ Bonitátem fecìsti cum servo tuo, Dòmine, secùndum vèrbum tuum. ^ Thou hast done well with thy servant, O Lord, according to thy word.
66 ^ Bonitátem et disciplínam et sciènțiam dòce me, qụia mandátîs tuîs crédidi. ^ Teach me goodness and discipline and knowledge, for I have believed thy commandments.
67 ^ Priùsqụam humiliárer ego delíqụi~; proptèrea elóqụium tuum custodívi. ^ Before I was humbled I offended~; therefore have I kept thy word.
68 ^ Bonus es tu, et in bonitáte tua dòce me justificațiónes tuas. ^ Thou art good, and in thy goodness teach me thy justifications.
69 ^ Multiplicáta est super me iníqụitas superbórum~; ego aŭtem in toto corde meo scrutábor mandáta tua. ^ The iniquity of the proud hath been multiplied over me~; but I will seek thy commandments with my whole heart.
70 ^ Coagulátum est sicut lac cor eórum~; ego vero leģem tuam meditátus sum. ^ Their heart is curdled like milk~; but I have meditated on thy law.
71 ^ Bonum mìchi qụia humiliavìsti me, ut dìscam justificațiónes tuas. ^ It is good for me that thou hast humbled me, that I may learn thy justifications.
72 ^ Bonum mìchi lex oris tui, super mìllia aŭri et arģènti. ^ The law of thy mouth is good to me, above thousands of gold and silver.
73 ^ Manûs tuaĕ fecérunt me, et plasmavérunt me~; da mìchi intelléctum, et dìscam mandáta tua. ^ Thy hands have made me and formed me~; give me understanding, and I will learn thy commandments.
74 ^ Qụi tìment te vedébunt me, et laĕtabùntur, qụia in vèrba tua supersperávi. ^ They that fear thee shall see me, and shall be glad, because I have greatly hoped in thy words.
75 ^ Cognóvi, Dòmine, qụia áĕqụitas judìcia tua, et in veritáte tua humiliavìsti me. ^ I know, O Lord, that thy judgments are equity, and in thy truth thou hast humbled me.
76 ^ Fiat misericórdia tua ut consolétur me, secùndum elóqụium tuum servo tuo. ^ O let thy mercy be for my comfort, according to thy word unto thy servant.
77 ^ Vèniant mìchi miserațiónes tuaĕ, et vivam, qụia lex tua meditáțio mea est. ^ Let thy tender mercies come unto me, and I shall live, for thy law is my meditation.
78 ^ Confundántur supèrbi, qụia injúste iniqụitátem fecérunt in me~; ego aŭtem exercébor in mandátîs tuîs. ^ Let the proud be ashamed, because they have done unjustly towards me~; but I will be employed in thy commandments.
79 ^ Convertántur mìchi timèntes te, et qụi novérunt testimónia tua. ^ Let them that fear thee turn to me, and they that know thy testimonies.
80 ^ Fiat cor meum immaculátum in justificațiónibus tuîs, ut non confùndar. ^ Let my heart be undefiled in thy justifications, that I may not be confounded.
81 ^ Defécit in salutáre tuum ánima mea, et in vèrbum tuum supersperávi. ^ My soul hath fainted after thy salvation, and in thy word I have very much hoped.
82 ^ Defecérunt òculi mei in elóqụium tuum, dicèntes, «~¿~Qụando consoláberis me~?~». ^ My eyes have failed for thy word, saying, "When wilt thou comfort me~?"
83 ^ Qụia factus sum sicut uter in pruína~; justificațiónes tuas non sum oblítus. ^ For I am become like a bottle in the frost~; I have not forgotten thy justifications.
84 ^ ¿~Qụot sunt dies sèrvi tui~? ¿~Qụando fáçies de perseqụèntibus me judìcium~? ^ How many are the days of thy servant~? When wilt thou execute judgment on them that persecute me~?
85 ^ Narravérunt mìchi iníqụi fabulațiónes, sed non ut lex tua. ^ The wicked have told me fables, but not as thy law.
86 ^ Òmnia mandáta tua vèritas~; iníqụe persecúti sunt me~; ádjuva me. ^ All thy statutes are truth~; they have persecuted me unjustly; do thou help me.
87 ^ Paŭlo mìnus consummavérunt me in terra~; ego aŭtem non derelíqụi mandáta tua. ^ They had almost made an end of me upon earth~; but I have not forsaken thy commandments.
88 ^ Secùndum misericórdiam tuam vivìfica me, et custódiem testimónia oris tui. ^ Qụicken thou me according to thy mercy, and I shall keep the testimonies of thy mouth.
89 ^ In aĕtèrnum, Dòmine, vèrbum tuum pèrmanet in caĕlo. ^ For ever, O Lord, thy word standeth firm in heaven.
90 ^ In ģenerațiónem et ģenerațiónem vèritas tua~; fundavìsti terram, et pèrmanet. ^ Thy truth unto all generations~; thou hast founded the earth, and it continueth.
91 ^ Ordinațióne tua persevérat dies, qụóniam òmnia sèrviunt tìbi. ^ By thy ordinance the day goeth on, for all things serve thee.
92 ^ Nisi qụod lex tua meditáțio mea est, tunc forte perivìssem in humilitáte mea. ^ Unless thy law had been my meditation, I had then perhaps perished in my abjection.
93 ^ In aĕtèrnum non oblivíscer justificațiónes tuas, qụia in ìpsîs vivificavìsti me. ^ Thy justifications I will never forget, for by them thou hast given me life.
94 ^ Tuus sum ego~; salvum me fac, qụóniam justificațiónes tuas exqụisívi. ^ I am thine~; save thou me, for I have sought thy justifications.
95 ^ Me expectavérunt peccatóres ut pèrderent me~; testimónia tua intelléxi. ^ The wicked have waited for me to destroy me~; I have understood thy testimonies.
96 ^ Òmnis consummațiónis vîdi finem, latum mandátum tuum nìmis. ^ I have seen an end of all perfection~; thy commandment is exceeding broad.
97 ^ Qụómodo diléxi leģem tuam, Dòmine~; tota die meditáțio mea est. ^ O how have I loved thy law, O Lord~; it is my meditation all the day.
98 ^ Super inimícos meos prudèntem me fecìsti mandáto tuo, qụia in aĕtèrnum mìchi est. ^ Through thy commandment, thou hast made me wiser than my enemies, for it is ever with me.
99 ^ Super òmnes docèntes me intelléxi, qụia testimónia tua meditáțio mea est. ^ I have understood more than all my teachers, because thy testimonies are my meditation.
100 ^ Super sènes intelléxi, qụia mandáta tua qụaĕsívi. ^ I have had understanding above ancients, because I have sought thy commandments.
101 ^ Ab òmni via mala prohìbui pèdes meos, ut custódiam vèrba tua. ^ I have restrained my feet from every evil way, that I may keep thy words.
102 ^ Ab judìciîs tuîs non declinávi, qụia tu leģem posuìsti mìchi. ^ I have not declined from thy judgments, because thou hast set me a law.
103 ^ Qụam dùlcia fáŭcibus meîs elóqụia tua, super mel ori meo. ^ How sweet are thy words to my palate, more than honey to my mouth.
104 ^ A mandátîs tuîs intelléxi~; proptèrea odívi òmnem viam iniqụitátis. ^ By thy commandments I have had understanding, therefore have I hated every way of iniquity.
105 ^ Lucèrna pèdibus meîs vèrbum tuum, et lumen sémitîs meîs. ^ Thy word is a lamp to my feet, and a light to my paths.
106 ^ Jurávi et statúvi custodíre judìcia justìțiaĕ tuaĕ. ^ I have sworn and am determined to keep the judgments of thy justice.
107 ^ Humiliátus sum usqụeqụáqụe, Dòmine~; vivìfica me secùndum vèrbum tuum. ^ I have been humbled exceedingly, O Lord~; quicken thou me according to thy word.
108 ^ Voluntária oris mei beneplácita fac, Dòmine, et judìcia tua dòce me. ^ The free offerings of my mouth make acceptable, O Lord, and teach me thy judgments.
109 ^ Ánima mea in mánibus meîs sèmper, et leģem tuam non sum oblítus. ^ My soul is continually in my hands, and I have not forgotten thy law.
110 ^ Posuérunt peccatóres láqụeum mìchi, et de mandátîs tuîs non errávi. ^ Sinners have laid a snare for me, but I have not erred from thy precepts.
111 ^ Hereditáte acqụisívi testimónia tua in aĕtèrnum, qụia exsultáțio cordis mei sunt. ^ I have purchased thy testimonies for an inheritance for ever, because they are the joy of my heart.
112 ^ Inclinávi cor meum ad facièndas justificațiónes tuas in aĕtèrnum, pròpter retribuțiónem. ^ I have inclined my heart to do thy justifications for ever, for the reward.
113 ^ Iníqụos ódio hábui, et leģem tuam diléxi. ^ I regarded the unjust transgressors with hated, and have loved thy law.
114 ^ Adjútor et suscèptor meus es tu, et in vèrbum tuum supersperávi. ^ Thou art my helper and my protector, and in thy word I have greatly hoped.
115 ^ Declináte a me, malìgni, et scrutábor mandáta Dei mei. ^ Depart from me, ye malignant, and I will search the commandments of my God.
116 ^ Sùscipe me secùndum elóqụium tuum, et vivam, et non confùndas me ab expectațióne mea. ^ Uphold me according to thy word, and I shall live, and let me not be confounded in my expectation.
117 ^ Ádjuva me, et salvus èro, et meditábor in justificațiónibus tuîs sèmper. ^ Help me, and I shall be saved, and I will meditate always on thy justifications.
118 ^ Sprevìsti òmnes discedèntes ab judìciîs tuîs, qụia injústa coģitáțio eórum. ^ Thou hast despised all them that fall off from thy judgments, for their thought is unjust.
119 ^ Praĕvaricántes reputávi òmnes peccatóres terraĕ~; ìdeo diléxi testimónia tua. ^ I have accounted all the sinners of the earth prevaricators, therefore have I loved thy testimonies.
120 ^ Confíģe timóre tuo carnes meas~; ab judìciîs ènim tuîs tìmui. ^ Pierce thou my flesh with thy fear, for I am afraid of thy judgments.
121 ^ Feci judìcium et justìțiam~; non tradas me calumniántibus me. ^ I have done judgment and justice~; give me not up to them that slander me.
122 ^ Sùscipe servum tuum in bonum~; non calumnièntur me supèrbi. ^ Uphold thy servant unto good~; let not the proud calumniate me.
123 ^ Òculi mei defecérunt in salutáre tuum, et in elóqụium justìțiaĕ tuaĕ. ^ My eyes have fainted after thy salvation, and for the word of thy justice.
124 ^ Fac cum servo tuo secùndum misericórdiam tuam, et justificațiónes tuas dòce me. ^ Deal with thy servant according to thy mercy, and teach me thy justifications.
125 ^ Servus tuus sum ego~; da mìchi intelléctum, ut sciam testimónia tua. ^ I am thy servant~; give me understanding that I may know thy testimonies.
126 ^ Tempus facièndi, Dòmine~; dissipavérunt leģem tuam. ^ It is time, O Lord, to act~; they have dissipated thy law.
127 ^ Ìdeo diléxi mandáta tua super aŭrum et topasiòntem. ^ Therefore have I loved thy commandments above gold and the topaz.
128 ^ Proptèrea ad òmnia mandáta tua diriģébar~; òmnem viam iníqụam ódio hábui. ^ Therefore was I directed to all thy commandments~; I regarded with hated all wicked ways.
129 ^ Mirabìlia testimónia tua~; ìdeo scrutáta est ea ánima mea. ^ Thy testimonies are wonderful~; therefore my soul hath sought them.
130 ^ Declaráțio sermónum tuórum illúminat, et intelléctum dat párvulîs. ^ The declaration of thy words giveth light, and giveth understanding to little ones.
131 ^ Os meum apèrui, et attráxi spíritum, qụia mandáta tua desiderábam. ^ I opened my mouth, and drew breath, because I longed for thy commandments.
132 ^ Áspice in me, et miserére mei, secùndum judìcium diliģèntium nomen tuum. ^ Look thou upon me, and have mercy on me, according to the judgment of them that love thy name.
133 ^ Gressûs meos díriģe secùndum elóqụium tuum, et non dominétur mei òmnis injustìția. ^ Direct my steps according to thy word, and let no iniquity have dominion over me.
134 ^ Rèdime me a calùmniîs hòminum, ut custódiam mandáta tua. ^ Redeem me from the calumnies of men, that I may keep thy commandments.
135 ^ Fáciem tuam illúmina super servum tuum, et dòce me justificațiónes tuas. ^ Make thy face to shine upon thy servant, and teach me thy justifications.
136 ^ Èxitûs aqụárum deduxérunt òculi mei, qụia non custodivérunt leģem tuam. ^ My eyes have sent forth springs of water, because they have not kept thy law.
137 ^ Justus es Dòmine, et rectum judìcium tuum. ^ Thou art just, O Lord, and thy judgment is right.
138 ^ Mandavìsti justìțiam testimónia tua, et veritátem tuam nìmis. ^ Thou hast commanded justice thy testimonies, and thy truth exceedingly.
139 ^ Tabéscere me fecit zelus meus, qụia oblíti sunt vèrba tua inimíci mei. ^ My zeal hath made me pine away, because my enemies forgot thy words.
140 ^ Ignítum elóqụium tuum vehemènter, et sèrvus tuus diléxit illud. ^ Thy word is exceedingly refined, and thy servant hath loved it.
141 ^ Adolescèntulus sum ego et contèmptus~; justificațiónes tuas non sum oblítus. ^ I am very young and despised~; thy justifications I did not forget.
142 ^ Justìția tua justìția in aĕtèrnum, et lex tua vèritas. ^ Thy justice is justice for ever, and thy law is the truth.
143 ^ Tribuláțio et angùstia invenérunt me~; mandáta tua meditáțio mea est. ^ Trouble and anguish have found me~; thy commandments are my meditation.
144 ^ Áĕqụitas testimónia tua in aĕtèrnum~; intelléctum da mìchi, et vivam. ^ Thy testimonies are justice for ever~; give me understanding, and I shall live.
145 ^ Clamávi in toto corde meo, exáŭdi me, Dòmine~; justificațiónes tuas reqụírem. ^ I cried with my whole heart, hear me, O Lord~; I will seek thy justifications.
146 ^ Clamávi ad te~; salvum me fac, ut custódiam mandáta tua. ^ I cried unto thee~; save me, that I may keep thy commandments.
147 ^ Praĕvéni in maturitáte, et clamávi, qụia in vèrba tua supersperávi. ^ I prevented the dawning of the day, and cried, because in thy words I very much hoped.
148 ^ Praĕvenérunt òculi mei ad te dilúculo, ut meditárer elóqụia tua. ^ My eyes to thee have prevented the morning, that I might meditate on thy words.
149 ^ Vocem meam aŭdi secùndum misericórdiam tuam Dòmine, et secùndum judìcium tuum vivìfica me. ^ Hear thou my voice, O Lord, according to thy mercy, and quicken me according to thy judgment.
150 ^ Appropinqụavérunt perseqụèntes me iniqụitáti, a leģe aŭtem tua longe facti sunt. ^ They that persecute me have drawn nigh to iniquity, but they are gone far off from thy law.
151 ^ Prope es tu Dòmine, et òmnes viaĕ tuaĕ vèritas. ^ Thou art near, O Lord, and all thy ways are truth.
152 ^ Inìțio cognóvi de testimóniîs tuîs, qụia in aĕtèrnum fundavìsti ea. ^ I have known from the beginning concerning thy testimonies, that thou hast founded them for ever.
153 ^ Vède humilitátem meam, et éripe me, qụia leģem tuam non sum oblítus. ^ See my humiliation, and deliver me, for I have not forgotten thy law.
154 ^ Júdica judìcium meum, et rèdime me~; pròpter elóqụium tuum vivìfica me. ^ Judge my judgment, and redeem me~; quicken thou me for thy word's sake.
155 ^ Longe a peccatóribus salûs, qụia justificațiónes tuas non exqụisivérunt. ^ Salvation is far from sinners, because they have not sought thy justifications.
156 ^ Misericórdiaĕ tuaĕ mùltaĕ, Dòmine~; secùndum judìcium tuum vivìfica me. ^ Many, O Lord, are thy mercies~; quicken me according to thy judgment.
157 ^ Mùlti qụi perseqụùntur me, et trìbulant me~; a testimóniîs tuîs non declinávi. ^ Many are they that persecute me and afflict me~; from thy testimonies I have not declined.
158 ^ Vîdi praĕvaricántes et tabescébam, qụia elóqụia tua non custodivérunt. ^ I beheld the transgressors, and pined away, because they kept not thy word.
159 ^ Vède qụóniam mandáta tua diléxi, Dòmine~; in misericórdia tua vivìfica me. ^ Behold I have loved thy commandments, O Lord~; quicken me thou in thy mercy.
160 ^ princìpium verbórum tuórum vèritas~; in aĕtèrnum òmnia judìcia justìțiaĕ tuaĕ. ^ The beginning of thy words is truth~; all the judgments of thy justice are for ever.
161 ^ príncipes persecúti sunt me gratîs, et a vèrbîs tuîs formidávit cor meum. ^ Princes have persecuted me without cause, and my heart hath been in awe of thy words.
162 ^ Laĕtábor ego super elóqụia tua, sicut qụi invénit spólia mùlta. ^ I will rejoice at thy words, as one that hath found great spoil.
163 ^ iniqụitátem ódio hábui, et abominátus sum~; leģem aŭtem tuam diléxi. ^ Iniquity I regarded with hated, and I abhorred~; thy law however I have loved.
