1 ^ Levāvī oculōs meōs in montēs, unde veniet auxilium mihī. ^ I have lifted up my eyes to the mountains, from whence help shall come to me.
2 ^ Auxilium meum ā Dominō, quī fēcit caelum et terram. ^ My help is from the Lord, who made heaven and earth.
3 ^ Non det in commōtiōnem pedem tuum, neque dormītet quī custōdit tē. ^ May he not suffer thy foot to be moved, neither let him slumber that keepeth thee.
4 ^ Ecce non dormītābit neque dormiet quī custōdit Isrāhēlem. ^ Behold he shall neither slumber nor sleep that keepeth Israel.
5 ^ Dominus custōdit tē, Dominus prōtectiō tua super manum dexteram tuam. ^ The Lord is thy keeper, the Lord is thy protection upon thy right hand.
6 ^ Per diem sōl non ūret tē, neque lūna per noctem. ^ The sun shall not burn thee by day, nor the moon by night.
7 ^ Dominus custōdit tē ab omnī malō~; custōdiat animam tuam Dominus. ^ The Lord keepeth thee from all evil~; may the Lord keep thy soul.
8 ^ Dominus custōdiat introitum tuum, et exitum tuum, ex hōc nunc, et usque in saeculum. ^ May the Lord keep thy coming in and thy going out, from henceforth now and for ever.
