1 ^ Levávi òculos meos in montes, unde vèniet aŭxìlium mìhi. ^ I have lifted up my eyes to the mountains, from whence help shall come to me.
2 ^ Aŭxìlium meum a Dòmino, qŭi fecit caĕlum et terram. ^ My help is from the Lord, who made heaven and earth.
3 ^ Non det in commotiónem pèdem tuum, nèqŭe dormítet qŭi custódit te. ^ May he not suffer thy foot to be moved, neither let him slumber that keepeth thee.
4 ^ Ecce non dormitábit nèqŭe dórmiet qŭi custódit Israhélem. ^ Behold he shall neither slumber nor sleep that keepeth Israel.
5 ^ Dòminus custódit te, Dòminus protèctio tua super manum dèxteram tuam. ^ The Lord is thy keeper, the Lord is thy protection upon thy right hand.
6 ^ Per diem sol non uret te, nèqŭe luna per noctem. ^ The sun shall not burn thee by day, nor the moon by night.
7 ^ Dòminus custódit te ab omni malo~; custódiat ánimam tuam Dòminus. ^ The Lord keepeth thee from all evil~; may the Lord keep thy soul.
8 ^ Dòminus custódiat intróitum tuum, et èxitum tuum, ex hoc nunc, et usqŭe in sáĕculum. ^ May the Lord keep thy coming in and thy going out, from henceforth now and for ever.
