1 ^ Laĕtátus sum in hîs qụaĕ dicta sunt mìchi, «~In domum Dòmini íbimus.~»
2 ^ Stantes èrant pèdes nostri in átriîs tuîs, Jerúsalim. 
3 ^ Jerúsalim, qụaĕ aĕdificátur ut cívitas, cujus participáțio ejus in idìpsum. 
4 ^ Illûc ènim ascensérunt trìbûs, trìbûs Dòmini, testimónium Israhélis, ad confitèndum nómini Dòmini. 
5 ^ Qụia illic sêdérunt sedes in judìcio, sedes super domum Davídis. 
6 ^ Rogáte qụaĕ ad pacem sunt Jerusalímis, et abundánția diliģèntibus te. 
7 ^ Fiat pax in virtúte tua, et abundánția in tùrribus tuîs. 
8 ^ Pròpter fratres meos et pròximos meos, loqụébar pacem de te. 
9 ^ Pròpter domum Dòmini Dei nostri, qụaĕsívi bona tìbi. 
