1 ^ Laetátus sum in hîs qụae dicta sunt mìchi, «~In domum Dòmini íbimus.~»
2 ^ Stantes èrant pèdes nostri in átriîs tuîs, Jerúsalim. 
3 ^ Jerúsalim, qụae aedificátur ut cívitas, cujus participáṭio ejus in idìpsum. 
4 ^ Illûc ènim ascensérunt trìbûs, trìbûs Dòmini, testimónium Israhélis, ad confitèndum nómini Dòmini. 
5 ^ Qụia illic sêdérunt sedes in judìcio, sedes super domum Davídis. 
6 ^ Rogáte qụae ad pacem sunt Jerusalímis, et abundánṭia diliǧèntibus te. 
7 ^ Fiat pax in virtúte tua, et abundánṭia in tùrribus tuîs. 
8 ^ Pròpter fratres meos et pròximos meos, loqụébar pacem de te. 
9 ^ Pròpter domum Dòmini Dei nostri, qụaesívi bona tìbi. 
