1 ^ Saepe expugnāvērunt mē ā juventūte meā, dīcat nunc Isrāel. ^ Often have they fought against me from my youth, let Israel now say.
2 ^ Saepe expugnāvērunt mē ā juventūte meā~; etenim nōn potuērunt mihī. ^ Often have they fought against me from my youth, but they could not prevail over me.
3 ^ Suprā dorsum meum fabricāvērunt peccātōrēs~; prolongāvērunt inīquitātem suam. ^ The wicked have wrought upon my back~; they have lengthened their iniquity.
4 ^ Dominus jūstus concīdit cervīcēs peccātōrum. ^ The Lord who is just will cut the necks of sinners.
5 ^ Confundantur et convertantur retrorsum omnēs quī ōdērunt Siōnem. ^ Let them all be confounded and turned back that hate Sion.
6 ^ Fīant sīcut foenum tectōrum, quod priusquam ēvellātur exāruit, ^ Let them be as grass upon the tops of houses, which withereth before it be plucked up,
7 ^ dē quō nōn implēvit manum suam quī metit, et sinum suum quī manipulōs colligit. ^ who with the mower filleth not his hand, nor he that gathereth sheaves his bosom.
8 ^ Et nōn dixērunt quī praeterībant, «~Benedictiō Dominī super vōs~; benediximus vōbīs in nōmine Dominī.~»^ And they that passed by have not said, "The blessing of the Lord be upon you~; we have blessed you in the name of the Lord."
