1 ^ Memènto, Dòmine, Davídis et òmnis mansuetúdinis ejus, 
2 ^ sicut jurávit Dòmino~; votum vovit Deo Jacóbis, 
3 ^ «~Si introívero in tabernáculum domûs meae, si ascèndero in lettum strati mei, 
4 ^ si dèdero sòmnum òculîs meîs, et pálpebrîs meîs dormitatiónem, 
5 ^ et rèqviem tempóribus meîs, donec invèniam locum Dòmino, tabernáculum Deo Jacóbis.~»
6 ^ Ecce audívimus eam in Efráta~; invénimus eam in campîs silvae. 
7 ^ Introíbimus in tabernáculum ejus~; adorábimus in loco, ubi stetérunt pèdes ejus. 
8 ^ Sùrǧe Dòmine in rèqviem tuam, tu et arca sanctificatiónis tuae. 
9 ^ Sacerdótes tui induántur justìṭiam, et sancti tui exsùltent. 
10 ^ Pròpter Davídem servum tuum, non avèrtas fáciem christi tui. 
11 ^ Jurávit Dòminus Davídi veritátem, et non frustrábitur eam, «~De fructu vèntris tui ponem super sedem tuam. 
12 ^ Si custodíverint fílii tui testamèntum meum, et testimónia mea haec qvae docébo eos, et fílii eórum usqve in sáeculum sědébunt super sedem tuam.~»
13 ^ Qvóniam eléǧit Dòminus Siónem~; eléǧit eam in habitatiónem sìbi. 
14 ^ Haec rèqvies mea in sáeculum sáeculi~; hic habitábo, qvóniam eléǧi eam. 
15 ^ Vìduam ejus benedícens benedícem~; páuperes ejus saturábo pánibus. 
16 ^ Sacerdótes ejus ìnduem salutári, et sancti ejus exsultatióne exsultábunt. 
17 ^ Illûc prodúcem cornu Davídi~; parávi lucèrnam christo meo. 
18 ^ Inimícos ejus ìnduem confușióne~; super ìpsum autem efflorébit sanctificáṭio mea. 
