1 ^ Memènto, Dòmine, Davídis et òmnis mansuetúdinis ejus, 
2 ^ sicut jurávit Dòmino~; votum vovit Deo Jacóbi, 
3 ^ «~Si introívero in tabernáculum domüs meae, si asčèndero in lèctum strati mei, 
4 ^ si dèdero sòmnum òculïs meïs, et pálpebrïs meïs dormitațiónem, 
5 ^ et rèquiem tempóribus meïs, donec invèniam locum Dòmino, tabernáculum Deo Jacóbi.~»
6 ^ Ecče audívimus eam in Ephráta~; invénimus eam in campïs sỳlvae. 
7 ^ Introíbimus in tabernáculum ejus~; adorábimus in loco, ubi stetérunt pèdes ejus. 
8 ^ Sùrge Dòmine in rèquiem tuam, tu et arca sanctificațiónis tuae. 
9 ^ Sačerdótes tui induàntur justìțiam, et sancti tui exsùltent. 
10 ^ Pròpter Davídem servum tuum, non avèrtas fàčiem christi tui. 
11 ^ Jurávit Dòminus Davídi veritátem, et non frustrábitur eam, «~De fructu vèntris tui ponem super sedem tuam. 
12 ^ Si custodíverint fílii tui testamèntum meum, et testimónia mea haec quae dočébo eos, et fílii eórum usque in sáeculum sědébunt super sedem tuam.~»
13 ^ Quóniam elégit Dòminus Siónem~; elégit eam in habitațiónem sìbi. 
14 ^ Haec rèquies mea in sáeculum sáeculi~; hic habitábo, quóniam elégi eam. 
15 ^ Vìduam ejus benedícens benedícem~; páuperes ejus saturábo pánibus. 
16 ^ Sačerdótes ejus ìnduem salutári, et sancti ejus exsultațióne exsultábunt. 
17 ^ Illüc prodúcem cornu Davídi~; parávi lučèrnam christo meo. 
18 ^ Inimícos ejus ìnduem confusióne~; super ìpsum autem efflorébit sanctificázio mea. 
