1 ^ Super flúmina Babylónis, illic sédimus et flévimus quum recordarémur Siónem. 
2 ^ In salìçibus in mèdio ejus suspèndimus órgana nostra, 
3 ^ quia illic interrogavérunt nos qui captívos duxérunt nos vèrba canziónum, et qui abduxérunt nos hỳmnum, «~Cantáte nobïs de cànticïs Siónis.~»
4 ^ ¿~Quómodo cantábimus cànticum Dòmini in terra aliéna~? 
5 ^ Si oblítus fúero tui, Jerosólima, oblivióni detur dèxtera mea. 
6 ^ Adháereat lìngüa mea fáuçibus meïs, si non memìnero tui~; si non proposúero Jerosólima in prínçipio laetìziae meae. 
7 ^ Mèmor èsto, Dòmine filiórum Edómis in die Jerosólimae, qui dicunt, «~Exinaníte, exinaníte usque ad fundamèntum in ea.~»
8 ^ Fília Babylónis mìsera~; beátus qui retrìbuet tìbi retribuziónem tuam, quam retribuìsti nobïs. 
9 ^ Beátus qui tenébit et allídet párvulos tuos ad pètram. 
