1 ^ Super flúmina Babilónis, illic sédimus et flévimus qvum recordarémur Siónem. 
2 ^ In salìcibus in mèdio ejus suspèndimus órgana nostra, 
3 ^ qvia illic interrogavérunt nos qvi captívos duxérunt nos vèrba canziónum, et qvi abduxérunt nos hìmnum, «~Cantáte nobîs de cánticîs Siónis.~»
4 ^ ¿~Qvómodo cantábimus cánticum Dòmini in terra aliéna~? 
5 ^ Si oblítus fúero tui, Jerosólima, oblivióni detur dèxtera mea. 
6 ^ Adháereat lìngva mea fáucibus meîs, si non memìnero tui~; si non proposúero Jerosólima in príncipio laetìziae meae. 
7 ^ Mèmor èsto, Dòmine filiórum Edómis in die Jerosólimae, qvi dicunt, «~Exinaníte, exinaníte usqve ad fundamèntum in ea.~»
8 ^ Fília Babilónis mìsera~; beátus qvi retrìbuet tìbi retribüziónem tuam, qvam retribüìsti nobîs. 
9 ^ Beátus qvi tenébit et allídet párvulos tuos ad pètram. 
