1 ^ Super flúmina Babilónis, illic sédimus et flévimus qŭum recordarémur Siónem. ^ Upon the rivers of Babylon, there we sat and wept when we remembered Sion.
2 ^ In salìcibus in mèdio ejus suspèndimus órgana nostra, ^ On the willows in the midst thereof we hung up our instruments,
3 ^ qŭia illic interrogavérunt nos qŭi captívos duxérunt nos vèrba canțiónum, et qŭi abduxérunt nos hìmnum, «~Cantáte nobîs de cánticîs Siónis.~»^ for there they who led us captive asked us words of songs, and they that carried us away a hymn, "Sing ye to us of the songs of Sion."
4 ^ ¿~Qŭómodo cantábimus cánticum Dòmini in terra aliéna~? ^ How shall we sing the song of the Lord in a strange land~?
5 ^ Si oblítus fúero tui, Jerúsalim, oblivióni detur dèxtera mea. ^ If I forget thee, O Jerusalem, let my right hand be forgotten.
6 ^ Adháĕreat lingŭa mea fáŭcibus meîs, si non memìnero tui~; si non proposúero Jerúsalim in príncipio laĕtìțiaĕ meaĕ. ^ Let my tongue cleave to my jaws, if I do not remember thee~; if I make not Jerusalem the beginning of my joy.
7 ^ Mèmor èsto, Dòmine filiórum Edómis in die Jerusalímis, qŭi dicunt, «~Exinaníte, exinaníte usqŭe ad fundamèntum in ea.~»^ Remember, O Lord, the children of Edom in the day of Jerusalem, who say, "Rase it, rase it, even to the foundation thereof."
8 ^ Fília Babilónis mìsera~; beátus qŭi retrìbuet tìbi retribuțiónem tuam, qŭam retribuìsti nobîs. ^ O miserable daughter of Babylon~; blessed shall he be who shall repay thee thy payment which thou hast paid us.
9 ^ Beátus qŭi tenébit et allídet párvulos tuos ad pètram. ^ Blessed be he that shall take and dash thy little ones against the rock.
