1 ^ Dòmine probavìsti me, et cognovìsti me. 
2 ^ tu cognovìsti sessiónem meam et resurrecçiónem meam~; intellexìsti coǧitaçiónes meas de longe. 
3 ^ Sémitam meam et funìculum meum investigavìsti, et òmnes vias meas praevidìsti, 
4 ^ qvia non est sermo in lìngva mea. 
5 ^ Ecce, Dòmine, tu cognovìsti òmnia, novìssima et antíqva~; tu formavìsti me, et posuìsti super me manum tuam. 
6 ^ Mirábilis facta est sciènṭia tua ex me~; confortáta est, et non pótero ad eam. 
7 ^ ¿~Qvo ibo a spíritu tuo, et qvo a fáçie tua fúǧiem~? 
8 ^ Si ascènsero in caelum, tu illic es~; si descènsero in infèrnum, ades. 
9 ^ Si sùmpsero pennas meas dilúculo, et habitávero in extrémîs maris, 
10 ^ ètenim illûc manus tua dedúcet me, et tenébit me dèxtera tua. 
11 ^ Et dixi, «~Fórsitan tènebrae conculcábunt me, et nòx illumináṭio mea in delìciîs meîs~», 
12 ^ qvia tènebrae non obscurabùntur a te, et nòx sicut dies illuminábitur~; sicut tènebrae ejus, ita et lumen ejus. 
13 ^ Qvia tu possedìsti renes meos~; suscepìsti me de útero matris meae. 
14 ^ Confitébor tìbi, qvia terribìliter magnificátus es~; mirabìlia ópera tua, et ánima mea cognóscit nìmis. 
15 ^ Non est occultátum òssu meum a te, qvod fecìsti in occùlto, et substánṭia mea in inferióribus terrae. 
16 ^ Imperfèctum meum vîdérunt òculi tui, et in lìbro tuo òmnes scribèntur~; dies formabùntur, et nemo in eîs. 
17 ^ Mìhi autem nìmis honorificáti sunt amíci tui, Deus~; nìmis confortátus est principátûs eórum. 
18 ^ Dinumerábo eos, et super arénam multiplicábuntur~; exsurréxi, et adhûc sum tecum. 
19 ^ Si occáeserîs peccatóres, Deus~; vìri sángvinum, declináte a me, 
20 ^ qvia dícitis in coǧitaçióne, «~Accìpient in vanitáte civitátes tuas.~»
21 ^ ¿~Nonne qvi odérunt te, Dòmine, óderam, et super inimícos tuos tabescébam~? 
22 ^ Perfècto ódio óderam illos, et inimíci facti sunt mìchi. 
23 ^ Proba me, Deus, et scito cor meum~; intèrroga me, et cognósce sémitas meas. 
24 ^ Et vède si via iniqvitátis in me est, et dedúce me in via aetèrna. 
