1 ^ Dòmine probavìsti me, et cognovìsti me. ^ Lord, thou hast proved me, and known me.
2 ^ tu cognovìsti sessiónem meam et resurrecțiónem meam~; intellexìsti coģitațiónes meas de longe. ^ Thou hast known my sitting down and my rising up~; thou hast understood my thoughts afar off.
3 ^ Sémitam meam et funìculum meum investigavìsti, et òmnes vias meas praĕvidìsti, ^ My path and my line thou hast searched out, and thou hast foreseen all my ways,
4 ^ qŭia non est sermo in lingŭa mea. ^ for there is no speech in my tongue.
5 ^ Ecce, Dòmine, tu cognovìsti òmnia, novìssima et antíqŭa~; tu formavìsti me, et posuìsti super me manum tuam. ^ Behold, O Lord, thou hast known all things, the last and those of old~; thou hast formed me, and hast laid thy hand upon me.
6 ^ Mirábilis facta est sciènția tua ex me~; confortáta est, et non pótero ad eam. ^ Thy knowledge is become wonderful to me~; it is high, and I cannot reach to it.
7 ^ ¿~Quo ibo a spíritu tuo, et qŭo a fáçie tua fúģiem~? ^ Whither shall I go from thy spirit, or whither shall I flee from thy face~?
8 ^ Si ascènsero in caĕlum, tu illic es~; si descènsero in infèrnum, ades. ^ If I ascend into heaven, thou art there~; if I descend into the depths, thou art present.
9 ^ Si sùmpsero pennas meas dilúculo, et habitávero in extrémîs maris, ^ If I take my wings early in the morning, and dwell in the uttermost parts of the sea,
10 ^ ètenim illûc manus tua dedúcet me, et tenébit me dèxtera tua. ^ even there also shall thy hand lead me, and thy right hand shall hold me.
11 ^ Et dixi, «~Fórsitan tènebraĕ conculcábunt me, et nòx illumináțio mea in delìciîs meîs~», ^ And I said, "Perhaps darkness shall cover me, and night shall be my light in my pleasures,"
12 ^ qŭia tènebraĕ non obscurabùntur a te, et nòx sicut dies illuminábitur~; sicut tènebraĕ ejus, ita et lumen ejus. ^ but darkness shall not be dark to thee, and night shall be light all the day~; for just as its darkness is, so also is its light.
13 ^ Qŭia tu possedìsti renes meos~; suscepìsti me de útero matris meaĕ. ^ For thou hast possessed my reins~; thou hast protected me from my mother's womb.
14 ^ Confitébor tìbi, qŭia terribìliter magnificátus es~; mirabìlia ópera tua, et ánima mea cognóscit nìmis. ^ I will praise thee, for thou art fearfully magnified~; wonderful are thy works, and my soul knoweth right well.
15 ^ Non est occultátum òssu meum a te, qŭod fecìsti in occùlto, et substánția mea in inferióribus terraĕ. ^ My bone is not hidden from thee, which thou hast made in secret, and my substance in the lower parts of the earth.
16 ^ Imperfèctum meum vîdérunt òculi tui, et in lìbro tuo òmnes scribèntur~; dies formabùntur, et nemo in eîs. ^ Thy eyes did see my imperfect being, and in thy book all shall be written~; days shall be formed, and no one in them.
17 ^ Mìhi aŭtem nìmis honorificáti sunt amíci tui, Deus~; nìmis confortátus est principátûs eórum. ^ But to me thy friends are made exceedingly honourable, O God~; their principality is exceedingly strengthened.
18 ^ Dinumerábo eos, et super arénam multiplicábuntur~; exsurréxi, et adhûc sum tecum. ^ I will number them, and they shall be multiplied above the sand~; I rose up, and am still with thee.
19 ^ Si occáĕserîs peccatóres, Deus~; vìri sángŭinum, declináte a me, ^ If thou shouldst kill the wicked, O God~; ye men of blood, depart from me,
20 ^ qŭia dícitis in coģitațióne, «~Accìpient in vanitáte civitátes tuas.~»^ because you say in thought, "They shall receive thy cities in vain."
21 ^ ¿~Nonne qŭi odérunt te, Dòmine, óderam, et super inimícos tuos tabescébam~? ^ Have I not hated them, O Lord, that hated thee, and pined away because of thy enemies~?
22 ^ Perfècto ódio óderam illos, et inimíci facti sunt mìchi. ^ I have hated them with a perfect hatred, and they are become enemies to me.
23 ^ Proba me, Deus, et scito cor meum~; intèrroga me, et cognósce sémitas meas. ^ Prove me, O God, and know my heart~; examine me, and know my paths.
24 ^ Et vède si via iniqŭitátis in me est, et dedúce me in via aĕtèrna. ^ And see whether the way of iniquity is in me, and lead me in the eternal way.
