2 ^ Éripe me Dòmine ab hòmine màlo~; a vìro iníquo éripe me. 
3 ^ Qui coǧitavérunt iniquitátes in corde~; tota die constituébant práelia. 
4 ^ Acuvérunt lìngüas suas sicut serpèntis~; venénum àspidum sub lábiïs eórum. 
5 ^ Custódi me, Dòmine, de mànu peccatóris, et ab homìnibus iníquïs éripe me, qui coǧitavérunt supplàntare gressüs meos. 
6 ^ Absconduérunt supèrbi làqueum mìhi, et funes extendérunt in làqueum~; juxta ìter scándalum posuérunt mìhi. 
7 ^ Dixi Dòmino, «~Deus meus es tu~; exáudi, Dòmine, vočem deprecațiónis meae.~»
8 ^ Dòmine, Dòmine, vìrtüs salútis meae, obumbravìsti super caput meum in die belli. 
9 ^ Ne tradas me, Dòmine, a desidèrio meo peccatóri~; coǧitavérunt còntra me~; ne derelìnquas me, ne forte exaltèntur. 
10 ^ Caput čircùmitüs eórum~; labor labiórum ipsórum opèriet eos. 
11 ^ Cadent super eos carbónes~; in ìgnem dejìčies eos~; in misèriïs non subsìstent. 
12 ^ Vìr lingüósus non dirigétur in terra~; vìrum injústum màla cápient in intèritu. 
13 ^ Cognóvi quia fàčiet Dòminus judìčium ìnopis, et vindìctam páuperum. 
14 ^ Verùmtamen justi confitebùntur nómini tuo, et habitábunt recti cum vùltu tuo. 
