2 ^ Éripe me Dòmine ab hòmine malo~; a vìro iníqụo éripe me. 
3 ^ Qụi coģitavérunt iniqụitátes in corde~; tota die constituébant práĕlia. 
4 ^ Acuvérunt lìngụas suas sicut serpèntis~; venénum áspidum sub lábiîs eórum. 
5 ^ Custódi me, Dòmine, de manu peccatóris, et ab homìnibus iníqụîs éripe me, qụi coģitavérunt supplántare gressûs meos. 
6 ^ Absconduérunt supèrbi láqụeum mìchi, et funes extendérunt in láqụeum~; juxta ìter scándalum posuérunt mìchi. 
7 ^ Dixi Dòmino, «~Deus meus es tu~; exáŭdi, Dòmine, vocem deprecațiónis meaĕ.~»
8 ^ Dòmine, Dòmine, vìrtûs salútis meaĕ, obumbravìsti super caput meum in die belli. 
9 ^ Ne tradas me, Dòmine, a desidèrio meo peccatóri~; coģitavérunt contra me~; ne derelìnqụas me, ne forte exaltèntur. 
10 ^ Caput circùmitûs eórum~; labor labiórum ipsórum opèriet eos. 
11 ^ Cadent super eos carbónes~; in ìgnem dejìcies eos~; in misèriîs non subsìstent. 
12 ^ Vìr lingụósus non diriģétur in terra~; vìrum injústum mala cápient in intèritu. 
13 ^ Cognóvi qụia fáçiet Dòminus judìcium ìnopis, et vindìctam páŭperum. 
14 ^ Verùmtamen justi confitebùntur nómini tuo, et habitábunt recti cum vùltu tuo. 
