2 ^ Éripe me Dòmine ab hòmine malo~; a vìro iníqŭo éripe me. ^ Deliver me, O Lord, from the evil man~; rescue me from the unjust man.
3 ^ Qŭi coģitavérunt iniqŭitátes in corde~; tota die constituébant práĕlia. ^ Who have devised iniquities in their hearts~; all the day long they designed battles.
4 ^ Acuvérunt lingŭas suas sicut serpèntis~; venénum áspidum sub lábiîs eórum. ^ They have sharpened their tongues like a serpent~; the venom of asps is under their lips.
5 ^ Custódi me, Dòmine, de manu peccatóris, et ab homìnibus iníqŭîs éripe me, qŭi coģitavérunt supplántare gressûs meos. ^ Keep me, O Lord, from the hand of the wicked, and from unjust men deliver me, who have proposed to supplant my steps.
6 ^ Absconduérunt supèrbi láqŭeum mìchi, et funes extendérunt in láqŭeum~; juxta ìter scándalum posuérunt mìchi. ^ The proud have hidden a net for me, and they have stretched out cords for a snare~; they have laid for me a stumblingblock by the wayside.
7 ^ Dixi Dòmino, «~Deus meus es tu~; exáŭdi, Dòmine, vocem deprecațiónis meaĕ.~»^ I said to the Lord, "Thou art my God~; hear, O Lord, the voice of my supplication."
8 ^ Dòmine, Dòmine, vìrtûs salútis meaĕ, obumbravìsti super caput meum in die belli. ^ O Lord, Lord, the strength of my salvation, thou hast overshadowed my head in the day of battle.
9 ^ Ne tradas me, Dòmine, a desidèrio meo peccatóri~; coģitavérunt contra me~; ne derelìnqŭas me, ne forte exaltèntur. ^ Give me not up, O Lord, from my desire to the wicked~; they have plotted against me~; do not thou forsake me, lest they should triumph.
10 ^ Caput circùmitûs eórum~; labor labiórum ipsórum opèriet eos. ^ The head of their encompassing~; the labour of their lips shall overwhelm them.
11 ^ Cadent super eos carbónes~; in ìgnem dejìcies eos~; in misèriîs non subsìstent. ^ Burning coals shall fall upon them~; thou wilt cast them down into the fire~; in miseries they shall not be able to stand.
12 ^ Vìr lingŭósus non diriģétur in terra~; vìrum injústum mala cápient in intèritu. ^ A man full of tongue shall not be established in the earth~; evil shall catch the unjust man unto destruction.
13 ^ Cognóvi qŭia fáciet Dòminus judìcium ìnopis, et vindìctam páŭperum. ^ I know that the Lord will establish the justice of the needy, and the revenge of the poor.
14 ^ Verùmtamen justi confitebùntur nómini tuo, et habitábunt recti cum vùltu tuo. ^ But as for the just, they shall give glory to thy name, and the upright shall dwell with thy countenance.
