2 ^ Voce mea ad Dòminum clamávi, voce mea ad Dòminum deprecátus sum. ^ I cried to the Lord with my voice~; with my voice I made supplication to the Lord.
3 ^ Effùndo in conspèctu ejus deprecațiónem meam, et tribulațiónem meam ante ìpsum pronúnțio. ^ In his sight I pour out my supplication, and before him I declare my trouble.
4 ^ In deficièndo ex me spíritum meum, et tu cognovìsti sémitas meas. In via hac qŭa ambulábam absconduérunt láqŭeum mìhi. ^ When my spirit failed me, then thou knewest my paths. In this way wherein I walked, they have hidden a snare for me.
5 ^ Considerábam ad dèxteram, et vedébam, et non èrat qŭi cognósceret me. Perívit fuǧéla a me, et non est qŭi reqŭírat ánimam meam. ^ I looked on my right hand, and beheld, and there was no one that would know me. Flight hath failed me, and there is no one that hath regard to my soul.
6 ^ Clamávi ad te, Dòmine~; dixi, «~Tu es spes mea, pórțio mea in terra vivèntium.~»^ I cried to thee, O Lord~; I said, "Thou art my hope, my portion in the land of the living."
7 ^ Intènde ad deprecațiónem meam, qŭia humiliátus sum nìmis. Líbera me a perseqŭèntibus me, qŭia confortáti sunt super me. ^ Attend to my supplication, for I am brought very low. Deliver me from my persecutors, for they are stronger than I.
8 ^ Edúce de custódia ánimam meam ad confitèndum nómini tuo~; me expèctant justi donec retrìbuas mìhi. ^ Bring my soul out of prison, that I may praise thy name~; the just wait for me, until thou reward me.
