1 ^ Dòmine exáŭdi orațiónem meam~; áŭribus pèrcipe obsecrațiónem meam in veritáte tua~; exáŭdi me in tua justìția. 
2 ^ Et non intres in judìcium cum servo tuo, qụia non justificábitur in conspèctu tuo òmnis vívens. 
3 ^ Qụia persecútus est inimícus ánimam meam~; humiliávit in terra vitam meam. Collocávit me in obscúrîs sicut mórtuos sáĕculi. 
4 ^ Et anxiátus est super me spíritus meus~; in me turbátum est cor meum. 
5 ^ Mèmor fui diérum antiqụórum~; meditátus sum in òmnibus opèribus tuîs~; in factîs mánuum tuárum meditábar. 
6 ^ Expándi manûs meas ad te~; ánima mea sicut terra sine aqụa tìbi. 
7 ^ Velóciter exáŭdi me, Dòmine, defécit spíritus meus. Non avèrtas fáçiem tuam a me, et sìmilis èro descendèntibus in lacum. 
8 ^ Aŭdítam fac mìchi mane misericórdiam tuam, qụia in te sperávi. Notam fac mìchi viam in qụa ámbulem, qụia ad te levávi ánimam meam. 
9 ^ Éripe me de inimícîs meîs, Dòmine, ad te confúģi. 
10 ^ Dòce me fácere voluntátem tuam, qụia Deus meus es tu. Spíritus tuus bonus dedúcet me in terram rectam. 
11 ^ Pròpter nomen tuum, Dòmine, vivificábis me. In aĕqụitáte tua edúces de tribulațióne ánimam meam, 
12 ^ et in misericórdia tua dispèrdes inimícos meos, et pèrdes òmnes qụi trìbulant ánimam meam, qụóniam ego sèrvus tuus sum. 
