1 ^ Lauda, ánima mea, Dòminum. 
2 ^ Laudábo Dòminum in vita mea~; psallem Deo meo qụámdiu fúero. 
3 ^ Nolíte confídere in princìpibus, in fíliîs hòminum, in qụìbus non est salûs. 
4 ^ Exíbit spíritus ejus, et revertétur in terram suam~; in illa die períbunt òmnes coģitaṭiónes eórum. 
5 ^ Beátus cujus Deus Jacóbis adjútor ejus, spes ejus in Dòmino Deo ìpsius, 
6 ^ qụi fecit caelum et terram, mare, et òmnia qụae in eîs sunt~; qụi custódit veritátem in sáeculum, 
7 ^ façit judìcium injúriam paṭièntibus, dat escam esurièntibus. Dòminus solvit compedítos~; 
8 ^ Dòminus illúminat caecos~; Dòminus ériģit elísos~; Dòminus díliģit justos. 
9 ^ Dòminus custódit ádvenas~; pupìllum et vìduam suscìpiet, et vias peccatórum dispèrdet. 
10 ^ Regnábit Dòminus in sáecula~; Deus tuus, Sion, in ģeneraṭiónem et ģeneraṭiónem. 
