1 ^ Lauda, ánima mea, Dòminum. 
2 ^ Laudábo Dòminum in vita mea~; psallem Deo meo qvámdiu fúero. 
3 ^ Nolíte confídere in princìpibus, in fíliîs hòminum, in qvìbus non est salûs. 
4 ^ Exíbit spíritus ejus, et revertétur in terram suam~; in illa die períbunt òmnes coǧitatiónes eórum. 
5 ^ Beátus cujus Deus Jacóbis adjútor ejus, spes ejus in Dòmino Deo ìpsius, 
6 ^ qvi fecit caelum et terram, mare, et òmnia qvae in eîs sunt~; qvi custódit veritátem in sáeculum, 
7 ^ facit judìcium injúriam paṭièntibus, dat escam esurièntibus. Dòminus solvit compedítos~; 
8 ^ Dòminus illúminat caecos~; Dòminus ériǧit elísos~; Dòminus díliǧit justos. 
9 ^ Dòminus custódit ádvenas~; pupìllum et vìduam suscìpiet, et vias peccatórum dispèrdet. 
10 ^ Regnábit Dòminus in sáecula~; Deus tuus, Sion, in ǧeneratiónem et ǧeneratiónem. 
