1 ^ Laudāte Dominum, quoniam bonus est psalmus~; Deō nostrō sit jūcunda, decōraque laudātiō. ^ Praise ye the Lord, because psalm is good~; to our God be joyful and comely praise.
2 ^ Aedificans Jerūsalim Dominus~; dispersiōnēs Isrāhēlis congregābit. ^ The Lord buildeth up Jerusalem~; he will gather together the dispersed of Israel.
3 ^ Quī sānat contrītōs corde, et alligat contrītiōnēs eōrum. ^ Who healeth the broken of heart, and bindeth up their bruises.
4 ^ Quī numerat multitūdinem stellārum, et omnibus eīs nōmina vocat. ^ Who telleth the number of the stars, and calleth them all by their names.
5 ^ Magnus Dominus noster, et magna virtūs ejus, et sapientiae ejus nōn est numerus. ^ Great is our Lord, and great is his power, and of his wisdom there is no number.
6 ^ Suscipiens mansuētōs Dominus~; humilians autem peccātōrēs usque ad terram. ^ The Lord lifteth up the meek~; the wicked however he bringeth down unto the ground.
7 ^ Praecinite Dominō in confessiōne~; psallite Deō nostrō in cittarā. ^ Sing ye to the Lord with praise~; sing to our God upon the harp.
8 ^ Quī operit caelum nūbibus, et parat terrae pluviam~; quī prōdūcit in montibus foenum, et herbam servitūtī hominum~; ^ Who covereth the heaven with clouds, and provideth rain to the earth~; who maketh grass to grow on the mountains, and herbs for the service of men~;
9 ^ quī dat jūmentīs ēscam ipsōrum, et pullīs corvōrum invocantibus eum. ^ who giveth to beasts their food, and to the young ravens that call upon him.
10 ^ Nōn in fortitūdine equī voluntātem habēbit, nec in tībiīs virī benēplacitum erit eī. ^ He shall not delight in the strength of the horse, nor take pleasure in the legs of a man.
11 ^ Benēplacitum est Dominō super timentēs eum, et in eīs quī spērant super misericordiā ejus. ^ The Lord taketh pleasure in them that fear him, and in them that hope in his mercy.
