1 ^ Laŭda, Jerúsalim, Dòminum~; laŭda Deum tuum, Sion. 
2 ^ Qụóniam confortávit sèras portárum tuárum~; benedíxit fíliîs tuîs in te. 
3 ^ Qụi pósuit fines tuos pacem, et ádipe frumènti sáțiat te. 
4 ^ Qụi emìttit elóqụium suum terraĕ~; velóciter currit sermo ejus. 
5 ^ Qụi dat nivem sicut lanam~; nèbulam sicut cìnerem spargit. 
6 ^ Mittit cristállum suum sicut buccèllas~; ¿~ante fáçiem fríģoris ejus qụìs sustinébit~? 
7 ^ Emìttet vèrbum suum, et liqụefáciet ea~; flabit spíritus ejus, et fluent aqụaĕ. 
8 ^ Qụi adnúnțiat vèrbum suum Jacóbi~; justìțias et judìcia sua Israhéli. 
9 ^ Non fecit táliter òmni națióni, et judìcia sua non manifestávit eîs. 
