1 ^ Laŭda, Jerúsalim, Dòminum~; laŭda Deum tuum, Sion. ^ Praise the Lord, O Jerusalem~; praise thy God, O Sion.
2 ^ Qŭóniam confortávit sèras portárum tuárum~; benedíxit fíliîs tuîs in te. ^ Because he hath strengthened the bolts of thy gates, he hath blessed thy children within thee.
3 ^ Qŭi pósuit fines tuos pacem, et ádipe frumènti sátiat te. ^ Who hath placed peace in thy borders, and filleth thee with the fat of corn.
4 ^ Qŭi emìttit elóqŭium suum terraĕ~; velóciter currit sermo ejus. ^ Who sendeth forth his speech to the earth~; his word runneth swiftly.
5 ^ Qŭi dat nivem sicut lanam~; nèbulam sicut cìnerem spargit. ^ Who giveth snow like wool~; scattereth mists like ashes.
6 ^ Mittit cristállum suum sicut buccèllas~; ¿~ante fáciem frígoris ejus qŭìs sustinébit~? ^ He sendeth his crystal like morsels~; who shall stand before the face of his cold~?
7 ^ Emìttet vèrbum suum, et liqŭefáciet ea~; flabit spíritus ejus, et fluent aqŭaĕ. ^ He shall send out his word, and shall melt them~; his wind shall blow, and the waters shall run.
8 ^ Qŭi adnúntiat vèrbum suum Jacóbi~; justìtias et judìcia sua Israhéli. ^ Who declareth his word to Jacob~; his justices and his judgments to Israel.
9 ^ Non fecit táliter òmni natióni, et judìcia sua non manifestávit eîs. ^ He hath not done in like manner to every nation, and his judgments he hath not made manifest to them.
