1 ^ Cantáte Dòmino cànticum novum~; laus ejus in ecclésia sanctórum. 
2 ^ Laetétur Ìsrahel in eo qui fečit eum, et fílii Siónis exsùltent in reǧe suo. 
3 ^ Laudent nomen ejus in choro~; in tỳmpano et psaltério psallant ei. 
4 ^ Quia benepláčitum est Dòmino in pòpulo suo, et exaltábit mansuétos in salútem. 
5 ^ Exsultábunt sancti in glória~; laetabùntur in cubílibus suïs. 
6 ^ Exaltaziónes Dei in gùtture eórum, et glàdii ančìpites in mànibus eórum~; 
7 ^ ad fačièndam vindìctam in naziónibus, increpaziónes in pòpulïs~; 
8 ^ ad alligándos reǧes eórum in compèdibus, et nóbiles eórum in mànicïs fèrreïs~; 
9 ^ ut fàčiant in eïs judìčium conscríptum~; glória haec est òmnibus sanctïs ejus. Allelúja. 
