1 ^ Cantáte Dòmino cánticum novum~; laus ejus in ecclésia sanctórum. 
2 ^ Laetétur Isráhel in eo qvi feçit eum, et fílii Siónis exsùltent in rege suo. 
3 ^ Laudent nomen ejus in choro~; in tìmpano et psaltério psallant ei. 
4 ^ Qvia beneplácitum est Dòmino in pòpulo suo, et exaltábit mansuétos in salútem. 
5 ^ Exsultábunt sancti in glória~; laetabùntur in cubílibus suîs. 
6 ^ Exaltaziónes Dei in gùtture eórum, et gládii ancìpites in mánibus eórum~; 
7 ^ ad facièndam vindìctam in naziónibus, increpaziónes in pòpulîs~; 
8 ^ ad alligándos reges eórum in compèdibus, et nóbiles eórum in mánicîs fèrreîs~; 
9 ^ ut fáçiant in eîs judìcium conscríptum~; glória haec est òmnibus sanctîs ejus. Allelúja. 
